Title,Author_count,subtype,Subject_area_count,Cite_count
Public health and international epidemiology for radiology,2,ch,1,1
Flexible Printed Active Antenna for Digital Television Reception,2,cp,2,1
Parametric study of hydrogen production via sorption enhanced steam methane reforming in a circulating fluidized bed riser,4,ar,3,21
Superhydrophobic coating from fluoroalkylsilane modified natural rubber encapsulated SiO 2 composites for self-driven oil/water separation,8,ar,5,37
Electrochemical impedance-based DNA sensor using pyrrolidinyl peptide nucleic acids for tuberculosis detection,6,ar,4,68
Evaluation of outsourcing transportation contract using simulation and design of experiment Ocena kontraktów outsourcingowych w transporcie z wykorzystaniem symulacji i projektu eksperymentu,1,ar,3,15
The phenotypic and mutational spectrum of Thai female patients with ornithine transcarbamylase deficiency,6,ar,1,13
External beam radiotherapy in the treatment of painful bone metastases,3,ch,1,0
Predicting judicial decisions of criminal cases from Thai supreme court using bi-directional gru with attention mechanism,3,cp,5,24
PH Variation as a Simple and Selective Pathway for Obtaining Nanoparticle or Nanocapsule Polysaccharides,2,ar,5,3
Effect of Zr addition on the microstructure and tribological property of the anodization of Ti-6Al-4V alloy,5,ar,5,17
Applying Text Mining for Classifying Disease from Symptoms,2,cp,6,4
Classification of advertisement text on Facebook using synthetic minority over-sampling technique,3,cp,4,0
Detecting Radio AGN Signatures in Red Geysers,22,ar,2,16
Organic agriculture education in Thai Universities: National trends and student perceptions,2,cp,2,1
"A new species of Ceropegia (Asclepiadoideae, Apocynaceae) from eastern Thailand",1,ar,2,6
Observation of Weakened V-V Dimers in the Monoclinic Metallic Phase of Strained VO2,9,ar,1,13
Heterostructured d-Ti 3 C 2 /TiO 2/ g-C 3 N 4 Nanocomposites with Enhanced Visible-Light Photocatalytic Hydrogen Production Activity,5,ar,4,105
Performance comparison of different cavitation reactors for biodiesel production via transesterification of palm oil,6,ar,5,30
"The dynamic linkage among the size, growth and profitability of listed companies in the ASEAN-4 countries",3,ar,6,0
Different natures of sub-gap states in 135-CIGS/112-CIGS and 112-CIGS/135-CIGS heterostructures investigated by photoluminescence technique,3,cp,1,1
Optical properties of CsI:Tl crystals grown using different precursors purities,3,cp,1,2
CIGS thin film solar cells with graded-band gap fabricated by CIS/CGS bilayer and CGS/CIS/CGS trilayer systems,4,cp,1,5
Machine Learning system mimicking student's choice in Particle Data Analysis laboratory activity,4,cp,1,0
Effects of global and local rewiring on SIS epidemic adaptive networks,2,cp,1,1
Glucose sensing characterization of non-enzymatic nickel film and nickel foam electrodes in sodium hydroxide solution,8,cp,1,3
Shielding the Earth Magnetic Field using Spherical Coils,3,cp,1,1
EMF Shielding of One Set of Circular Coils with Slight Distortion,5,cp,1,0
Evaluation of Thai students and teacher's attitudes in physics using Colorado Learning Attitudes about Science Survey (CLASS),3,cp,1,3
Cosmic-Ray Muons Detection by a Spark Chamber,3,cp,1,0
3D Information Retrieving of Concealing Surface beneath Opaque Resin Layer by Fast-Fourier Low Coherence Interferometer,3,cp,1,0
Mass-radius bounds in massive gravity models,2,cp,1,1
Identification of Pinocembrin as an Anti-Glycation Agent and α-Glucosidase Inhibitor from Fingerroot (Boesenbergia rotunda): The tentative structure–activity relationship towards Mg-trapping activity,5,ar,7,24
Graceful exit for the cosmological constant damping scenario,2,ar,1,7
Structural and transport phenomena of urocanate-based proton carrier in sulfonated poly(ether ether ketone) membrane composite,7,ar,4,4
Simulation of control characteristics of liquid column vibration absorber using a quasi-elliptic flow path estimation method,4,ar,1,3
"Corrigendum to “Effects of salt on the LLE and tie-line data for furfuryl alcohol - n-butanol-water at T = 298.15 K” [J. Mol. Liq. 218 (2016) 50–58] (Effects of salt on the LLE and tie-line data for furfuryl alcohol — n-butanol–water at T=298.15K (2016) 218 (50–58), (S0167732215309028) (10.1016/j.molliq.2016.02.027))",6,er,6,1
Bacillus sp. strain M10 as a potential biocontrol agent protecting chili pepper and tomato fruits from anthracnose disease caused by Colletotrichum capsici,4,ar,2,16
Finding impact factors for rejection of pull requests on GitHub,2,cp,4,3
Performance analysis of machine learning techniques in intrusion detection,2,cp,4,4
Observation of Medium-Induced Modifications of Jet Fragmentation in Pb-Pb Collisions at sNN =5.02 TeV Using Isolated Photon-Tagged Jets,2283,ar,1,39
The ideal commensurate value of Sc and the superconducting phase under high pressure,7,ar,1,19
A mini review on antidiabetic properties of fermented foods,4,re,2,35
Search for Leptoquarks Coupled to Third-Generation Quarks in Proton-Proton Collisions at s =13 TeV,2303,ar,1,51
WS2 and C-TiO2 Nanorods Acting as Effective Charge Separators on g-C3N4 to Boost Visible-Light Activated Hydrogen Production from Seawater,5,ar,4,64
Physics-based motion capture imitation with deep reinforcement learning,5,cp,3,41
Design of output feedback nonlinear model predictive control for inverted pendulum on cART,3,cp,4,0
Explicit Formula for Conditional Expectations of Product of Polynomial and Exponential Function of Affine Transform of Extended Cox-Ingersoll-Ross Process,3,cp,1,12
Two Properties of Pseudo-Polynomials over a Galois Field,4,cp,1,0
Basic fibroblast growth factor regulates phosphate/pyrophosphate regulatory genes in stem cells isolated from human exfoliated deciduous teeth,5,ar,4,27
Deep learning using risk-reward function for stock market prediction,2,cp,4,8
Chest X-ray analysis of tuberculosis by convolutional neural networks with affine transforms,2,cp,4,10
Creative industries policy in Thailand: A story of rise and demise,1,ch,1,6
Effect of modified Khon dance performance on functional fitness in older Thai persons,4,ar,2,3
Social return on investment for community-based alcohol consumption control program during Buddhist Lent,3,ar,2,1
"Medication adherence and associated factors among elderly hypertension patients with uncontrolled blood pressure in rural area, Northeast Thailand",4,ar,2,20
The effects of toothpaste amounts and post-brushing rinsing methods on salivary fluoride retention,5,ar,2,4
Complete genomic sequences of highly pathogenic H5N1 avian influenza viruses obtained directly from human autopsy specimens,7,ar,3,3
Downstream components of the calmodulin signaling pathway in the rice salt stress response revealed by transcriptome profiling and target identification,5,ar,1,54
"Deep multispectral painting reproduction via multi-layer, custom-ink printing",8,cp,4,15
Carbonized briquettes as a tool for adding value to waste from rain tree (Samanea saman) and coffee ground/tea waste,3,ar,1,8
Periodic-review policy for a 2-Echelon inventory problem with seasonal demand,2,ar,1,4
Reference stress approach for fracture assessment of extrados circumferential through-wall crack between elbow and pipe under internal pressure,2,ar,1,0
Atmospheric water estimation using GNSS precise point positioning method,2,ar,1,3
Development of arbuscular mycorrhizal fungi-organic fertilizer pellets encapsulated with alginate film,5,ar,1,7
Cross-sectoral analysis of water usage in Thailand using input–output model,4,ar,1,7
Speculation of nano-gap sensor for DNA sequencing technology: A review on synthetic nanopores,1,re,1,4
Peat Endogenous Lignocellulolytic Bacteria for Humic Waste Decomposition,3,cp,1,1
Relationships between causal factors affecting future carbon dioxide output from Thailand's transportation sector under the government's sustainability policy: Expanding the SEM-VECM model,2,ar,2,2
Mechanochemical-assisted heterogeneous surface modification of parawood microcrystalline cellulose and its effect on the properties of polypropylene composites,2,ar,5,1
Sequential Fractionation of Palm Empty Fruit Bunch and Microwave-Assisted Depolymerization of Lignin for Producing Monophenolic Compounds,8,ar,4,24
Enhancement of Hydrogen Evolution Reaction Performance of Graphitic Carbon Nitride with Incorporated Nickel Boride,4,ar,4,39
Hemostatic efficacy of sheep-derived fibrin glue for liver biopsy in swine,4,ar,1,0
"Plasmid profile of Enterococcus faecium and Enterococcus faecalis isolated from pigs, pork and humans in Thai-Laos border provinces",3,ar,1,0
Ophthalmology Snapshot,1,no,1,0
ECG Quiz,2,no,1,0
Computed tomographic contrast enhancement and tumor angiogenesis in canine oral tumors,3,ar,1,0
Efficacy of different vaccination programs of recombinant HVT-NDV vaccine against genotype VII NDV Challenge in broiler chickens,4,ar,1,1
Emergence of a classical variant of porcine epidemic diarrhea virus novel to Thailand responsible for the milder clinical disease in a herd previously infected with a pandemic variant,5,ar,1,1
Comparative ultrasonographic and computed tomographic images of the adrenal glands of healthy cats,3,ar,1,1
"A preliminary study on diversity of midgut microbiota in Aedes aegypti (Linnaeus) and Culex quinquefasciatus (Say) collected from Bangkok, Thailand",7,ar,1,2
Concomitant mycotic abdominal aortic aneurysm and lumbar tuberculous spondylitis with cauda equina syndrome: a rare condition — a case report and literature review,7,ar,2,6
Predicting the present revisited: The case of Thailand,2,ar,3,0
Survival time and prognosis factors in hypertrophic cardiomyopathy cats with congestive heart failure,5,ar,1,2
"The potential use of phytoestrogen containing the herb, Pueraria mirifica, for bone healing in osteoporotic monkeys",4,ar,1,2
Dynamic symmetry breaking in sat using augmented clauses with a polynomial-time lexicographic pruning,2,cp,3,2
Approximation of positive integer in double-base number system with a single term,2,cp,3,0
"Machine learning methods for abnormality detection in hard disk drive assembly process: Bi-LSTM, Wavelet-CNN and SVM",2,cp,3,1
ALMA twenty-six arcmin2 survey of GOODS-S at one millimeter (ASAGAO): Source catalog and number counts,32,re,2,17
Message from General Chairs,3,ed,5,0
Railway network modeling using building block of timed coloured petri nets,3,cp,2,2
Refactoring orchestrated web services into microservices using decomposition pattern,2,cp,2,5
Skin Barrier Function and Atopic Dermatitis,4,re,1,11
Corundum with spinel corona from the Tan Huongtruc Lau area in Northern Vietnam,6,ar,1,2
Effect of food additives on the quality of white shrimp (Litopenaeus vannamei),2,ar,1,2
High infection rate of Zika virus in mosquitoes collected from an area of active Zika virus transmission in eastern Thailand,11,ar,1,5
Antimicrobial and weed inhibitory activities of Senna spectabilis extracts against plant pathogens,2,ar,1,2
D-minimal expansions of the real field have the zero set property,2,ar,2,5
Current progress in production of flavonoids using systems and synthetic biology platforms,8,ar,1,10
Mucuna pruriens seed extract promotes neurite outgrowth via ten-4 dependent and independent mechanisms in Neuro2a cells,4,ar,1,3
A study into perioperative anaesthetic adverse events in Thailand (PAAd THAI): An analysis of suspected emergence delirium,6,ar,3,0
Effect of emg biofeedback to improve hand function in children with cerebral palsy: A randomized controlled trial,1,ar,1,1
Lipschitz retractions onto sphere vs spherical cup in a hilbert space,3,ar,2,0
Mechanisms of carbapenem resistance in Acinetobacter pittii and Acinetobacter nosocomialis isolates from Thailand,2,ar,2,10
Domain rearrangement and denaturation in Ebola virus protein VP40,6,ar,1,7
Amyloidosis associated with long-standing enterobacter endocarditis in a dog,4,cp,1,1
A New tocopherol derivative and cytotoxicity from the leaves of dalbergia velutina,5,ar,4,3
Effecting factors of the mechanical properties of Thai Dendrocalamus gigantues bamboo,3,ar,4,4
"Role of acute kidney injury biomarkers to guide renal replacement therapy initiation, what we learn from EARLY-RRT trial and FST trial?",5,le,1,0
Determining the amphipol distribution within membrane-protein fibre samples using small-angle neutron scattering,3,ar,1,1
Angular analysis of the decay B+ →k+μ+μ- in proton-proton collisions at s =8 TeV,2300,ar,1,27
Search for pair-produced resonances decaying to quark pairs in proton-proton collisions at s =13 TeV,2297,ar,1,34
Long-term effectiveness of omalizumab treatment in Thai severe asthmatic patients: A real-life experience,16,ar,2,6
Randomized comparison of caregivers' ability to use epinephrine autoinjectors and prefilled syringes for anaphylaxis,3,ar,2,8
Effects of aerobic exercise and vitamin C supplementation on rhinitis symptoms in allergic rhinitis patients,4,ar,2,11
First episode of preschool wheeze requiring hospitalization:a prospective study on the chance of recurrence and associated factors,3,ar,2,1
"Differential dendritic cell responses to cell wall mannan of Candida albicans, Candida parapsilosis, and Candida dubliniensis",3,ar,1,6
Common viral infections in kidney transplant recipients,4,re,2,52
Event shape variables measured using multijet final states in proton-proton collisions at √s=13 TeV,2305,ar,1,19
A nonrelativistic limit for AdS perturbations,3,ar,1,16
Melittin induced G1 cell cycle arrest and apoptosis in Chago-K1 human bronchogenic carcinoma cells and inhibited the differentiation of THP-1 cells into tumour- associated macrophages,6,ar,4,23
Alteration of urinary neutrophil gelatinase–associated lipocalin as a predictor of tacrolimus-induced chronic renal allograft fibrosis in tacrolimus dose adjustments following kidney transplantation,7,ar,1,1
Rapid and sensitive detection of Chlamydia trachomatis sexually transmitted infections in resource-constrained settings in Thailand at the point-of-care,7,ar,2,17
The utilization of the surviving sepsis campaign care bundles in the treatment of pediatric patients with severe sepsis or septic shock in a resource-limited environment: A prospective multicenter trial,7,ar,1,7
"Real-life clinical pattern, management, and survival in Thai patients with early-stage or metastatic triple-negative breast cancer",12,ar,1,5
A robust intracellular metabolite extraction protocol for human neutrophil metabolic profiling,4,ar,1,12
Role of mucoprotective agents in endoscopic submucosal dissection-derived ulcers: A systematic review,3,re,2,5
GOODS-ALMA: 1.1 mm galaxy survey: I. Source catalog and optically dark galaxies,39,ar,2,121
Complete genome analysis demonstrates multiple introductions of enterovirus 71 and coxsackievirus A16 recombinant strains into Thailand during the past decade,10,ar,7,19
Two-state co-expression network analysis to identify genes related to salt tolerance in Thai rice,7,ar,2,9
The [CII] emission as a molecular gas mass tracer in galaxies at low and high redshifts,22,ar,2,113
Rice overexpressing OsNUC1-s reveals differential gene expression leading to yield loss reduction after salt stress at the booting stage,6,ar,7,12
How might normative and mimetic pressures improve local government service performance reporting?,2,ar,3,8
"The new 4th edition World Health Organization classification for thyroid tumors, Asian perspectives",6,ar,1,54
The coexistence of Cushing syndrome and gynecomastia as the manifestations of adrenocortical carcinoma,4,le,1,2
Genetic diversity and relationships among Lyle's flying fox colonies in Thailand,8,ar,1,2
Improving Thai word and sentence segmentation using linguistic knowledge,4,ar,5,11
Baseline atrial fibrillation is associated with contrast-induced nephropathy after cardiac catheterization in coronary artery disease: Systemic review and meta-analysis,6,re,1,5
Extraction of Trend Keywords and stop words from Thai Facebook pages using character n-Grams,2,ar,3,9
Numerical data on the shear stress distribution generated by a rotating rod within a stationary ring over a 35-mm cell culture dish,5,dp,1,5
Adjunctive Use of Cidofovir and Intravenous Immunoglobulin to Treat Invasive Adenoviral Disease in Solid Organ Transplant Recipients,3,ar,1,7
"Two regulators, PA3898 and PA2100, modulate the pseudomonas aeruginosa multidrug resistance MexAB-OprM and EmrAB efflux pumps and biofilm formation",7,ar,3,20
Low-density lipoprotein cholesterol target attainment in patients with stable or acute coronary heart disease in the Asia-Pacific region: results from the Dyslipidemia International Study II,14,ar,2,25
"Data analysis of the U–Pb geochronology and Lu–Hf system in zircon and whole-rock Sr, Sm–Nd and Pb isotopic systems for the granitoids of Thailand",13,dp,1,5
Cell wall mannan of Candida krusei mediates dendritic cell apoptosis and orchestrates Th17 polarization via TLR-2/MyD88-dependent pathway,8,ar,1,17
Relations between cardinalities of the finite sequences and the finite subsets of a set,2,ar,1,1
AFOMP policy number 6: code of ethics for medical physicists in AFOMP Countries,10,re,4,0
New application of dynamic magnetic resonance imaging for the assessment of deglutitive tongue movement,7,ar,1,3
The Effect of a Brief HIV Prevention Program on Risk Reduction Behaviors Among Thai Men Diagnosed With Sexually Transmitted Infections,3,ar,1,2
Impact of AlCl3 and FeCl2 Addition on Catalytic Behaviors of TiCl4/MgCl2/THF Catalysts for Ethylene Polymerization and Ethylene/1-Hexene Copolymerization,3,ar,2,4
Vonoprazan versus proton-pump inhibitors for gastric endoscopic submucosal dissection-induced ulcers: A systematic review and meta-analysis,3,re,2,16
Cardol triene inhibits dengue infectivity by targeting kl loops and preventing envelope fusion,7,ar,1,11
The metal kiln with heat distribution pipes for high quality charcoal and wood vinegar production,3,ar,3,16
"Major depression model induced by repeated and intermittent lipopolysaccharide administration: Long-lasting behavioral, neuroimmune and neuroprogressive alterations",14,ar,2,40
"Metal accumulation in the marine bivalve, Marcia optima collected from the coastal area of Phuket Bay, Thailand",3,ar,3,6
Incorporation of 13 C-HCO 3 − by ammonia-oxidizing archaea and bacteria during ammonia oxidation of sludge from a municipal wastewater treatment plant,6,ar,2,7
Effects of varying soil and atmospheric water deficit on water use characteristics of tropical street tree species,2,ar,3,2
"The benefits of angiotensin-converting enzyme inhibitors/angiotensin II receptor blockers combined with calcium channel blockers on metabolic, renal, and cardiovascular outcomes in hypertensive patients: a meta-analysis",6,ar,2,6
Comparison between digital image analysis and visual assessment of immunohistochemical HER2 expression in breast cancer,4,ar,2,20
Chitosan-based nanoparticles with damnacanthal suppress CRM1 expression,9,ar,2,5
Evaluation of Plasmodium vivax isolates in Thailand using polymorphic markers Plasmodium merozoite surface protein (PvMSP) 1 and PvMSP3,5,ar,4,7
Detection of host pathways universally inhibited after Plasmodium yoelii infection for immune intervention,11,ar,1,12
Classification of unusual insertion of the pectoralis minor muscle,7,ar,4,10
Scaling laws for static displacement of linearly elastic cracked beam by energy method,2,ar,4,13
Data in support of photosynthetic responses in a chromosome segment substitution line of ‘Khao Dawk Mali 105’ rice at seedling stage,8,dp,1,5
"Inflammatory reaction, clinical efficacy, and safety of bacterial cellulose wound dressing containing silk sericin and polyhexamethylene biguanide for wound treatment",5,ar,1,34
Caring for Thai Older Persons With Long-Term Care Needs,3,ar,3,19
Facilitated transport of cadmium with montmorillonite KSF colloids under different pH conditions in water-saturated sand columns: Experiment and transport modeling,2,ar,6,63
"Adaptive effect of sericin on hepatic mitochondrial conformation through its regulation of apoptosis, autophagy and energy maintenance: a proteomics approach",4,ar,1,13
Discharge Performance of Zinc-Air Flow Batteries Under the Effects of Sodium Dodecyl Sulfate and Pluronic F-127,6,ar,1,74
Influence of anisotropic properties on vertical vibrations of circular foundation on saturated elastic layer,2,ar,5,24
Generation and characterization of hepatocellular carcinoma cell lines with enhanced cancer stem cell potential,11,ar,2,24
Evaluation of different pretreatments of Napier grass for enzymatic saccharification and ethanol production,5,ar,2,27
Biofuel production via the pyrolysis of sugarcane (Saccharum officinarum L.) leaves: Characterization of the optimal conditions,2,ar,4,17
Is the occiput-wall distance valid and reliable to determine the presence of thoracic hyperkyphosis?,8,ar,1,8
Optimization of process parameters using response surface methodology for Pd(II) extraction with quaternary ammonium salt from chloride medium: kinetic and thermodynamics study,5,ar,5,7
Loss of Gsα in osteocytes leads to osteopenia due to sclerostin induced suppression of osteoblast activity,7,ar,3,13
Intracatheter Antifungal Lock Leading to Detrimental Complications,5,ar,2,3
Optimization of exposure parameters in dental cone beam computed tomography using a 3-step approach,5,ar,5,16
Distinctive features of low-grade myofibroblastic sarcoma on aspiration cytology: A case report,2,ar,2,5
A randomized trial of low-dose gabapentin for post hospitalization relapse prevention in a Thai clinical sample of alcohol dependence,6,ar,2,10
Three-dimensional lower bound finite element limit analysis of Hoek-Brown material using semidefinite programming,2,ar,2,50
Clinical and functional studies of two novel variants in the LPL gene in subjects with severe hypertriglyceridemia,4,ar,3,1
Topical drug delivery to the posterior segment of the eye: The effect of benzalkonium chloride on topical dexamethasone penetration into the eye in vivo,6,ar,1,11
"Effect of pressure on the structure stability, electronic structure and band gap engineering in Zn16O1S15",7,ar,4,1
Co-overexpression of native phospholipid-biosynthetic genes plsX and plsC enhances lipid production in Synechocystis sp. PCC 6803,5,ar,1,18
Two host gut-derived lactic acid bacteria activate the proPO system and increase resistance to an AHPND-causing strain of Vibrio parahaemolyticus in the shrimp Litopenaeus vannamei,4,ar,2,45
Improved Survival of Elderly-fit Patients With Acute Myeloid Leukemia Requiring Intensive Therapy: 3-Year Multicenter Analysis From TALWG,16,ar,3,6
Changes of cardiac function in diabetic dogs,3,ar,2,1
Quinolone-resistant phenotype of Flavobacterium columnare isolates harbouring point mutations both in gyrA and parC but not in gyrB or parE,6,ar,4,7
Mechanistic aspect based on the role of reactive oxidizing species (ROS) in macroscopic level on the glycerol photooxidation over defected and defected-free TiO2,4,ar,3,21
The crucial role of density functional nonlocality and on-axis CH3NH3 rotation induced I2 formation in hybrid organic-inorganic CH3NH3PbI3 cubic perovskite,5,ar,1,12
High tissue eosinophilia as a marker to predict recurrence for eosinophilic chronic rhinosinusitis: a systematic review and meta-analysis,5,re,2,67
Constitutive equations for vertical upward two-phase flow in rod bundle,7,re,3,17
"Serological evidence of duck Tembusu virus infection in free-grazing ducks, Thailand",8,ar,2,11
Evaluation of dielectric cure monitoring for in situ measurement of natural rubber vulcanization,4,ar,3,4
A spectroscopic study of indigo dye in aqueous solution: A combined experimental and TD-DFT study,7,ar,5,4
"Permian–Triassic back-arc basin development in response to Paleo-Tethys subduction, Sa Kaeo–Chanthaburi area in Southeastern Thailand",9,ar,1,20
Ultrasound evaluation of arterial anastomosis of the forehead,8,ar,1,23
Factorizable non-atomic copulas,2,ar,2,1
Characterization of N-type and P-type Aluminum Antimonides on Si substrates for room-temperature optoelectronic devices,7,ar,4,4
Cortical Bone Loss in a Spontaneous Murine Model of Systemic Lupus Erythematosus,12,ar,3,5
Cytotoxicity against cancer cells of chitosan oligosaccharides prepared from chitosan powder degraded by electrical discharge plasma,5,ar,3,47
Inhibition of amyloid fibril formation in the variable domain of λ6 light chain mutant Wil caused by the interaction between its unfolded state and epigallocatechin-3-O-gallate,7,ar,3,5
Measurement of ballistic impact performance of fiber reinforced polybenzoxazine/polyurethane composites,3,ar,2,19
Development of a high throughput yeast-based screening assay for human carbonic anhydrase isozyme II inhibitors,3,ar,2,10
Nephrology nurses' perceptions of discussing sexual health issues with patients who have end-stage kidney disease,3,ar,2,8
Effects of decongestant addition to intranasal corticosteroid for chronic rhinitis: a systematic review and meta-analysis,5,re,2,14
Simultaneous assessment of various quality attributes and shelf life of packaged bratwurst using hyperspectral imaging,2,ar,1,28
Finite element modelling of flexural behaviour of geosynthetic cementitious composite mat (GCCM),4,ar,4,26
Chitosan/alginate nanoparticles as a promising approach for oral delivery of curcumin diglutaric acid for cancer treatment,5,ar,4,106
Ethanol as an electrolyte additive for alkaline zinc-air flow batteries,5,ar,1,68
Environmental risk factors and nonpharmacological and nonsurgical interventions for obesity: An umbrella review of meta-analyses of cohort studies and randomized controlled trials,13,re,2,47
A colorimetric paper-based analytical device coupled with hollow fiber membrane liquid phase microextraction (HF-LPME) for highly sensitive detection of hexavalent chromium in water samples,4,ar,1,67
Detection of Aujeszky's disease virus DNA and antibody in swine oral fluid specimens,6,ar,2,13
