Title,cover_date,authkey_word
Case Atlas and Illustrations: Colon,2020-01-01,"Colonic polyp, Colorectal polyp, IEE colorectal lesions, Lower GI IEE, NBI colonic polyp, NBI colorectal polyp, NBI polyp"
Handling of Specimen and Post-ESD Management Protocol,2020-01-01,"GI disease, Handle, Management, Post-ESD, Protocol, Specimen, Tissue"
A Review on the Technical and Economic Prospects of Biofuel Production from Integrated Biomass Gasification and Fischer-Tropsch Processes,2020-01-01,"Biomass gasification, Fischer-Tropsch synthesis, Tar removal, Technical and economic prospects, Transportation fuel"
Selection of Cost-Effective and Energy-Efficient Storages with Respect to Uncertain Nature of Renewable Energy Sources and Variations of Demands,2020-01-01,"Cost, Efficiency, Multi-generation systems, Renewable energy sources (RESs), Storage, Uncertainty"
"Participatory Comprehensive Planning of Amphawa District, Thailand",2020-01-01,"Amphawa district, Community participation, Comprehensive, planning"
Human Rabies Vaccines,2020-01-01,"CCV, Exposure, PEP, Potency, Rabies, Vaccines"
Rabbit induced pluripotent stem cells: The challenges,2020-01-01,"Animal model, Differentiation, Embryonic stem cells, Induced pluripotent stem cells, Rabbit"
Low-dose macrolides for treating pediatric rhinosinusitis: A retrospective study and literature review,2020-01-01,"chronic inflammation, macrolides, Pediatrics, rhinosinusitis, steroid"
Drug safety in Thailand,2020-01-01,"Drug safety, Health Product Vigilance Center, herbal medicines, medication abuse, medication disposal, medication error, medication misuse, medication storage, self-care, self-medication, Thai Vigibase, Thailand, traditional medicines"
Evaporite Deposits,2020-01-01,"Anhydrite, Basinwide, Cryogenic, Epeiric, Evaporite, Gypsum, Halite, Hydrohalite, Hydrothermal, Mirabilite, Platform, Solar heating"
"mHealth for Better Quality of Life, Healthier Lifestyles, and More Meaningful Lives",2020-01-01,"Climate change, Global burden of disease, Health system integration, Information and communication technology"
The Regulation of Unfair Terms and Consumer Protection in Thailand,2020-01-01,"Consumer contracts, Contracts, Exemption clause, Freedom of contract, Judicial power, Procedural unfairness, Standard terms, Thai law, Unfair term"
Electroactive fluoropolymers and polyamides,2020-01-01,"Electroactive polymers, Electrostriction, Ferroelectric polymers, Fluoropolymers, Maxwell effect, Piezoelectric, Polyamides"
Magnetic nanocarriers of bioactives: structural and delivery system designs,2020-01-01,"ferrite, ferrofluid, iron oxides, magnetic nanocomposites, SPIONs, Superparamagnetic"
Lymphatic filariasis,2020-01-01,"Aptamers, Drug targets, Lymphatic filariasis, Mass drug administration, Wolbachia"
Factors of Successful Women Leadership in Asian: Moderating Role of Political Differences and Organization Culture,2020-01-01,"Asian countries, Emotional intelligence, Learning autonomy, Organization culture, Political differences, Women leadership"
Distribution and significance of the 2004 Indian Ocean tsunami deposits: Initial results from Thailand and Sri Lanka,2020-01-01,"Indian ocean tsunami, Sri Lanka, Thailand, Tsunami, Tsunami deposits, Tsunamiites"
"Thickness and grain-size distribution of Indian Ocean tsunami deposits at Khao Lak and Phra Thong Island, South-Western Thailand",2020-01-01,"Grain size, Multiple-graded layers, Thailand, Thickness, Tsunami deposit"
Unraveling the mode of action of medicinal plants in delaying age-related diseases using model organisms,2020-01-01,"aging, medicinal plants, metabolites, model system"
Cancer nanomedicine,2020-01-01,"Bio-based nanoparticle, Drug delivery, Inorganic nanoparticle, Liposome, Nanomedicine, Targeting delivery"
Intensified processes of steam reforming and their materials for hydrogen production,2020-01-01,"Hydrogen production, Multifunctional material, Process intensification, Steam reforming"
Assistive technologies in Parkinson’s disease,2020-01-01,"Assistive device, Assistive technology, Laser-guided walking stick, Mobility aids, Parkinson’s disease, Walking frames, Walking stick"
Clitoria ternatea beverages and antioxidant usage,2020-01-01,"Antioxidant, Clitoria ternatea flower, Functional ingredient, Health benefits"
Tea (Camellia oleifera) Seeds: Use of Tea Seeds in Human Health,2020-01-01,"Biological activity, Camellia oleifera, Camellia tea seeds, Tea seed cake, Tea seed oil"
Teachers’ perception for integrating educational robots and use as teaching assistants in thai primary schools,2020-01-01,"Education robots, Emotional engagement, Learners’ behavior, Learning Management System (LMS), Teaching method"
Production of acetaldehyde via oxidative dehydrogenation of ethanol over AgLi/SiO2 catalysts,2020-01-01,"Acetaldehyde, Oxidative dehydrogenation of ethanol, Silica, Silver-lithium"
Induced pluripotent stem cells for the modeling of Bernard-Soulier syndrome,2020-01-01,"Bernard-Soulier syndrome, Bleeding disorders, ES-Sac, Giant platelet, Glycoprotein, Glycoprotein Ib-IX-V, Hereditary thrombocytopenia, Induced pluripotent stem cells, Macrothrombocytopenia, Megakaryocyte, Platelet adhesion, Platelet dysfunction, Platelets, Proplatelet formation, Thrombocytopenia"
Exploring the difference between implied volatilities of options embedded in convertible bonds and exchange-traded options and its contributing factors,2020-01-01,"convertible bond, embedded option, implied volatility"
Temporal lobe necrosis in head and neck cancer patients after proton therapy to the skull base,2020-01-01,"Head and neck cancer, Proton therapy, Temporal lobe necrosis, Toxicity"
Behavior of industrial building under seismic loading,2020-01-01,"Industrial factory, Nonlinear time history procedure, Reinforced concrete, Seismic behavior"
The optimal method for building damage fragility curve development,2020-01-01,"Building damage, Fragility curve, Optimal method, Risk assessment"
"Alternative measures of mutual fund performance: Ranking DFA, fidelity, and vanguard",2020-01-01,"Active versus passive investment, DFA, Fidelity, Vanguard"
Development of a risk score to predict abnormal glycemic status among Thai dental patients,2020-01-01,"Abnormal glycemic status, Dental patients, Risk score"
Aquaponics for resource recovery and organic food productions,2020-01-01,"Aquaculture, Aquaponics, Nitrogen, Nutrient recovery, Organic agriculture"
A comparison between peer-assisted learning and self-study for electrocardiography interpretation in Thai medical students,2020-01-01,"Electrocardiography, Peer group, Self-assessment"
Clam-shaped cyclam-functionalized porphyrin for electrochemical reduction of carbon dioxide,2020-01-01,"Carbon dioxide, CO2 reduction, Cyclam, Electrocatalyst, Porphyrin"
'impermanence': A translation of the first chapter of the tibetan udanavarga,2020-01-01,"Buddhist verse, Impermanence and death, Tibetan translation, Udanavarga"
Era of Industry 4.0 Technologies and Environmental Performance of Thailand’s Garment Industry: Role of Lean Manufacturing and Green Supply Chain Management Practices,2020-01-01,"Environmental performance, Garment industry, Green supply chain management practices, Industry 4.0 technologies, Lean manufacturing practices, Thailand"
A relational database management system for life-cycle cost analysis of bim projects,2020-01-01,"6D BIM, Building cost estimating, Construction data management, Multi-parametric model, Sustainable procurement"
Alamillo bridge: Construction simulation models in ezstrobe,2020-01-01,"Cable-stayed bridge, Calatrava, CYCLONE, Modeling, Statistics, STROBOSCOPE"
Communal After-Living: Asian Ghosts and the City,2020-01-01,"Apartments, Asia, Dystopia, Haunting, Urban Gothic"
Improvement The Properties Of Poly(L-Lactide) Films With Cellulose Fiber From Rice Straw Waste In Agricultural Products,2020-01-01,"Cellulose fiber, Poly(L-lactide), Rice straw"
Public health and research: an overview,2020-01-01,"Public health, Public health research, Research"
Production of a sophorolipid biosurfactant by Wickerhamomyces anomalus MUE24 and its use for modification of rice flour properties,2020-01-01,"Biosurfactant, Rice flour, Sophorolipid, Soybean oil, Wickerhamomyces anomalus"
Exploring the structure of volunteer activities in hospital settings using multidimensional scaling: A preliminary study,2020-01-01,"Hospital settings, Job analysis, Multidimensional scaling, Placement, Volunteers"
A review of skin banking guidelines and standards worldwide: Towards the harmonization of guidelines for skin banking in therapeutic applications for the regions under the asia pacific burn association (APBA),2020-01-01,"Skin allografts, Skin banking, Skin transplantation, Tissue banking, Tissue donation"
Clinical assessment of brachycephalic airway obstructive syndrome using questionnaire and 6-minute walk test in French Bulldogs,2020-01-01,"6-minute walk test, Brachycephalic airway obstructive syndrome, French Bulldog, Questionnaire"
"Leadership and Industry 4.0 As A Tool to Enhance Organization Performance: Direct and Indirect Role of Job Satisfaction, Competitive Advantage and Business Sustainability",2020-01-01,"Business sustainability, Competitive advantage, Industry 4.0, Job satisfaction, Leadership style, Organization performance"
"Social backgrounds, oral behaviors and dental service utilization among Thai older adults: data from the national oral health survey",2020-01-01,"Dental service utilization, National survey, Older adults, Oral behaviors, Social backgrounds, Thailand"
Collaborative cassava-chip supply chain mobile application in Thailand,2020-01-01,"Agriculture mobile application, Cassava-chip collaboration, Collaborative supply chain"
Glycerol valorization through production of di-glyceryl butyl ether with sulfonic acid functionalized KIT-6 catalyst,2020-01-01,"di-GNBEs, Etherification, Glycerol, SO3H-KIT-6 catalyst, Valuable fuel additive"
Do Remittances Increase Household Investment in Education? Evidence from Cambodia During and After the Global Financial Crisis,2020-01-01,"Cambodia, education, investment, pooled cross-section data, remittances"
R&D investment that enhances IT firm survival,2020-01-01,"Competitive risk mitigation, IT industry, R&D investment"
Opportunity in pandemic: Understand how customers look at your banner ads,2020-01-01,"Banner ads, First fixation duration, Fixation count, Time to first fixation, Total fixation duration"
Optimal INR level in elderly and non-elderly patients with atrial fibrillation receiving warfarin: A report from the COOL-AF nationwide registry in Thailand,2020-01-01,"Bleeding, Ischemic stroke, Non-valvular atrial fibrillation, Optimal international normalized ratio, Thailand, Warfarin"
thai university student travel behavior: an extension of theory of planned behavior,2020-01-01,"behavioral intention, theory of planned behavior, travel motivation, university student tourists"
Analysis of land use land coverage dynamics and its effects on rainfall-runoff and runoff-sediment patterns in yom river basin Thailand,2020-01-01,"Double mass curve, Land use dynamics, Rainfall-runoff, Runoff-sediment, Sediment load, Water balance"
Environmental impact of irrigation to groundwater contamination and aquifer vulnerability from intensive agricultural practices in Thailand,2020-01-01,"Agricultural contamination, Contaminant transport and migration, Groundwater contamination, Irrigation, MODFLOW, MT3D, Nitrate"
"Inequality, sociocultures and habitus in Thailand",2020-01-01,"Habitus, Social classes, Social inequality, Sociocultures, Thailand"
Children of internal migrants: Does moving with parent(s) affect schooling progression?,2020-01-01,"Cambodia, Internal migration, Left-behind children, Migrant children, Schooling progression"
Immunogenicity and safety of a quadrivalent meningococcal tetanus toxoid-conjugate vaccine (MenaCyW-TT) administered concomitantly with other paediatric vaccines in toddlers: A Phase III randomized study,2020-01-01,"Coadministration, MenACYW-TT, Paediatric vaccines, Toddlers"
Establishing an ocean acidification monitoring system for the tropical waters of Indonesia facing regional climate variability,2020-01-01,"Biogeochemistry, Carbonate system, Climate change, Monitoring, Ocean acidification"
The Effect of Surface Treatment on Shear Bond Strength of Resin Matrix Ceramics and Dual Cure Resin Cement,2020-01-01,"Resin matrix ceramic, Shear bond strength, Tetrahydrofuran"
Beneficial non-compliance with inadequate information systems,2020-01-01,"Beneficial non-compliance, Inadequate information systems, Workarounds"
An approach to YouTubers' children in Thailand. The case of minors as specialists in toys Una aproximación a los niños Youtubers tailandeses. El caso de los menores como prescriptores de juguetes,2020-01-01,"Advertising, Influencer, Minors, Regulation, Unboxing, Youtuber"
Kick-starting ovarian cyclicity by using dietary glucogenic precursors in post-partum dairy cows: a review,2020-01-01,"dairy cow, metabolism, Nutrition, ovarian function, reproduction"
The N-dimension computing machine postulate,2020-01-01,"Biological-like architecture, Data flow computers, Molecular computers, N-dimension computing, Turing machine"
Stroke screening feature selection for arm weakness using a mobile application,2020-01-01,"Arm weakness, Curl-up, FAST, Handcrafted features, Raise-up, Stroke screening"
Performance improvement of adaptive wavelet thresholding for speech enhancement using generalized Gaussian priors and frame-wise context modeling,2020-01-01,"Context modeling, Speech enhancement, Wavelet thresholding"
Framework for communication model encouraging innovation in thai small and medium family businesses,2020-01-01,"Communication Model, Family Business, Family Business Succession, Medium Business Enterprises, Organizational Innovation, Small"
Adsorption study of bovine serum albumin onto multiwalled carbon nanotubes,2020-01-01,"Adsorption controlled release, Bovine serum albumin, Carbon nanotubes, Modified surface"
Multiple biosurfactant production by aureobasidium pullulans strain ytp6-14 in aqueous and heavy oil layers,2020-01-01,"Aureobasidium pullulans, Biosurfactant, Exophilin, Heavy oil, Liamocin, Massoia lactone"
Developing Engaged Scholars Through Glocal Learning: A Case Study of the Thailand Global Citizenship and Civic Engagement Initiative,2020-01-01,"engaged scholarship, global citizenship, graduate education, international partnerships, sustainability"
Normativity in Buddhism and Its Application in Bioethics,2020-01-01,"Buddhism, Ethics, Euthanasia, Naturalism, Normativity"
Housing conditions and improvement guidelines for the elderly living in urban areas: Case studies of four Bangkok's districts,2020-01-01,"Elderly people, Housing condition, Living inside a dwelling, Urban area"
Quantifying real estate externalities: Evidence on the whole foods effect,2020-01-01,"Externalities, Hedonic prices, Supermarket, Whole foods market"
Effects of different cooking methods and palm oil addition on the bioaccessibility of beta-carotene of sweet leaf (Sauropus androgynous),2020-01-01,"Beta-carotene, Bioaccessibility, Cooking methods, Palm oil, Sauropus androgynous"
A way to create a sustainable environment: Green nanotechnology - with an emphasis on noble metals,2020-01-01,"Applications, Characterization, Green synthesis, Nanomaterials, Noble metals"
Phyloanatomic characterization of the distinct T cell and monocyte contributions to the peripheral blood HIV population within the host,2020-01-01,"Evolution, HIV, Monocyte, Phyloanatomy, T cell"
Clinical impacts of dna-based typing and provision of antigen-matched red blood cell units for chronically transfused patients with thalassemia,2020-01-01,"Antigen-matched transfusion, Chronic transfusion, DNA-based typing, Red blood cell alloantibody, Thalassemia"
"The Semi-Aquatic Freshwater Earthworm Genus Glyphidrilus Horst, 1889 from Myanmar (Oligochaeta: Almidae) with Description of a New Species",2020-01-01,"Almidae, earthworm, Glyphidrilus, Myanmar, new species"
Education and Subjective Well-Being among Older Vietnamese: Exploring Gender Differences,2020-01-01,"Education, elderly, happiness, loneliness, subjective well-being"
Towards Healthier Choices: An Investigation Into Sugar Label Design,2020-01-01,"consumer well-being, decision, healthy choice, sugar label"
Experiential Tourism Development On Lanna Local Plant-Based Gastronomy,2020-01-01,"experiential tourism, gastronomy tourism, local plant, tourism development"
Toward A Process Model Of Consumer Brand Evaluation And Promotion: Drivers Of Word Of Mouth For Thai Small And Medium Enterprises,2020-01-01,"Branding, Small and Medium Enterprises, Thailand, Visibility, Word of Mouth"
Critical Factors Influencing Revisit Intention of Large Restaurant Chains in Myanmar,2020-01-01,"Customer Satisfaction, Distributed Service, Food Quality, Perceived Service Quality, Price Perception, Revisit Intention"
INVESTIGATING ZAKAT PAYMENT OF THAI MUSLIMS,2020-01-01,"Compulsory charity, Thai muslims, Zakat payment"
Optimum Conditions for the Catalytic Cracking of Palm Oil from Empty Fruit Bunch over Dolomite in a Continuous Reactor,2020-01-01,"Catalytic cracking, Dolomite, Empty fruit bunch (PEFB), Organic liquid product (OLP)."
Screen printed textile electrodes using graphene and carbon nanotubes with silver for flexible supercapacitor applications,2020-01-01,"CNT, Cotton, Flexible supercapacitor, Graphene, Screen printing"
Nanotoxicology and Its Remediation,2020-01-01,"Microorganism toxicity, Nanoparticle toxicity, Nanotoxicity, Remediation"
"The operculate micro land snail genus Dicharax Kobelt & Möllendorff, 1900 (Caenogastropoda, Alycaeidae) in Thailand, with description of new species",2020-01-01,"Cyclophoroidea, Gastropoda, Mollusca, taxonomy"
Microstructure evolution and mechanical properties of calcined kaolin processing waste-based geopolymers in the presence of different alkali activator content by pressing and casting,2020-01-01,"Calcined kaolin processing waste, Geopolymers with low and high contents of alkali activator, Mechanical properties, Microstructure evolution, Pressed and cast geopolymers"
Chitosan beads as the adsorbent for glyphosate removal from an aqueous solution,2020-01-01,"Adsorption, Chitosan beads, Glyphosate, Isotherm, Removal"
Comparison of neural networks and regression analysis to predict in-process straightness in CNC turning,2020-01-01,"Cutting force ratio, Neural networks, Regression analysis, Straightness"
Development of prototype kit for portable drug allergy testing,2020-01-01,"3D printing, Allergy testing, Drug allergy, ELISpot, Portable"
Evolution of Mangrove Muddy Coast in the Western Coast of the Upper Gulf of Thailand Over the Past Six Decades,2020-01-01,"Coastal erosion, Human activities, Mangrove deforestation, Shoreline change"
"Factors Associated with Food Safety Knowledge and Practice Among Street Food Vendors in Taunggyi Township, Myanmar: a Cross-Sectional Study",2020-01-01,"Food safety, knowledge and practices, Myanmar, street food"
Meaningful work on career satisfaction: a moderated mediation model of job embeddedness and work-based social support,2020-01-01,"Accountant, Career satisfaction, Co-worker support, Job embeddedness, Meaningful work, Supervisor support"
Confronting otherness through theatre: On directing the merchant of venice for thai audiences,2020-01-01,"Audience perception, Shakespearean play, Thai theatre, The Merchant of Venice, Theatre directing"
‘Authoritarian civil society’: How anti-democracy activism shapes Thailand’s autocracy,2020-01-01,"Authoritarian civil society, autocratisation, Thailand, third-wave democracy"
Performance research seen through the lens of cultural ecology: A case study of an innovative production at Chiang Mai’s Lanna wisdom school,2020-01-01,"Chiang Mai, Choeng, Cultural ecology, Dance, Lanna culture, Performance research"
"Roundtables on performance research, developing cultural ecologies, and artistic research networking in the Asia-Pacific",2020-01-01,"Artistic research, Asia-Pacific, Cultural ecology, Intercultural improvisation, Performance research"
Playing with practice theory: Preliminary remarks on the work of performance ecologies in 21st century Bangkok,2020-01-01,"Artistic research, Bangkok theatre, Cultural ecologies, Performance studies, Practice theory"
Paraganglioma of the organ of Zuckerkandl and FH gene mutation,2020-01-01,"FH gene, Organs of ZuckerKandl, Paraganglioma"
Adaptation and evaluation of home fall risk assessment tools for the elderly in Thailand,2020-01-01,"Elderly, Falls, Home fall risk assessment tool, Thailand"
The Effect Of Breathing Cycles Program on Heart Rateand Sleep Parameters in Healthy Young Adults,2020-01-01,"Breathing, Heart rate, Sleep"
Degradation of diuron in water by electrochemical advanced oxidation in a microreactor: Effects of anion contamination on degradation and toxicity,2020-01-01,"Anion, Degradation, Diuron, Electrochemical advanced oxidation, Microreactor, Reaction pathway"
Effectiveness of behavioral activation in treating thai older adults with subthreshold depression residing in the community,2020-01-01,"Behavioral activation, Community, Depression, Older adults"
Event detection system based on user behavior changes in online social networks: Case of the covid-19 pandemic,2020-01-01,"Affective analysis, COVID-19, Event detection, Natural language processing, Online social networks"
A microbial fuel cell integrated with an absorption column for the removal of hydrogen sulfide from anaerobic wastewater treatment,2020-01-01,"Absorption column, Biogas, Hydrogen sulfide, Microbial fuel cell, Sulfate"
Cash flow uncertainty and IPO underpricing: evidence from income guarantee in Thai REITs,2020-01-01,"Cash flow uncertainty, Initial public offerings, REITs"
Nurse administered propofol sedation (Naps) versus on-call anesthesiologist administered propofol sedation (oaps) in elective colonoscopy,2020-01-01,"Colonoscopy, NAPS, Nurse administered sedation, Propofol, Sedation"
Assessment of microbial diversity and enumeration of metal tolerant autochthonous bacteria from tailings of magnesite and bauxite mines,2020-01-01,"Bauxite, Magnesite, Metals, Microbial diversity, Tailings, Tolerance"
Immune response to fungi in diabetic patients with invasive fungal rhinosinusitis,2020-01-01,"Diabetes mellitus, Fungi, Immune response, Neutrophils, Rhinosinusitis"
Agent or non-agent subject topics in English expository and fictional proses,2020-01-01,"AGENT, Semantic roles, Subject, Topic, Topic-comment"
Power-free automated capillary flow assay for SARS-CoV-2 detection,2020-01-01,"Automated ELISA, Capillary-driven microfluidics, SARS-CoV-2, Serology"
A new approach for low-dimensional constrained engineering design optimization using design and analysis of simulation experiments,2020-01-01,"Computationally expensive function, Constrained optimization, Global optimization, Kriging, Surrogates"
Biomass and Production Rates of Fine Roots in Two Mangrove Stands in Southern Thailand,2020-01-01,"Avicennia alba, ingrowth core, Rhizophora apiculata, soil depth, vertical distribution"
"A New Species of Tylototriton (Urodela: Salamandridae) from Nan Province, Northern Thailand",2020-01-01,"molecular phylogeny, morphology, new species, Thailand, Tylototriton"
Economic Burden of Influenza in Thailand: A Systematic Review,2020-01-01,"costs of illness, economic burden, influenza, systematic review, Thailand"
Cell lysis methods and coenzyme Q10 production of methylobacterium strains,2020-01-01,"Cell lysis method, Coenzyme Q10, Content, Methylobacterium strains, Production"
Pharmacy workforce in Myanmar public sector,2020-01-01,"Human resource planning, Myanmar, Pharmacist shortage, Pharmacist workforce, Public sector"
Proton pump inhibitors use in short bowel patients at a Thai Tertiary Hospital: A 10-year retrospective observational study,2020-01-01,"Antisecretory agent, Intestinal failure, Omeprazole, Proton pump inhibitor, Short bowel"
Association of N-acetyltransferase 2 (NAT2) polymorphisms and elevated liver enzymes of myanmar tuberculosis patients in Thailand,2020-01-01,"Isoniazid, Liver enzyme, Myanmar, N-acetyltransferase 2 polymorphism, Tuberculosis"
Increasing the solubility of levodopa and carbidopa using ionization approach,2020-01-01,"Carbidopa, Levodopa, Molar concentration, PH, Solubility"
Prescription and non-prescription drug classification systems across countries: Lessons learned for thailand,2020-01-01,"Classification criteria, Drug category, Drug regulatory, Non-prescription, OTC, Prescription"
On the surface welding of pearlitic rails: The control of dilution and microstructure,2020-01-01,"Bainite, Dilution, Hardfacing, Pearlitic rail, Surface welding"
Statistical analysis of building damage from the 2013 super typhoon haiyan and its storm surge in The Philippines,2020-01-01,"Building damage, Statistical analysis, Storm surge, Super Typhoon Haiyan"
Assessing flood risk of the chao phraya river basin based on statistical rainfall analysis,2020-01-01,"Chao Phraya Basin, Design hyetograph, Flood inundation, Probability distribution, Return period of rain-fall"
The Using Results of OER Mobile Application to Enhance 21st Century Skills in Information Media and Technology Skills for Humanities and Social Sciences,2020-01-01,"Application, Information Media and Technology skills, Mobile Learning, Open learning"
A systemic approach to biomass energy development: Thailand’s path towards sustainable development,2020-01-01,"Biomass Energy, Critical Systems Heuristic (CSH), Critical Systems Thinking (CST), Soft System Methodology (SSM), Systemic Approach"
"Understanding Muay Thai camp tourist motivations in Bangkok, Thailand",2020-01-01,"Muay Thai, sport heritage, sport tourism, Thailand, tourist motivation"
