Title,cover_date,authkey_word
Benzoxazine dimer analogue targets integrin β3 in lung cancer cells and suppresses anoikis resistance and migration,2020-05-01,"Anti-migration, Benzoxazine dimer analogue, Integrins, Non-small cell lung cancer"
Levansucrase from bacillus amyloliquefaciens kk9 and its y237s variant producing the high bioactive levan-type fructooligosaccharides,2020-05-01,"Bacillus amyloliquefaciens, Fructooligosaccharide, Levansucrase, Mutagenesis, Prebiotic"
"Hiring discrimination against highly competent candidates: An investigation of competence and warmth stereotypes, and cooperative/competitive mindsets",2020-05-01,"AEC, Hiring discrimination, Stereotype, The stereotype content model"
IR microspectroscopic identification of microplastics in municipal wastewater treatment plants,2020-05-01,"Aeration, Fate of microplastics, FTIR spectroscopy, Microplastics, Municipal wastewater treatment"
Cost-Effectiveness Analysis of Xpert MTB/RIF for Multi-Outcomes of Presumptive Pulmonary Tuberculosis Patients in Thailand,2020-05-01,"cost-effectiveness analysis, multi-outcomes, pulmonary tuberculosis, sputum AFB smear, Thailand, Xpert MTB/RIF"
"Successful pregnancy following chemotherapy in a survivor of small cell carcinoma of the ovary, hypercalcemic type (SCCOHT): A case report and review of literature",2020-05-01,"Oncofertility, SCCOHT, Small cell carcinoma of the ovary hypercalcemic type, VPCBAE"
Binder-free α-MnO2 nanowires on carbon cloth as cathode material for zinc-ion batteries,2020-05-01,"Dimethyl sulfoxide, Nanowires, Single crystal, Zinc, Zinc-ion battery, α-MnO2"
Heuristic Algorithms for Aggregated HVAC Control via Smart Thermostats for Regulation Service,2020-05-01,"aggregated HVAC control, Regulation services, smart thermostat"
National screening programs for cervical cancer in Asian countries,2020-05-01,"Asia, Cancer Screening, Cervical Cancer, National Health Programs"
Role of Zeolite-Supported Nanoscale Zero-Valent Iron in Selenate Removal,2020-05-01,"Fly ash, Nanoscale zero-valent iron, Selenate, Selenium, Zeolite"
Comparison of exercise training and estrogen supplementation on mast cellmediated doxorubicin-induced cardiotoxicity,2020-05-01,"Cardiomyocyte, Mast cell stabilizer, Ovariectomy"
On-farm lambing outcomes after transfer of vitrified and slow frozen embryos,2020-05-01,"Cryopreservation method, Embryonic stage, Sheep"
Relationships Between Pharmaceutical Therapy–Related Quality of Life and Health Utility Scores in Thai Patients With Chronic Diseases,2020-05-01,"EQ-5D-5L, EQ-VAS, health utility, medicine/pharmaceutical/drug therapy, quality of life, Thailand"
Synthesis of reusable biobased nano-catalyst from waste sugarcane bagasse for biodiesel production,2020-05-01,"Catalyst optimization, CCRD-RSM, Characterization, Esterification, Reusability, Sulfonated sugarcane bagasse"
Determination of anti-leishmanial drugs efficacy against Leishmania martiniquensis using a colorimetric assay,2020-05-01,"Colorimetric assay, Drug susceptibility, Ex vivo, In vitro, Leishmania martiniquensis"
Multi Response Optimization of Bioactive Starch Foam Composite Using Taguchi’s Method and Grey Relational Analysis,2020-05-01,"Bioactive agents, Biodegradability, Foam composite, Grey relational analysis, Taguchi method"
Potential Thai medicinal plants for neurodegenerative diseases: A review focusing on the anti-glutamate toxicity effect,2020-05-01,"Alzheimer's disease, Glutamate, Herbal medicine, Neuroprotective, Neurotoxicity, Oxidative stress, Plant extract, Traditional medicine"
Determination of radiation dose and low-dose protocol for digital chest tomosynthesis using radiophotoluminescent (RPL) glass dosimeters,2020-05-01,"Digital chest tomosynthesis, Entrance surface air kerma, Low-dose protocol, Pulmonary nodule detection, Radiophotoluminescent glass dosimeter"
The wake of a three-dimensional underwater obstacle: Effect of bottom boundary conditions,2020-05-01,"Boundary conditions, Internal waves, Lee vortices, Turbulent wakes, Vorticity generation"
The impact of corrected field output factors based on IAEA/AAPM code of practice on small-field dosimetry to the calculated monitor unit in eclipse™ treatment planning system,2020-05-01,"eclipse™ TPS, monitor unit, small field commissioning, small field detectors, small-field dosimetry, TRS 483"
"Immune response and protective efficacy of intramuscular and intradermal vaccination with porcine reproductive and respiratory syndrome virus 1 (PRRSV-1) modified live vaccine against highly pathogenic PRRSV-2 (HP-PRRSV-2) challenge, either alone or in combination with of PRRSV-1",2020-05-01,"Challenge, Immune response, Intradermal, Intramuscular, Modified live virus vaccine, Porcine reproductive and respiratory syndrome virus, Protective efficacy"
Fatty acid–binding protein 4 downregulation drives calcification in the development of kidney stone disease,2020-05-01,"fatty acid–binding protein, kidney stone, metabolic syndrome, Randall's plaque, RNA-sequence"
International comparison of peritoneal dialysis prescriptions from the Peritoneal Dialysis Outcomes and Practice Patterns Study (PDOPPS),2020-05-01,"International comparisons, peritoneal dialysis, prescription patterns"
Hepatic expression of HGF/C-met and native liver survival in biliary atresia,2020-05-01,"Biliary atresia, C-met, HGF, Survival"
Mastering nocturnal jigsaws in Parkinson’s disease: a dusk-to-dawn review of night-time symptoms,2020-05-01,"Excessive daytime somnolence, Insomnia, Nocturia, Nocturnal hypokinesia, Nocturnal manifestations, Parkinson’s disease, REM sleep behaviour disorder"
Molecular approaches to allergen-specific immunotherapy: Are we so far from clinical implementation?,2020-05-01,"allergen-specific immunotherapy, blocking antibodies, clinical trial, efficacy, hypoallergenic, recombinant derivatives, safety, Treg"
Superhydrophobic surface modification for corrosion protection of metals and alloys,2020-05-01,"Corrosion protection, Durability, Superhydrophobic, Water repellency, Wettability"
Multi-model projections of precipitation extremes in Southeast Asia based on CORDEX-Southeast Asia simulations,2020-05-01,"Climate change, CORDEX-SEA, Drought, Dynamical downscaling, Extreme precipitation"
The evolutionarily conserved HtrA is associated with stress tolerance and protein homeostasis in the halotolerant cyanobacterium Halothece sp. PCC7418,2020-05-01,"Halothece, Halotolerant cyanobacterium, HtrA, Salt stress, Serine protease"
Modulation of DNA and RNA by PNA,2020-05-01,"Antigene, Antisense, Gene edit, Oligonucleotide therapeutics, Peptide nucleic acid"
Adsorptions of lithium ion/atom and packing of Li ions on graphene quantum dots: Application for Li-ion battery,2020-05-01,"Adsorption, DFT, Graphene, Graphene quantum dots, Lithium atom, Lithium ion"
"The clinical characteristics, pre- and post–liver transplantation outcomes in patients having autoimmune overlap syndromes",2020-05-01,"clinical characteristics, liver transplantation, outcomes, overlap syndromes"
Genetic and clinical risk factors associated with phenytoin-induced cutaneous adverse drug reactions in Thai population,2020-05-01,"drug reaction with eosinophilia and systemic symptoms, epoxide hydrolases, maculopapular exanthema, pharmacoepidemiology, pharmacogenetics, phenytoin, Stevens-Johnson syndrome"
Phase inversion temperature-fabricated cinnamon oil nanoemulsion as a natural preservative for prolonging shelf-life of chilled Asian seabass (Lates calcarifer) fillets,2020-05-01,"Antimicrobial, Antioxidant, cinnamon oil nanoemulsion, Natural preservation, Shelf-life"
Dynamic feedback control of day-to-day traffic disequilibrium process,2020-05-01,"Demand and supply traffic regulation, Disequilibrium traffic dynamics, Dynamic feedback traffic control, Stability and convergence"
Increased Levels of Plasma Tumor Necrosis Factor-α Mediate Schizophrenia Symptom Dimensions and Neurocognitive Impairments and Are Inversely Associated with Natural IgM Directed to Malondialdehyde and Paraoxonase 1 Activity,2020-05-01,"Antioxidants, Cytokines, Inflammation, Oxidative stress, Paraoxonase 1, Psychiatry, Schizophrenia"
Silver nanoparticle/bacterial nanocellulose paper composites for paste-and-read SERS detection of pesticides on fruit surfaces,2020-05-01,"Bacterial nanocellulose, Flexible substrate, In situ detection, Methomyl, Silver nanoparticles, Surface enhanced Raman scattering"
Impaired ability to turn in bed in parkinson's disease as a potential rare cause of positional asphyxia: a sensor-based analysis,2020-05-01,"Impaired turning in bed, Parkinson's disease, Positional asphyxia, Prone sleeping position, Wearable sensors"
Alginate microencapsulated human hepatocytes for the treatment of acute liver failure in children,2020-05-01,"Acute liver failure, Alginate, Cell transplantation, Cryopreservation, Hepatocyte microbeads, Intraperitoneal transplantation, Microencapsulated human hepatocytes"
Virus-like particles displaying major house dust mite allergen Der p 2 for prophylactic allergen immunotherapy,2020-05-01,"animal models, immunotherapy vaccines and mechanisms, prevention, vaccines"
Neurodevelopmental pathways in bipolar disorder,2020-05-01,"Bipolar disorder, Cognition, Genomics, Neurobiology, Neurodevelopment, Neuroimaging, Psychiatry, Schizophrenia"
Systemic distribution of progesterone receptor subtypes in human tissues,2020-05-01,"Human tissues, Progesterone receptor, Progesterone receptor isoform B, Systemic distribution"
Enhanced H2 production with efficient N2-fixation by fructose mixotrophically grown Anabaena sp. PCC 7120 strain disrupted in uptake hydrogenase,2020-05-01,"Fructose, H2-production, Mixotrophic growth, N2-fixation, ΔHupL strain"
Enhancing purchase intention in circular economy: An empirical evidence of remanufactured automotive product in Thailand,2020-05-01,"Circular economy, Emerging economy, Partial least square structural equation modeling, Purchase intention, Remanufacturing, Theory of planned behavior"
Comprehensive investigation on bond mechanism of embedded through-section fiber-reinforced polymer bars to concrete for structural analysis,2020-05-01,"Bond model, Embedded through-section, Fiber-reinforced polymer, Pullout test, Shear strengthening"
Antioxidant and Anti-inflammatory Diagnostic Biomarkers in Multiple Sclerosis: A Machine Learning Study,2020-05-01,"Adiponectin, Machine learning study, Multiple sclerosis, Oxidative stress, TNF receptors, Zinc"
"Duck Tembusu virus detection and characterization from mosquitoes in duck farms, Thailand",2020-05-01,"detection, duck farms, duck Tembusu virus, mosquito, Thailand, vector"
An iterative elastic SBFE approach for collapse load analysis of inelastic structures,2020-05-01,"Collapse load, Elastic compensation, Limit analysis, Plasticity, Scaled boundary finite element"
Synthesis and electrochemical performance of LiV3O8/graphene for aqueous lithium batteries,2020-05-01,"Anode, Aqueous lithium batteries, Calcination, Lithium vanadate oxide, Sol-gel"
Risk factors of foot and mouth disease in an endemic area on low vaccination rate in Xayaboury province of Lao People’s Democratic Republic (Lao PDR),2020-05-01,"Animal movement, Control and prevention, Foot and mouth disease, Risk factors, Spatial location"
Optimal scheduling of electric vehicles aggregator under market price uncertainty using robust optimization technique,2020-05-01,"Charging and discharging schedule of electric vehicles, Electric vehicles aggregator, Market price uncertainty, Robust optimization technique"
The potential use of cross-linked alginate/gelatin hydrogels containing silver nanoparticles for wound dressing applications,2020-05-01,"Alginate/gelatin hydrogel, Calcium chloride, Silver nanoparticles, Wound dressing"
Physical and psychological predictors on pain intensity in conscripts with plantar fasciitis,2020-05-01,"Anxiety, Heel pain, Lower extremity injury, Military training, Predictor"
Predicting bacteria causing acute bacterial rhinosinusitis by clinical features Predição de bactérias causadoras de rinossinusite bacteriana aguda por características clínicas,2020-05-01,"Bacteria, C-reactive protein, Haemophilus influenza, Sinusitis, Streptococcus pneumoniae"
Student and feedback: Which type of feedback is preferable?,2020-05-01,"Assessment as learning, Computer-based testing, Genetic problem-solving ability, Immediate feedback, Student ability level"
"Creative leadership strategies for primary school principals to promote teachers’ creativity in Guangxi, China",2020-05-01,"China, Creative leadership, Primary school principals, Strategies, Teachers’ creativity"
Constructing MoS2/g-C3N4 heterojunction with enhanced oxygen evolution reaction activity: A theoretical insight,2020-04-30,"Electrocatalyst, Electrochemical water splitting, First-principles calculation, MoS2/g-C3N4 heterojunction, Oxygen evolution reaction"
"Corrigendum: Fertility Preservation for Child and Adolescent Cancer Patients in Asian Countries (Frontiers in Endocrinology, (2019), 10, 10.3389/fendo.2019.00655)",2020-04-28,"Asia, child cancer patients, fertility preservation, oncofertility, ovarian tissue cryopreservation"
Asian CHI symposium: HCI research from asia and on asian contexts and cultures,2020-04-25,"Asia, Interaction design, Interaction techniques, Interactive systems, User interfaces"
Atomic diffusion mediated by vacancy defects in L12-Zr3Al: A first-principles study,2020-04-25,"Diffusion, First-principles, Migration barrier, Self, Zr3Al"
Large-scale Distributive Matrix Collaborative Filtering for Recommender System,2020-04-24,"Collaborative Filtering, Distributive Matrix, Ensemble approach, Matrix Factorization"
Visual-based Items Recommendation Using Deep Neural Network,2020-04-24,"Deep Learning, Items' Recommendation, Machine learning, VGG-16"
Elucidating the Regulon of a Fur-like Protein in Mycobacterium avium subsp. paratuberculosis (MAP),2020-04-23,"ChIP-seq, Fur, iron, Mycobacterium avium subsp. paratuberculosis, regulon"
Ethyl acetate extract of kaempferia parviflora inhibits helicobacter pyloriassociated mammalian cell inflammation by regulating proinflammatory cytokine expression and leukocyte chemotaxis,2020-04-22,"Chemotaxis, Helicobacter pylori, Inflammation, Interleukin-8, Kaempferia parviflora"
Long-Term Isotope Evidence on the Diet and Habitat Breadth of Pleistocene to Holocene Caprines in Thailand: Implications for the Extirpation and Conservation of Himalayan Gorals,2020-04-21,"bulk carbon isotope, goral, paleoecology, Quaternary, refugee, serow, Southeast Asia"
A Well-Defined Core–Shell-Structured Capsule Catalyst for Direct Conversion of CO2 into Liquefied Petroleum Gas,2020-04-21,"capsule catalyst, carbon dioxide hydrogenation, liquefied petroleum gas, tandem reaction"
Rocking vibrations of rigid foundations on multi-layered poroelastic media,2020-04-20,"Exact stiffness matrix method, foundations, multi-layered soils, poroelasticity, rocking vibration, soil–structure interaction"
Comparison of two caries prevention programs among Thai kindergarten: A randomized controlled trial,2020-04-19,"Fluoride, Kindergarten, Prevention programs, Randomized controlled trial, Risk assessment, Toothbrushing"
"Middle Permian (Roadian) gastropods from the Khao Khad Formation, Central Thailand: Implications for palaeogeography of the Indochina Terrane",2020-04-17,"Diversity, Gastropoda, Lopburi, Mollusca, New species, Saraburi Group"
Performance analysis and temperature gradient of solid oxide fuel cell stacks operated with bio-oil sorption-enhanced steam reforming,2020-04-17,"Solid oxide fuel cell system, Sorption-enhanced steam reforming, System efficiency, Temperature gradient"
Aryl ethynylpyrene as fluorescent sensors for cyanide ions in aqueous media,2020-04-16,"Cyanide, Fluorescence, Pyrene, Sensors"
Rapid Low-Cost Microarray-Based Genotyping for Genetic Screening in Primary Immunodeficiency,2020-04-15,"copy number variants (CNV) calling, microarray-based genotyping, primary immunodeficiencies, single nucleotide variants (SNV) calling, SNP microarray"
Electrochemical immunosensor functionalized with nanobodies for the detection of the toxic microalgae Alexandrium minutum using glassy carbon electrode modified with gold nanoparticles,2020-04-15,"Alexandrium minutum, Electrochemical impedance spectroscopy, Glassy carbon electrode, Nanobodies"
Quantitative analysis of calcium carbonate formation in magnetized water,2020-04-15,"Aragonite/calcite ratio, Magnetic field strength, Magnetizing process, Quantitative analysis, X-ray technique"
Neoproterozoic to Early Triassic tectono-stratigraphic evolution of Indochina and adjacent areas: A review with new data,2020-04-15,"Indochina composite terrane, Paleozoic tectono-stratigraphy, Sino-Vietnam composite terrane, Song Ma suture, Tam Ky-Phuoc Son suture"
Bacterial cellulose membrane conjugated with plant-derived osteopontin: Preparation and its potential for bone tissue regeneration,2020-04-15,"Bacterial cellulose, Bone tissue regeneration, Osteopontin"
"Hydrochemical, geophysical and multivariate statistical investigation of the seawater intrusion in the coastal aquifer at Phetchaburi Province, Thailand",2020-04-15,"Coastal aquifer, Hydrochemical facies evolution diagram, Hydrogeological characteristics, Seawater intrusion, Thailand, Vertical electrical sounding method"
Photocatalytic zinc oxide on flexible polyacrylonitrile nanofibers via sol–gel coaxial electrospinning,2020-04-15,"Flexible, Nanofiber, Photocatalyst, Zinc oxide"
"Investigating carbon dioxide absorption by urban trees in a new park of Bangkok, Thailand",2020-04-13,"Carbon dioxide absorption, Stomatal conductance, Urban trees"
Husband's willingness-to-pay for HIV and syphilis screening at antenatal care clinic under the Thai universal coverage scheme,2020-04-10,"Antenatal care, Sexually transmitted infection, Willingness to pay"
Study of excited Λb 0 states decaying to Λb 0π+π− in proton-proton collisions at s=13TeV,2020-04-10,"Beauty baryon, CMS, Experimental results, Flavor spectroscopy, Heavy baryon, Heavy flavor, Physics"
Measurement of the tt‾bb‾ production cross section in the all-jet final state in pp collisions at s=13 TeV,2020-04-10,"CMS, Measurement, Physics, Top"
Production of Λc + baryons in proton-proton and lead-lead collisions at s NN =5.02TeV,2020-04-10,"CMS, Heavy flavor, Lambda(c) baryons, Nuclear modification factor, Physics"
Running of the top quark mass from proton-proton collisions at s=13TeV,2020-04-10,"CMS, Physics, QCD, Renormalization, Top quark mass"
Undrained lower bound solutions for end bearing capacity of shallow circular piles in non-homogeneous and anisotropic clays,2020-04-10,"anisotropic strength, circular piles, finite element limit analysis, lower bound, pile capacity"
Influence of rice husk ash on mechanical properties and fire resistance of recycled aggregate high-calcium fly ash geopolymer concrete,2020-04-10,"Fire resistance, Geopolymer concrete, Nano silica, Recycled aggregate, Rice husk ash"
"Vincetoxicum strigosum (Asclepiadoideae, Apocynaceae), a new species from northeastern Thailand",2020-04-09,"Anatomy, Morphology, Tylophora, Tylophorinae, Ultrastructure"
Applying rice husk biochar to revitalise saline sodic soil in Khorat Plateau area - A case study for food security purposes,2020-04-08,"Biochar, Food security purposes, Rice husk, Saline sodic soil, Salt-affected soil"
Development of Leishmania (Mundinia) in guinea pigs,2020-04-08,"Animal model, Guinea pig, Leishmania, Leishmania enriettii, Leishmania macropodum, Leishmania martiniquensis, Leishmania orientalis, Mundinia"
Improvement of Non-oil Ethylene Propylene Diene Monomers Mixing Process,2020-04-07,"Non-oil EPDM, Response surface method, Rubber mixing process, Six Sigma"
Creation A Strategic Plan for Supporting Digital Transformation,2020-04-07,"digital transformation, PEST analysis, Strategic plan, SWOT analysis, Thailand 4.0 policy"
The Development of Machineries and Technologies to Support Digital Transformation,2020-04-07,"Digital Transformation, Flexible Manufacturing Systems, Industry 4.0, Smart Factory"
Automated Monitoring and Behavior Analysis for Proactive Security Operations,2020-04-07,"Elastic stack, Honeypot, Log analysis, Network threat detection, Proactive security operation"
Reduced Cardiac Index Reserve and Hypovolemia in Severe Falciparum Malaria,2020-04-07,"Echocardiography, Hemodynamics, Hypovolemia, Severe malaria, Systolic function"
CdS/ZnO: A Multipronged Approach for Efficient Reduction of Carbon Dioxide under Visible Light Irradiation,2020-04-06,"CdS/ZnO, CO2 photocatalytic reduction, heterojunction, photocatalysis, visible light"
Performance of the prototype shaftless small scale horizontal wind turbine for electricity generating from industrial exhaust air system,2020-04-06,"Exhaust air system, Renewable energy, Shaftless, Small scale horizontal wind turbine"
Fuel replacement: A possible option for Thailand energy security?,2020-04-06,"Carbon emissions mitigation, Coal replacement, Energy security, Fuel oil replacement, Natural gas"
"Enhanced oil recovery: Potential for oil production development in Fang oilfield, Thailand",2020-04-06,"Alkaline flooding, Carbon dioxide flooding, Chemical enhanced oil recovery, Interfacial tension, Microbial enhanced oil recovery"
"A systemic approach to integrated sustainable solid waste management through community engagement: A case study of Tan Deaw sub-district, Saraburi province",2020-04-06,"A systemic approach, Critical systems heuristic (CSH), Soft systems methodology (SSM), Solid waste management"
Business model and market designs for solar prosumer on peer to peer energy trading in Thailand,2020-04-06,"Business models and market designs, Excess energy, Peer to peer energy trading, Solar prosumer"
Comparative customer economics on different financial options in support the adoption of residential rooftop photovoltaic in Thailand,2020-04-06,"Financial options, Net billing, Self-consumption, Solar photovoltaic"
Crucial factors in shaping strategies for Thai energy business in the dynamic era,2020-04-06,"Crucial uncertainties, Drivers, Energy business strategy, Key challenges"
Efficiency of zinc ions (II) adsorption using activated carbon from palm kernel shell,2020-04-06,"Activated carbon, Adsorption, Palm kernel shell, Zinc ions"
Changes in plasma aldosterone level after weight loss by bariatric surgery in morbidly obese patients,2020-04-06,"Bariatric surgery, Direct renin concentration, Obesity, Plasma aldosterone concentration, Renin-angiotensin-aldosterone system"
Predictors of advanced fibrosis in elderly patients with biopsy-confirmed nonalcoholic fatty liver disease: The GOASIA study,2020-04-06,"Advanced fibrosis, Elderly patients, Nonalcoholic fatty liver disease (NAFLD)"
Tuning of catalytic behaviors in ethanol dehydration with oxygen cofeeding over Pd-HBZ catalyst for ethylene production at low temperature,2020-04-05,"Beta zeolite, Diethyl ether, Ethanol dehydration, Ethylene, Oxygen cofeeding, Pd modification"
Effect of light intensity on survival and photosynthetic efficiency of cultured corals of different ages,2020-04-05,"Light intensity, Photosynthesis, Pulse amplitude modulated, Specific growth rate, Zooxanthellae"
"Distribution of sea cucumbers, Holothuria atra, on reefs in the upper Gulf of Thailand and the effect of their population densities on sediment microalgal productivity",2020-04-05,"Abundance, Deposit feeder, Feeding behavior, Holothurian, Microalgae"
Extraocular muscle insertion shift after disinsertion during strabismus surgery,2020-04-02,"insertion shift, Limbal-insertion distance, rectus muscle insertion"
Sulfonated hydrothermal carbon-based catalyzed esterification under microwave irradiation: Optimization and kinetic study,2020-04-02,"Carbon-based catalyst, Esterification, Ki-netic study, Microwave irradiation, Response surface methodology"
"Complete mitochondrial genome of a sea star, Linckia laevigata (Echinodermata, Asteroidea, Valvatida, Ophidiasteridae)",2020-04-02,"complete mitogenome, Echinodermata, sea star, Valvatida"
Parallel U-shaped assembly line balancing with adaptive MOEA/D hybridized with BBO,2020-04-02,"evolutionary optimization, many-objective optimization, Parallel U-shaped line balancing"
"Taxonomic revision of the land snail genera Macrochlamys Gray, 1847 and Sarika Godwin-Austen, 1907 (Eupulmonata: Ariophantidae) from south-eastern Myanmar, with descriptions of three new species",2020-04-02,"Anatomy, endemic, Indochina, limestone, Pulmonata, South-East Asia, systematics"
Soluble fms-like tyrosine kinase 1 and placental growth factor ratio for predicting preeclampsia in elderly gravida,2020-04-02,"elderly gravida, placental growth factor, Preeclampsia, ratio, soluble fms-like tyrosine kinase 1"
Normal Range of Ocular Ductions in Various Age Brackets by Prism Shifting Light-Reflex Test,2020-04-02,"age, duction, ocular movement, ocular rotation, Prism Shifting Light-Reflex Test"
Behavioral problems in perinatally HIV-infected young children with early antiretroviral therapy and HIV-exposed uninfected young children: prevalence and associated factors,2020-04-02,"behavioral problems, depression, HIV exposed uninfected children, parenting style, Perinatally HIV infected children"
"Health Connections in Intergenerational Relationships: A Case Study on the Impact of Familial Activities on the Health and Well-being of Young and Elderly People in Bangkok, Thailand: Research",2020-04-02,"activity theory, elderly, familial activities, health, Intergenerational relationships, young people"
Extraction of lycopene from tomato with environmentally benign solvents: Box-Behnken design and optimization,2020-04-02,"Box–Behnken Design, Extraction, Lycopene, Vegetable oil"
