Title,cover_date,authkey_word
Aza-BODIPY dye as near infrared fluorescent marker for tagging petroleum products,2020-09-01,"Fluorescent dye, Fluorescent marker, Near-infrared marker, Petroluem marker"
Ccl-11 or eotaxin-1: An immune marker for ageing and accelerated ageing in neuro-psychiatric disorders,2020-09-01,"Aging, Alzheimer’s disease, Behaviour, Biomarkers, Brain, CCL-11, Cytokines, Eotaxin, Prevention, Schizophrenia, Stroke"
Single observation adaptive search for discrete and continuous stochastic optimization,2020-09-01,"Adaptive search, Martingale processes, Simulation optimization, Stochastic optimization"
Provision of Differentiated Reliability Services under a Market-Based Investment Decision Making,2020-09-01,"customer preferences, Differentiated reliability services, distributed generation, distribution network, independent distributions system operator, reconfiguration"
Neuroprotective Properties of Green Tea (Camellia sinensis) in Parkinson’s Disease: A Review,2020-09-01,"Green tea, Neurodegenerative diseases, Neuroprotection, Parkinson’s disease, Polyphenols"
In silico finding of key interaction mediated α3β4 and α7 nicotinic acetylcholine receptor ligand selectivity of quinuclidine-triazole chemotype,2020-09-01,"Anti-1,2,3-triazole, Quinuclidine, Stereoselectivity, α3β4 nAChR, α7 nAChR"
Youth-friendly services and a mobile phone application to promote adherence to pre-exposure prophylaxis among adolescent men who have sex with men and transgender women at-risk for HIV in Thailand: a randomized control trial,2020-09-01,"adolescents, HIV prevention, men who have sex with men (MSM), pre-exposure prophylaxis (PrEP) adherence, transgender women (TGW)"
Rapid antiretroviral initiation among Thai youth living with HIV in the National AIDS programme in the era of treatment at any CD4 cell count: a national registry database study,2020-09-01,"antiretroviral therapy, HIV cascade, loss to follow-up, rapid ART, universal coverage health programme, youth living with HIV"
Curcumin-Loaded Bacterial Cellulose/Alginate/Gelatin as A Multifunctional Biopolymer Composite Film,2020-09-01,"Alginate, Bacterial cellulose, Biomaterials, Curcumin, Gelatin"
"Plasma miR-370-3P as a Biomarker of Sepsis-Associated Encephalopathy, the Transcriptomic Profiling Analysis of Microrna-Arrays From Mouse Brains",2020-09-01,"Biomarker, blood-brain barrier, brain, microRNA, miR-370-3p, mouse, SAE, sepsis-associated encephalopathy"
"Concepts, selectivity options and experimental design approaches in multidimensional and comprehensive two-dimensional gas chromatography",2020-09-01,"Column selection, Comprehensive heartcut, Improved peak capacity, Ionic liquids, Orthogonality, Selectivity optimisation"
Rapid transient expression of functional human vascular endothelial growth factor in Nicotiana benthamiana and characterization of its biological activity,2020-09-01,"Human vascular endothelial growth factor, Molecular farming, Nicotiana benthamiana, Transient expression"
Experimental infection of Leishmania (Mundinia) martiniquensis in BALB/c mice and Syrian golden hamsters,2020-09-01,"animal model, BALB/c mouse, Leishmania martiniquensis, Mundinia, Syrian golden hamster"
GaAsPBi epitaxial layer grown by molecular beam epitaxy,2020-09-01,"bismuth compound, III-V material, molecular beam epitaxy"
Bioeconomic peace research and policy,2020-09-01,"Ecoviolence, Global public bads, Global public goods, Sigmoid growth, Sustainability"
Provision of Sexual Medicine Services During the Coronavirus Disease-2019 Pandemic: An Asia Pacific Society of Sexual Medicine Position Statement,2020-09-01,"COVID-19, Safety, Sexual Medicine, Telehealth, Webinar"
Identification of carotenoids and chlorophylls from green algae Chlorococcum humicola and extraction by liquefied dimethyl ether,2020-09-01,"Carotenoids, Chlorococcum humicola, Chlorophylls, Liquefied dimethyl ether, Microalgae, Subcritical extraction"
Billing system and health care utilization: Evidence from Thailand,2020-09-01,"Direct disbursement, Health care utilization, Health insurance, Provider payment"
Coexisting cancers with atypical glandular abnormalities by liquid-based cytology: A retrospective study in tertiary hospital in a high cervical cancer incident country,2020-09-01,"Atypical glandular cell, Cervical cancer, Endometrial cancer, Liquid base cytology"
Secondary contact and genomic admixture between rhesus and long-tailed macaques in the Indochina Peninsula,2020-09-01,"hybridization, Indochina, RAD-seq, reproductive isolation, speciation"
Transcatheter aortic valve implantation during the COVID-19 pandemic: Clinical expert opinion and consensus statement for Asia,2020-09-01,"COVID 19, TAVI, TAVR, valve repair/replacement"
"Large transmission cluster of acute hepatitis C identified among HIV-positive men who have sex with men in Bangkok, Thailand",2020-09-01,"HCV infection, men who have sex with men, molecular epidemiology, phylogenetic clustering, sexual transmission"
Design and use of a phantom for testing and comparing the performance of computed tomography automatic tube current modulation systems,2020-09-01,"automatic tube current modulation (ATCM), computed tomography, optimi sation, phantom, quality control (QC)"
Estimating canopy gross primary production by combining phloem stable isotopes with canopy and mesophyll conductances,2020-09-01,"boreal forest, intrinsic water-use efficiency, mesophyll conductance, nitrogen fertilization, phloem δ13C, PRELES, sap flux, stand transpiration"
Syk inhibitor attenuates inflammation in lupus mice from FcgRIIb deficiency but not in pristane induction: the influence of lupus pathogenesis on the therapeutic effect,2020-09-01,"(1→3)-β-D-glucan, endotoxin, FcgRIIb-deficient mice, gut leakage, spleen tyrosine kinase, systemic lupus erythematosus"
A New High-Performance Proton-Conducting Electrolyte for Next-Generation Solid Oxide Fuel Cells,2020-09-01,"electrochemical performance, power density, proton-conducting electrolytes, solid oxide fuel cells, structural analysis"
“It is really so exhausting”: Exploring intensive care nurses’ perceptions of 24-hour long shifts,2020-09-01,"intensive care, nursing care quality, qualitative study, registered nurses, shift work"
Why Patients Visit Dentists – A Study in all World Health Organization Regions,2020-09-01,"Dentistry, Oral health, Problem-oriented medical records, Quality of life, Surveys and questionnaires, WHO"
Characterization of natural rubber as a bolus material for electron beam radiotherapy,2020-09-01,"Bolus, Gafchromic EBT3 film, Natural rubber, Relative electron density"
Dependence of MWCNT production via co-pyrolysis of industrial slop oil and ferrocene on growth temperature and heating rate,2020-09-01,"Co-pyrolysis, Ferrocene, Growth temperature, Heating rate, MWCNT, Slop oil"
Pathological aspects of mucinous cholangiocarcinoma: A single-center experience and systematic review,2020-09-01,"cholangiocarcinoma, mucinous, pathology"
Axial compression behavior of concrete-encased cellular steel columns,2020-09-01,"Axial compression behavior, Cellular steel columns, Concrete-encased steel columns, Load – axial strain curves"
Biosorption of dicloxacillin from pharmaceutical waste water using tannin from Indian almond leaf: Kinetic and equilibrium studies,2020-09-01,"Biosorption, Dicloxacillin, Isotherms, Pseudo-second-order kinetics"
Pre-existing liver disease is associated with poor outcome in patients with SARS CoV2 infection; The APCOLIS Study (APASL COVID-19 Liver Injury Spectrum Study),2020-09-01,"Acute liver injury, Chronic liver disease, COVID-19, SARS CoV2"
"Synthesis, α-glucosidase inhibition, and molecular docking studies of novel N-substituted hydrazide derivatives of atranorin as antidiabetic agents",2020-09-01,"Atranorin, Cytotoxicity, N-substituted hydrazide derivatives, Parmotrema tsavoense, α-Glucosidase inhibition"
Selective-area growth and characterization of cubic GaN grown by metalorganic vapor phase epitaxy,2020-09-01,"Crystal growth, Crystal structure, Microstructure, Nitride materials, Semiconductors, Vapor deposition"
Preferential oxidation of carbon monoxide in a hydrogen-rich gas stream over supported gold catalysts: the effect of a mixed ceria–zirconia support composition,2020-09-01,"Au catalyst, CeO2–ZrO2, CO conversion, PROX, Solid solution"
Temporal changes in enzyme activities associated with ectomycorrhizas and soil from secondary deciduous dipterocarp forest fragments,2020-09-01,"Dipterocarp, Ectomycorrhizal communities, pNP assay, Potential enzyme activities, Seasonal changes, Secondary forests"
Correlation between Detergency of Different Oily and Solid Non-Particulate Soils and Hydrophilic–Lipophilic Deviation,2020-09-01,"Detergency, Dynamic interfacial tension (IFT), Hydrophilic–lipophilic deviation (HLD), Microemulsion phase behavior"
Amphiphilic biodegradable co-networks of Poly(butylene succinate)-Poly(ethylene glycol) chains for nano-gelation via Click chemistry and its potential dispersant for multi-walled carbon nanotubes,2020-09-01,"Amphiphilic, Carbon nanotube, Copper-catalyzed azide-alkyne cycloaddition (CuAAC) Click, Nanogel, poly(butylene succinate), poly(ethylene glycol)"
Carnivore Protoparvovirus-1 Associated With an Outbreak of Hemorrhagic Gastroenteritis in Small Indian Civets,2020-09-01,"brain, carnivore protoparvovirus-1, feline panleukopenia virus, hemorrhagic enteritis, host range, small Indian civet, viverrids"
A prebiotic fructo-oligosaccharide promotes tight junction assembly in intestinal epithelial cells via an AMPK-dependent pathway,2020-09-01,"AMP-activated protein kinase (AMPK), Fructo-oligosaccharides (FOS), Lipopolysaccharide (LPS), Tight junction"
Double heterozygous variants in FBN1 and FBN2 in a Thai woman with Marfan and Beals syndromes,2020-09-01,"Beals syndrome, Congenital contractural arachnodactyly, Dual diagnosis, Exome sequencing, Marfan syndrome, Two mendelian diseases"
Matrix graphs and MRD codes over finite principal ideal rings,2020-09-01,"Finite principal ideal ring, Matrix graph, MRD code"
Ideals of Γ-seminearrings,2020-09-01,"Bi-ideal, Ideal, Quasi-ideal, Γ-seminearring"
Phylogenetic and recombinant analyses of complete coding sequences of DENV-1 from field-caught mosquitoes in Thailand,2020-09-01,"Complete coding sequence, DENV-1, Phylogenetic analysis, Recombination"
Hearing-impaired population performance and the effect of hearing interventions on Montreal Cognitive Assessment (MoCA): Systematic review and meta-analysis,2020-09-01,"cochlear implant, hearing aid, hearing difficulty, hearing disorder, hearing impair*, hearing loss, MeSH subject headings, MoCA, Montreal Cognitive Assessment"
Pleiotropic effects of antidiabetic agents on renal and cardiovascular outcomes: a meta-analysis of randomized controlled trials,2020-09-01,"Antidiabetic agents, Cardiovascular outcomes, DPP-4 inhibitors, GLP-1 agonists, Renal outcomes, SGLT-2 inhibitors"
"Influence of compatibilizer and multifunctional additive loadings on flame retardation, plasticization, and impact modification of polylactide and poly(butylene adipate-co-terephthalate) biodegradable blends",2020-09-01,"additive, compatibilization, flame retardant, poly(butylene adipate-co-terephthalate), polylactide"
Projected future changes in rainfall in Southeast Asia based on CORDEX–SEA multi-model simulations,2020-09-01,"CORDEX Southeast Asia, Multi-model simulations, Projected rainfall, Regional climate downscaling"
Physical properties and morphology of siloxane–polyacrylate dispersion and coating films,2020-09-01,"Core–shell siloxane-modified polyacrylate, Hydrophobicity, Morphology, Recycling D4, Vinyl and acryloyl silane"
Combining biochar and zerovalent iron (BZVI) as a paddy field soil amendment for heavy cadmium (Cd) contamination decreases Cd but increases zinc and iron concentrations in rice grains: a field-scale evaluation,2020-09-01,"Biochar, Cadmium, Essential metals, Rice, Soil amendment, Zerovalent iron"
The pathophysiological effects of russell's viper (Daboia siamensis) venom and its fractions in the isolated perfused rabbit kidney model: A potential role for platelet activating factor,2020-09-01,"Daboia siamensis, phospholipase A2, Isolated perfused kidney, L-amino acid Oxidase, Metalloprotease, Phosphodiesterase, Russell's viper, WEB 2086"
Effects of antiepileptic drugs on electroencephalography (EEG): Insights and applicability,2020-09-01,"Antiepileptic drugs, Drug effects, Electroencephalography"
"Response of Scenedesmus sp. to microwave treatment: Enhancement of lipid, exopolysaccharide and biomass production",2020-09-01,"Biomass, Exopolysaccharides, Lipids, Microalgae, Microwave, Oxidative stress"
Clay/au nanoparticle composites as acetylcholinesterase carriers and modified-electrode materials: A comparative study,2020-09-01,"Bentonite, Biosensor, Gold nanoparticles, Kaolinite, Montmorillonite, Sepiolite"
IoT Enabled Quality of Experience Measurement for Next Generation Networks in Smart Cities,2020-09-01,"Data protection, Internet service provider, IoT, Latency, Quality of experience, Smart cities"
Driving factors and impact of land-use change in a fragile rainfed lowland rice-sugar palm cultural agroforestry system in southern Thailand,2020-09-01,"Borassus flabellifer, Commercialization, Diversification, Family farms, Oil palm, Peri-urbanization, Sustainable landscape management"
Sensitization to major Dermatophagoides pteronyssinus allergens in house dust mite allergic patients from North Eastern Poland developing rhinitis or asthma,2020-09-01,"Allergy, Der p 2.0101, Der p 23, Dermatophagoides pteronyssinus"
Continuous production of fatty acid methyl esters and high-purity glycerol over a dolomite-derived extrudate catalyst in a countercurrent-flow trickle-bed reactor,2020-09-01,"Biodiesel, Dolomite, Fatty acid methyl esters, Glycerol, Trickle-bed reactor"
Endoscopic sphenopalatine foramen cauterization is an effective treatment modification of endoscopic sphenopalatine artery ligation for intractable posterior epistaxis,2020-09-01,"Cauterization, Endoscopy, Epistaxis, Ligation, Pterygopalatine, Sphenopalatine"
Enhanced sensitivity and separation for simultaneous determination of tin and lead using paper-based sensors combined with a portable potentiostat,2020-09-01,"CTAB, Lead, Metal nanoparticles, Paper-based device, Portable sensor, Simultaneous detection, Tin"
Acemannan induces rapid early osseous defect healing after apical surgery: A 12-month follow-up of a randomized controlled trial,2020-09-01,"Aloe vera, Biomaterials, Bone repair, CBCT, Clinical study"
Wss1 homolog from Candida albicans and its role in DNA–protein crosslink tolerance,2020-09-01,"Candida albicans, DNA damage response, DNA repair, DNA–protein crosslink, Wss1"
Optimal multi-instrument management of interrelated resources and a groundwater dependent ecosystem,2020-09-01,"Active management, Coastal groundwater, Groundwater dependent ecosystem, Invasive species, Passive management, Watershed protection"
Response Surface Optimization of Multilayer Graphene Growth on Alumina-Supported Bimetallic Cobalt–Nickel Substrate,2020-09-01,"Characterization, Chemical vapor deposition, Multilayer graphene, Optimization, Response surface methodology"
Dominance status and copulatory vocalizations among male stump-tailed macaques in Thailand,2020-09-01,"Male copulation vocalizations, Male status, Multi-male multi-female society, Sexual strategy"
"AHP-GIS analysis for flood hazard assessment of the communities nearby the world heritage site on Ayutthaya Island, Thailand",2020-09-01,"Analytic hierarchy process, Flood hazard, GIS, Thailand, World heritage site"
"Field trials evaluating the efficacy of porcine epidemic diarrhea vaccine, RNA (Harrisvaccine) in the Philippines",2020-09-01,"Porcine epidemic diarrhea virus, RNA particle platform, Swine, Vaccine"
Effects of pedagogy and information technology utilization on innovation creation by SECI model,2020-09-01,"Information technology utilization, Innovation creation, Pedagogy, SECI model"
A SNP panel for early detection of artificial chimerism in HSCT patients using TaqMan technology,2020-09-01,"AIM, Chimerism analysis, HSCT, SNP, TaqMan, Thai"
Effects of season and single layer centrifugation on bull sperm quality in thailand,2020-09-01,"Bovine Semen Quality, Colloid Centrifugation, Frozen Semen, Humidity, Temperature"
Protein dynamics of five FMN binding protein isomers revealed by residue electrostatic energies between ionic residues: correlation coefficients,2020-09-01,"Electrostatic energy, FBP, FMN binding protein, Molecular dynamics simulation, Protein dynamics"
Development of amphotericin B nanosuspensions for fungal keratitis therapy: effect of self-assembled γ-cyclodextrin,2020-09-01,"Aggregates, Amphotericin B, Cyclodextrin, Nanosuspensions, Solubilizer"
In vitro immune responses of human peripheral blood mononuclear cells to silk fibroin: IL-10 stimulated anti-inflammatory and hypoallergenic properties,2020-09-01,"Atopic dermatitis, Biomaterials, Fibroin, Functional, Silk"
Development of novel cationic microemulsion as parenteral adjuvant for influenza vaccine,2020-09-01,"Adjuvant, Cationic microemulsion, Influenza virus, Vaccine"
The Value of a Statistical Life in Thailand: Evidence from the Labour Market,2020-09-01,"Quantile regression, Revealed preference, Thailand, Value of statistical life"
Bacopa monnieri (L.) wettst. Extract protects against glutamate toxicity and increases the longevity of Caenorhabditis elegans,2020-09-01,"Alzheimer's disease, Bhumi, Cytoprotective, Herbal medicine, Neurodegeratative disease, Neuroprotective"
A cross-national analysis of the psychometric properties of the geriatric anxiety inventory,2020-09-01,"Bifactor, Invariance, Measurement, Multigroup, Unidimensional"
Affective EEG-Based Person Identification Using the Deep Learning Approach,2020-09-01,"Affective computing, biometrics, convolutional neural networks (CNNs), deep learning (DL), electroencephalography (EEG), long short-Term memory (LSTM), personal identification (PI), recurrent neural networks (RNNs)"
Additive adjugate-commuting preservers between matrix spaces,2020-09-01,"additive preserver, Adjugate matrix, rank-1 preserver"
Feeling Good by Doing Good: A Selfish Motivation for Ethical Choice,2020-09-01,"Ethical consumption, Moral choice, Self-affirmation, Self-restoration, Sustainability"
The role of live streaming in building consumer trust and engagement with social commerce sellers,2020-09-01,"Customer engagement, Customer trust, Live streaming, Shopping value, Social commerce"
Neutral hip position for the oblique lumbar interbody fusion (OLIF) approach increases the retroperitoneal oblique corridor,2020-08-31,"Hip position, MRI, Oblique lateral lumbar interbody fusion, OLIF, Retroperitoneal oblique corridor, ROC"
Development of in situ gel containing asiaticoside/cyclodextrin complexes. Evaluation in culture human periodontal ligament cells (HPLDCs),2020-08-30,"Asiaticoside, Collagen type I, Cyclodextrin, Encapsulation, In situ gel, Periodontitis"
"Fermented unpolished black rice (Oryza sativa L.) inhibits melanogenesis via ERK, p38, and AKT phosphorylation in B16F10 melanoma cells",2020-08-28,"Fermented rice, Hom Nin rice, Melanogenesis inhibition, Melanogenesis-related proteins, Oryza sativa L, Unpolished black rice"
Treatment for vaginal atrophy using microablative fractional CO2laser: A randomized double-blinded sham-controlled trial,2020-08-27,"Fractional carbon dioxide laser, Genitourinary syndrome of menopause, Vaginal atrophy, Vaginal laser"
A performance study of a wearable balance assistance device consisting of scissored-pair control moment gyroscopes and a two-axis inclination sensor,2020-08-26,"Balance assistance device, Control moment gyroscopes, Inclination, Limit of stability, Postural sway"
Nineteenth century public relations: Siam's campaign to defend national sovereignty,2020-08-25,"Anti-colonization, International diplomacy, King Rama V, Public relations campaign, Public relations history, Thailand"
Cytokinin accumulation and flowering gene expression are orchestrated for floral meristem development in longan (Dimocarpus longan Lour.) after chemical flower induction,2020-08-25,"Cytokinin, Defoliation, Flower induction, Flowering time control, Girdling, Potassium chlorate"
Alginate/Pluronic F127-based encapsulation supports viability and functionality of human dental pulp stem cell-derived insulin-producing cells,2020-08-24,"Alginate, Dental pulp stem cells (DPSCs), Diabetes mellitus, Encapsulation, Insulin-producing cells (IPCs), Pluronic F127"
Dissecting factors influencing response to CAR T cell therapy in B lymphoid hematologic malignancies: from basic to practice,2020-08-23,"Chimeric antigen receptor T cell (CAR T cell), immunotherapy, leukemia, lymphoma"
Selective etching and hardness properties of quenched SAC305 solder joints,2020-08-23,"Electrochemical etching, Hardness, IMC, Quenched soldering, SAC305"
Vitamin D supplement on prevention of fall and fracture: A Meta-analysis of Randomized Controlled Trials,2020-08-21,"fall, fracture, meta-analysis, supplement, vitamin D"
Exploring how independent directors view CSR inequality using a quasi-natural experiment,2020-08-21,"Board independence, Corporate governance, CSR, Independent directors"
Do analysts’ recommendations reflect co-opted boards?,2020-08-21,"Agency theory, Analyst, Analyst recommendation, Board independence, Co-opted boards, Corporate governance"
Bangkok Tours and Activities Data Analysis via User-Generated Content,2020-08-17,"Association rules mining, K-fold cross validation, Logistic regression, Natural language processing, Prediction models, Sentiment analysis, Text frequency analysis, TripAdvisor, User-generated content"
Distinguishing Enantiomers by Tip-Enhanced Raman Scattering: Chemically Modified Silver Tip with an Asymmetric Atomic Arrangement,2020-08-17,"charge transfer, chirality, hydrogen bonding, Raman spectroscopy, silver"
Long-Term TDF-Inclusive ART and Progressive Rates of HBsAg Loss in HIV-HBV Coinfection-Lessons for Functional HBV Cure?,2020-08-15,"HBsAg seroloss, HBV, HIV, long-term ART, tenofovir"
"Solubility modelling and solvent effect on solid-liquid equilibrium of 2,2-bis(hydroxymethyl)butyric acid at different temperatures",2020-08-15,"2,2-Bis(hydroxymethyl)butyric acid, Apelblat model, Dimethylolbutyric acid, NRTL model, Solid-liquid equilibrium, Solubility, λh model"
Influence of TiO2 charge and BSA-metal ion complexation on retention of Cr (VI) in ultrafiltration process,2020-08-15,"Antifouling property, BSA complexation and Cr (VI) rejection, Composite membranes, TiO2 NPs, Ultrafiltration"
"Integrative taxonomy of the new millipede genus Coxobolellus, gen. nov. (Diplopoda: Spirobolida: Pseudospirobolellidae), with descriptions of ten new species",2020-08-14,"mitochondrial DNA, new genus, phylogeny, species delineation"
Current Perspectives and Unmet Needs of Primary Immunodeficiency Care in Asia Pacific,2020-08-13,"health resources, immunology, primary immunodeficiencies, resource needs, specialty training, standard of care"
Automatic Requirements Elicitation from Social Media (ARESM),2020-08-12,"Facebook, Machine Learning, Requirements Elicitation, Social Media, Text Classification, Twitter API"
Extractive Text Summarization for Thai Travel News Based on Keyword Scored in Thai Language,2020-08-12,"extractive summarization, non-negative matrix factorization, Text summarization"
"Effects of vaginal administration of conjugated estrogens tablet on sexual function in postmenopausal women with sexual dysfunction: A double-blind, randomized, placebo-controlled trial",2020-08-12,"Dyspareunia, Genitourinary syndrome of menopause, Hormonal therapy, Sexual dysfunction, The female sexual function index, Vaginal maturation index, Vaginal pH, Vulvovaginal atrophy"
Chitosan-polyacrylamide graft copolymers prepared with gamma irradiation for gold cyanide adsorption,2020-08-12,"adsorption, Chitosan, gamma irradiation, gold cyanide, graft copolymers"
Formulation of Bio-Based Washing Agent and Its Application for Removal of Petroleum Hydrocarbons From Drill Cuttings Before Bioremediation,2020-08-11,"biosurfactants, drilling waste, polyolefin biodegradation, sequential treatment, soil washing"
The characterization of extracellular vesicles-derived microRNAs in Thai malaria patients,2020-08-10,"Extracellular vesicles, Malaria, microRNAs, Patients, Plasmodium falciparum, Plasmodium vivax"
Meta-analysis of genome-wide association study identifies FBN2 as a novel locus associated with systemic lupus erythematosus in Thai population,2020-08-08,"Genetic susceptibility, Genome-wide association study, Polygenic risk score, Single nucleotide polymorphisms, Systemic lupus erythematosus, Thai population"
"Changes in inflammatory cytokines, antioxidants and liver stiffness after chelation therapy in individuals with chronic lead poisoning",2020-08-08,"Chelation therapy, Chronic Lead poisoning, Hepatic fibrosis, Hepatic Steatosis, Hepatotoxicity, Oxidative stress"
Estimating PM2.5 concentrations with statistical distribution techniques for health risk assessment in Bangkok,2020-08-08,"GIS-based map, health risk assessment, multiple linear regression, PM2.5"
Mixed-integer linear program for the operational harvest scheduling problem: An application to the thai sugar industry,2020-08-07,"Mixed-Integer Programming, Resource Scheduling, Traveling Salesman Problem, Vehicle Routing Problem"
Production cost analysis of plastic woven sack manufacturer,2020-08-07,"Cost Analysis, Cost Model, Material Balance, Production Cost"
Effectiveness of a Qigong program on sleep quality among community-dwelling older adults with mild to moderate depression: A randomized controlled trial,2020-08-07,"Depression, Older adult, Qigong, Sleep quality"
