Title,affliation_country
Covalent organic framework-based ultrathin crystalline porous film: Manipulating uniformity of fluoride distribution for stabilizing lithium metal anode,China
Colicin N mediates apoptosis and suppresses integrin-modulated survival in human lung cancer cells,Thailand
Insulin-Producing Cell Transplantation Platform for Veterinary Practice,Thailand
Pharmacognostical study of Chinese medicine Prinsepiae Nux 蕤仁的生药学鉴别研究,China
"Real-world Evaluation of glycemic control and hypoglycemic Events among type 2 Diabetes mellitus study (REEDS): A multicentre, cross-sectional study in Thailand",Thailand
Morphology-Controlled Self-Assembly and Synthesis of Biopolyimide Particles from 4-Amino-l-phenylalanine,Japan
Identification of bacterial pathogens in cultured fish with a custom peptide database constructed by matrix-assisted laser desorption/ionization time-of-flight mass spectrometry (MALDI-TOF MS),Thailand
"Comparison of hepatitis B surface antibody levels induced by the pentavalent DTwP-HB-Hib versus the hexavalent DTaP-HB-Hib-IPV vaccine, administered to infants at 2, 4, 6, and 18 months of age, following monovalent hepatitis B vaccination at birth",Thailand
Combined search for supersymmetry with photons in proton-proton collisions at s=13 TeV,Armenia
Genetic characterization of exotic commercial honey bee (Hymenoptera: Apidae) populations in Thailand reveals high genetic diversity and low population substructure,Thailand
"Lowered zinc and copper levels in drug-naïve patients with major depression: Effects of antidepressants, ketoprofen and immune activation",Iraq
"Mitochondrial DNA copy number, damage, repair and degradation in depressive disorder",Poland
Plumbagin inhibited AKT signaling pathway in HER-2 overexpressed-endocrine resistant breast cancer cells,Thailand
Biocompatible film sensors containing red radish extract for meat spoilage observation,Thailand
Systemic to pulmonary venous shunt and the focal hepatic hot spot sign from SVC obstruction in Behcet's disease,Thailand
Host proteome linked to HPV E7-mediated specific gene hypermethylation in cancer pathways,Thailand
"Outcomes of thrombolytic therapy in acute ischemic stroke: Mothership, drip-and-ship, and ship-and-drip paradigms",Thailand
Heterogeneous network model to identify potential associations between Plasmodium vivax and human proteins,Thailand
Performance of the reconstruction and identification of high-momentum muons in proton-proton collisions at s = 13 TeV,Armenia
Detection of brain metastases using alternative magnetic resonance imaging sequences: A comparison between SPACE and VIBE sequences,Thailand
Digital image processing technique to measure the range of motion of the elbow,Thailand
Gasification of plastic waste for synthesis gas production,Thailand
Realizing the potential of blockchain technology in smart grid applications,United States
"Identification and antimicrobial activities of Streptomyces, Micromonospora, and Kitasatospora strains from rhizosphere soils",Thailand
Non-Gaussian CMB and LSS statistics beyond polyspectra,Chile
Mesoporous acidic catalysts synthesis from dual-stage and rising co-current gasification char: Application for fame production from waste cooking oil,Italy
Dynamic simulation and control system for chemical looping combustion,Thailand
Dynamic model and control system of carbon dioxide capture process in fluidized bed using computational fluid dynamics,Thailand
Development of computational fluid dynamics model for two initial CO2 concentration in circulating fluidized bed reactor,Thailand
Development of CO2 capture capacity by using impregnation method in base condition for K2CO3/Al2O3,Thailand
Measurement of the top quark pair production cross section in dilepton final states containing one τ lepton in pp collisions at √s = 13 TeV,Armenia
Reducing vulnerability to desertification by using the spatial measures in a degraded area in Thailand,Thailand
Effect of various surface treatments on the performance of jute fibers filled natural rubber (NR) composites,Thailand
Value of CCNA1 Promoter Methylation in Triaging ASC-US Cytology,Thailand
"Implementation of an active case management network to identify HIV-positive infants and accelerate the initiation of antiretroviral therapy, Thailand 2015 to 2018",Thailand
Microneedle-facilitated intradermal proretinal nanoparticle delivery,Thailand
A novel test for predicting fusional potential in patients with torsional diplopia,United States
The synthesis of nitrogen and sulfur co-doped graphene quantum dots for fluorescence detection of cobalt(ii) ions in water,Thailand
Search for top squark pair production in a final state with two tau leptons in proton-proton collisions at √s = 13 TeV,Armenia
Novel salivary gland allergens from tropical mosquito species and IgE reactivity in allergic patients,Thailand
The effects of omega-3 fatty acids on diabetic nephropathy: A meta-analysis of randomized controlled trials,United States
Salivary and serum interleukin-17A and interleukin-18 levels in patients with type 2 diabetes mellitus with and without periodontitis,Thailand
"Real-world data of Helicobacter pylori prevalence, eradication regimens, and antibiotic resistance in Thailand, 2013–2018",Thailand
Evaluation of aspartate aminotransferase to platelet ratio index and fibrosis 4 scores for hepatic fibrosis assessment compared with transient elastography in chronic hepatitis C patients,Thailand
Seed longevity of buchanania siamensis in reclaiming salt-affected areas in Thailand,Thailand
Nonsteroidal anti-inflammatory drugs and incidence of atrial fibrillation: A meta-analysis,Thailand
Proton pump inhibitors and histamine-2 receptor antagonists on the risk of pancreatic cancer: A systematic review and meta-analysis,United States
Search for production of four top quarks in final states with same-sign or multiple leptons in proton–proton collisions at √s=13TeV,Armenia
"Characterization of viral, bacterial, and parasitic causes of disease in small-scale chicken flocks in the Mekong Delta of Vietnam",Viet Nam
Development and validation of liquid chromatography-tandem mass spectrometry method for simple analysis of sumatriptan and its application in bioequivalence study,Thailand
Author's reply,Thailand
Alterations in Synaptic Plasticity and Oxidative Stress Following Long-Term Paracetamol Treatment in Rat Brain,Thailand
"Parental attachment, adult-child romantic attachment, and marital satisfaction: An examination of cultural context in taiwanese and thai heterosexual couples",United Kingdom
ICON: Diagnosis and management of allergic conjunctivitis,United States
From international guidelines to real-world practice consensus on investigations and management of status epilepticus in adults: A modified Delphi approach,Thailand
ATP1A3-related epilepsy: Report of seven cases and literature-based analysis of treatment response,Germany
Osimertinib-associated ashy dermatosis–like hyperpigmentation,Thailand
Net Ultrafiltration Prescription and Practice Among Critically Ill Patients Receiving Renal Replacement Therapy: A Multinational Survey of Critical Care Practitioners,United States
"Isothermal cold crystallization kinetics and properties of thermoformed poly(lactic acid) composites: effects of talc, calcium carbonate, cassava starch and silane coupling agents",Thailand
"Correction to: Preparation and characterization of renewable composites from Polylactide and Rice husk for 3D printing applications (Journal of Polymer Research, (2019), 26, 9, (227), 10.1007/s10965-019-1882-6)",China
"Correction to: Cell adhesion molecules, plasminogen activator inhibitor type 1, and metabolic syndrome in patients with psoriasis (Clinical and Experimental Medicine, (2020), 20, 1, (39-48), 10.1007/s10238-019-00595-2)",Brazil
"Migration, physical and antibacterial properties of silver zeolite/poly(butylene succinate) composite films for food packaging applications",Thailand
"Correction to: Optimizing Pueraria candollei var. mirifica cell suspension culture for prolonged maintenance and decreased variation of isoflavonoid from single cell lines (Plant Cell, Tissue and Organ Culture (PCTOC), (2018), 134, 3, (433-443), 10.1007/s11240-018-1433-6)",Thailand
Comparison of managerial competence of Indonesian first-line nurse managers: a two-generational analysis,Thailand
"Identifying shallow gas zones by using seismic attributes, offshore Vietnam",Viet Nam
Use of an internal fibrous biofilter for intermittent nitrification and denitrification treatments in a zero-discharge shrimp culture tank,Thailand
"Amino-functionalized mesoporous silica-magnetic graphene oxide nanocomposites as water-dispersible adsorbents for the removal of the oxytetracycline antibiotic from aqueous solutions: adsorption performance, effects of coexisting ions, and natural organic matter",Thailand
Antral contraction rate estimation from dynamic antral scintigraphy using Hilbert-Huang transform,Thailand
Aqueous solubility of kinase inhibitors: II the effect of hexadimethrine bromide on the dovitinib/γ-cyclodextrin complexation,Iceland
Genome sequences of chikungunya virus isolates from an outbreak in southwest Bangkok in 2018,Thailand
A Review on Recent Trends and Future Prospects of Lignin Based Green Rubber Composites,Thailand
Turner syndrome in diverse populations,United States
"Mountain-to-sea ecological-resource management: Forested watersheds, coastal aquifers, and groundwater dependent ecosystems",United States
In situ monitoring of the crystalline state of active pharmaceutical ingredients during high-shear wet granulation using a low-frequency Raman probe,Japan
Synthesis optimization and X-ray absorption spectroscopy investigation of polymeric anion exchanger supported binary Fe/Mn oxides nanoparticles for enhanced As(III) removal,Thailand
Aqueous solubility of kinase inhibitors: I the effect of hydrophilic polymers on their γ-cyclodextrin solubilization,Iceland
"Nonwoven fabric supported, chitosan membrane anchored with curcumin/TiO2 complex: Scaffolds for MRSA infected wound skin reconstruction",India
Enhanced Antipsoriatic Activity of Mycophenolic Acid Against the TNF-α-Induced HaCaT Cell Proliferation by Conjugated Poloxamer Micelles,Thailand
A comparative study of pedobarography and ankle kinematics between children with idiopathic clubfoot after a soft tissue release procedure and controls,Thailand
A novel deletion in the fibrinogen beta chain (FGB) gene causing hypofibrinogenemia,Thailand
Risk evaluation and retail electricity pricing using downside risk constraints method,China
Effect of La and Gd substitution in BaFeO3-δ perovskite structure on its catalytic performance for thermochemical water splitting,Thailand
"Increased Serum Immunoglobulin Responses to Gut Commensal Gram-Negative Bacteria in Unipolar Major Depression and Bipolar Disorder Type 1, Especially When Melancholia Is Present",Bulgaria
Vibration activates the actin/NF-κB axis and upregulates IL-6 and IL-8 expression in human periodontal ligament cells,Thailand
The efficacy and safety of the addition of olanzapine to ondansetron and dexamethasone for prevention of chemotherapy-induced nausea and vomiting in patients receiving highly emetogenic chemotherapy,Thailand
Hotel daily demand forecasting for high-frequency and complex seasonality data: a case study in Thailand,Thailand
Microencapsulation of n-octadecane and methyl palmitate phase change materials in silica by spray drying process,Thailand
"The influence of EDTA on the accumulation, movement, and distribution of cadmium in dwarf elephant grass",Thailand
Adenosine triphosphate enhances osteoblast differentiation of rat dental pulp stem cells via the PLC–IP3 pathway and intracellular Ca 2+ signaling,United States
"Cell adhesion molecules, plasminogen activator inhibitor type 1, and metabolic syndrome in patients with psoriasis",Brazil
Fabrication of biocomposite membrane with microcrystalline cellulose (MCC) extracted from sugarcane bagasse by phase inversion method,Thailand
Learning programmes and teaching techniques to enhance oral health literacy or patient-centred communication for healthcare providers: A systematic review,Thailand
Formation of Alpha-Case Layer During Investment Casting of Pure Ti and Ti-6Al-4V Using Comparative XRD and EXAFS Investigation,Thailand
Novel DDX41 variants in Thai patients with myeloid neoplasms,Thailand
Molecular Pharming for low and middle income countries,United Kingdom
Maximizing double-link failure recovery of over-dimensioned optical mesh networks,Thailand
Energy management of wind-PV-storage-grid based large electricity consumer using robust optimization technique,China
Effect of acid on the crystalline phase of TiO2 prepared by hydrothermal treatment and its application in the oxidative steam reforming of methanol,Thailand
An IGDT-based risk-involved optimal bidding strategy for hydrogen storage-based intelligent parking lot of electric vehicles,China
"The development of sit-to-stand in typically developing children aged 4 to 12 years: Movement time, trunk and lower extremity joint angles, and joint moments",Thailand
Cycloartane triterpenoids from the leaves of Euphorbia neriifolia,Thailand
THAI-ICU score as a simplified severity score for critically ill patients in a resource limited setting: Result from SEA-AKI study group,Thailand
Modeling and prioritizing dynamic demand response programs in the electricity markets,China
Proteomic analysis of adult Schistosoma mekongi somatic and excretory-secretory proteins,Thailand
Acute Liver Failure Secondary to Drug-Induced Liver Injury,Thailand
The effect of narcissistic admiration and rivalry on speaking performance,Thailand
Differences in the immune-inflammatory profiles of unipolar and bipolar depression,Brazil
Perception of Thai dental students on becoming innovative healthcare professionals,Thailand
TiO2-coated alveolar clay foam as a photocatalyst for water detoxification,Thailand
Activity of Fly Ash-Derived ZSM-5 and Zeolite X on Fast Pyrolysis of Millettia (Pongamia) Pinnata Waste,Thailand
An early experience of Check List to Improve Patient Self-care and Product Defect Report in Continuous Ambulatory Peritoneal Dialysis (CLIP-SP) study,Thailand
"Administration of Candida Albicans to Dextran Sulfate Solution Treated Mice Causes Intestinal Dysbiosis, Emergence and Dissemination of Intestinal Pseudomonas Aeruginosa and Lethal Sepsis",Thailand
Investigation of the Morphology of InSb/InAs Quantum Nanostripe Grown by Molecular Beam Epitaxy,Thailand
Development of an innovative apparatus using UV-C for controlling the number of microorganisms in raw milk after milking,Thailand
An LMDI decomposition analysis of carbon emissions in the Thai manufacturing sector,Thailand
Comparison between ferrihydrite adsorption and full-scale advanced drinking water treatment processes for controlling bacterial regrowth potential,China
Characterization of a novel Clostridium sp. SP17–B1 and its application for succinic acid production from hevea wood waste hydrolysate,Thailand
The Role of Aberrations in the Immune-Inflammatory Response System (IRS) and the Compensatory Immune-Regulatory Reflex System (CIRS) in Different Phenotypes of Schizophrenia: the IRS-CIRS Theory of Schizophrenia,Thailand
Novel natural rubber composites based on silver nanoparticles and carbon nanotubes hybrid filler,Thailand
A Novel GNAS Mutation Causing Isolated Infantile Cushing's Syndrome,Thailand
Co-cultivation of two engineered strains of Synechocystis sp. PCC 6803 results in improved bioethanol production,Thailand
Quantitation of phosphatidylserine-exposing platelets in platelet concentrate prepared in routine blood transfusion laboratory,Thailand
Anatomical and ultrasound-based injections for sunken upper eyelid correction,Thailand
Bone turnover markers predict type of bone histomorphometry and bone mineral density in Asian chronic haemodialysis patients,Thailand
Deep neuromuscular blockade for endolaryngeal procedures: A multicenter randomized study,Thailand
"SDS modified mesoporous silica MCM-41 for the adsorption of Cu2+, Cd2+, Zn2+ from aqueous systems",Thailand
Family status and later-life depression among older adults in urban Latin America and the Caribbean,Thailand
Rice Husk-Derived Silica as a Support for Zirconocene/MMAO Catalyst in Ethylene Polymerization,Thailand
Motivational factors for knowledge sharing in co-working spaces,Thailand
The critical success factors for new service development in digital service,Thailand
Integrating traversal and visual-based techniques to initiate UI exploration scripting,Thailand
Missing factors that are overlooked in designing a photovoltaic system,Thailand
The impact of high frequency oscillatory ventilation on mortality in paediatric acute respiratory distress syndrome,Singapore
Water adsorption on vanadium oxide thin films in ambient relative humidity,New Zealand
Cohomology theory for biological time series,Slovakia
Paper-based immunosensor with competitive assay for cortisol detection,Thailand
The economic impact of IUU-fishing and its countermeasures on small scale fishermen in Thailand: A case study of Baan Khan Kradai,Thailand
"Search for Supersymmetry with a Compressed Mass Spectrum in Events with a Soft τ Lepton, a Highly Energetic Jet, and Large Missing Transverse Momentum in Proton-Proton Collisions at s =13 TeV",Armenia
Primary care management of allergic rhinitis: A cross-sectional study in four ASEAN countries,Malaysia
Dental school tracks related to the retention of dentists in Thai government service: A cross-sectional survey,Thailand
"Aspects of gauged R symmetry in SU (1,1) /U (1) supergravity",Thailand
Antifungal activity of econazole nitrate/cyclodextrin complex: Effect of pH and formation of complex aggregates,Thailand
Preparation of MCM-41-supported Pd–Pt catalysts with enhanced activity and sulfur resistance for partial hydrogenation of soybean oil-derived biodiesel fuel,Thailand
Epicardial posterior papillary muscle repositioning with mitral annular reduction for FIMR treatment: Initial ex vivo heart model study,United States
Multiparticle correlation studies in pPb collisions at sNN =8.16 TeV,Armenia
α7-Nicotinic acetylcholine receptor antagonist QND7 suppresses non-small cell lung cancer cell proliferation and migration via inhibition of Akt/mTOR signaling,Thailand
"Australasian impact crater buried under the Bolaven volcanic field, Southern Laos",Singapore
The different structure of sources of growth between the developed and the developing Asia and the Pacific countries,Thailand
Environmental changes on the west coast of the Gulf of Thailand during the 8.2 ka event,Thailand
Plant hormone induced enrichment of Chlorella sp. omega-3 fatty acids,Thailand
Sleep Disorders and Gestational Diabetes Mellitus,Thailand
Innovative Eco Biofilter/Membrane Bioreactor (MBR) Technology for Community Wastewater Recycling,Thailand
Nanoscale electrical analyses of axial-junction GaAsP nanowires for solar cell applications,France
Caring detachment in buddhism and implications for women's rights,Thailand
Innermost and outermost stable circular orbits in the presence of a positive cosmological constant,Thailand
"Strain stiffening, high load-invariant hardness, and electronic anomalies of boron phosphide under pressure",China
"Polyurethane-biomacromolecule combined foam dressing containing asiaticoside: fabrication, characterization and clinical efficacy for traumatic dermal wound treatment",Thailand
Experimental infection reveals transmission of tilapia lake virus (TiLV) from tilapia broodstock to their reproductive organs and fertilized eggs,Thailand
Cilostamide and forskolin maintain gap junction function of incubated dog follicles,United States
Simultaneous deacetylation and degradation of chitin hydrogel by electrical discharge plasma using low sodium hydroxide concentrations,Thailand
Adsorption removal of methylene blue onto activated carbon/cellulose biocomposite films: Equilibrium and kinetic studies,Thailand
Reproductive performance of weaned sows after single fixed-time artificial insemination under a tropical climate: Influences of season and insemination technique,Thailand
Software Remodularization Using Tabu Search,Thailand
Toward U-Net-based GANs for Diverse Facial Image Synthesis from Sketch,Thailand
Citation Network Analysis for Journal Selection of University Library,Thailand
"Prevalence and factors associated with safe sex behaviors among adolescent vocational students in Nakhon Ratchasima Province, Thailand",Thailand
Insights into the Binding Recognition and Susceptibility of Tofacitinib toward Janus Kinases,Thailand
"Knowledge, attitude and practice levels regarding malaria among people living in the malaria endemic area of Myanmar",Thailand
Hydrogen production via chemical looping steam reforming of ethanol by Ni-based oxygen carriers supported on CeO2 and La2O3 promoted Al2O3,Thailand
Risk-involved stochastic performance of hydrogen storage based intelligent parking lots of electric vehicles using downside risk constraints method,China
Profile of Histone H3 Lysine 4 Trimethylation and the Effect of Lipopolysaccharide/Immune Complex-Activated Macrophages on Endotoxemia,Thailand
Observation of nuclear modifications in W± boson production in pPb collisions at sNN=8.16TeV,Armenia
Search for light pseudoscalar boson pairs produced from decays of the 125 GeV Higgs boson in final states with two muons and two nearby tracks in pp collisions at s=13TeV,Armenia
Measurement of the single top quark and antiquark production cross sections in the t channel and their ratio in proton-proton collisions at s=13TeV,Armenia
Spray coating thin polymeric sensor films for Au3+,Thailand
Practical approaches for high-risk surgical patients with acute cholecystitis: The percutaneous approach versus endoscopic alternatives,Thailand
StyloThai: A scalable framework for stylometric authorship identification of Thai documents,Thailand
Impact of guideline-recommended versus non-guideline-recommended β-blocker and Doppler echocardiographic parameters on 1-year mortality in Thai ischemic cardiomyopathy patients: A prospective multicenter registry,Thailand
A bacteriophage nucleus-like compartment shields DNA from CRISPR nucleases,United States
A consumer-oriented segmentation study on edible insects in Switzerland and Thailand,Switzerland
Leptospirosis manifested with severe pulmonary haemorrhagic syndrome successfully treated with venovenous extracorporeal membrane oxygenation,Thailand
Decomposition of the total stress energy for the generalized Kiselev black hole,Thailand
A study on the operational condition of a ground source heat pump in Bangkok based on a field experiment and simulation,Japan
Consumers’ perceptions towards Thai rice: A cross-cultural comparison between easterners and westerners,Thailand
Exploring the effects of solute segregation on the strength of Zr {101¯1} grain boundary: A first-principles study,China
The effect of maternal antibodies on the cellular immune response after infant vaccination: A review,Belgium
Successful recruitment of a multi-site international randomized placebo-controlled trial in people with HIV with attention to diversity of race and ethnicity: critical role of central coordination,United States
Morphological and structural properties of barium strontium titanate nanopowders synthesized via a sol-gel method,Thailand
Fabrication of flexible titania/polyacrylonitrile co-axial nanofibers via electrospinning,Thailand
Visual Disability from Transient Diplopia Phenomenon in Acquired Strabismus,United States
Development and validation of a simple score for diagnosis of leptospirosis at outpatient departments,Thailand
In vitro fabrication of hybrid bone/cartilage complex using mouse induced pluripotent stem cells,Japan
"Correction: Abbasi, A. et al. Poly(2,6-dimethyl-1,4-phenylene oxide)-based hydroxide exchange separator membranes for zinc-air battery. (Int. J. Mol. Sci. 2019, 20, 3678)",Thailand
Simple and Cost-Effective Electrochemical Approach for Monitoring of Vitamin K in Green Vegetables,Thailand
Constructing calendars in the brain,United States
Hybrid Governance of Transboundary Commons: Insights from Southeast Asia,Singapore
Performance evaluation of parabolic greenhouse-type solar dryer used for drying of cayenne pepper,Thailand
A new dihydrophenanthrene from Cymbidium finlaysonianum and structure revision of cymbinodin-A,Thailand
Collaboration for the E-learning Space in ASEAN,Thailand
Intraocular Pressure Fluctuation in Angle Closure Glaucoma,Thailand
Medical Therapy in Angle Closure Glaucoma,Thailand
Sensitivity Analysis Comparisson of Synthetic Polymer and Biopolymer using Reservoir Simulation,Thailand
Case Atlas and Illustrations: Colon,Thailand
Handling of Specimen and Post-ESD Management Protocol,Thailand
A Review on the Technical and Economic Prospects of Biofuel Production from Integrated Biomass Gasification and Fischer-Tropsch Processes,Thailand
Selection of Cost-Effective and Energy-Efficient Storages with Respect to Uncertain Nature of Renewable Energy Sources and Variations of Demands,United States
"Participatory Comprehensive Planning of Amphawa District, Thailand",Thailand
Human Rabies Vaccines,United States
Rabbit induced pluripotent stem cells: The challenges,Thailand
Low-dose macrolides for treating pediatric rhinosinusitis: A retrospective study and literature review,Thailand
Drug safety in Thailand,Thailand
Evaporite Deposits,Thailand
"mHealth for Better Quality of Life, Healthier Lifestyles, and More Meaningful Lives",Belgium
The Regulation of Unfair Terms and Consumer Protection in Thailand,Thailand
Electroactive fluoropolymers and polyamides,Thailand
Magnetic nanocarriers of bioactives: structural and delivery system designs,Thailand
Lymphatic filariasis,Thailand
