Title,affliation_country
"Effect of Ball Milling Time on the Physical, Thermal and Fracture Behaviour of 2MgO.2Al2O3.5SiO2 Precursors",Nigeria
Using pre-commitment to reduce alcohol consumption: Lessons from a quasi-experiment in Thailand,Thailand
High selective monoaromatic hydrocarbon production via integrated pyrolysis and catalytic upgrading of Napier grass over Ca/Ni/boronic acid/KIT-6,Thailand
Surface morphology and cellulose structure of Napier grass pretreated with the ionic liquid 1-ethyl-3-methylimidazolium acetate combined with either water or dimethyl sulfoxide as a co-solvent under microwave irradiation,Thailand
Comparative Study of Three Chemical Pretreatments and Their Effects on the Structural Changes of Rice Straw and Butanol Production,Thailand
Two-Stage Liquefaction of Oil Palm Shell in Alkali Supercritical Ethanol–Water for Enhanced Bio-Oil Production,Thailand
Mechanical properties of cement-clay interlocking (Cci) hollow bricks,Thailand
Weekly forecasting model for dengue hemorrhagic fever outbreak in Thailand,Thailand
Effects of crumbed para rubber on permanent deformation resistance of hot mix asphalt,Thailand
Effect of local rewiring in adaptive epidemic networks,Thailand
Investigation on Solubility of Carbon Dioxide in the Mixed Aqueous Solution of MEA and 2-MAE,Thailand
Measurement of Mass Transfer Coefficient of CO2-Amine System from Absorption Process,Thailand
Application of Natural Dolomite for Soil Upgrading,Thailand
Analysis of the use of SEN0161 pH sensor for water in goldfish ponds,Indonesia
Decreased of BAFF-R expression and B cells maturation in patients with hepatitis B virus-related hepatocellular carcinoma,Thailand
Surface modification of graphene oxide via noncovalent functionalization with porphyrins for selective photocatalytic oxidation of alcohols,Thailand
Utility of Plasmodium falciparum DNA from rapid diagnostic test kits for molecular analysis and whole genome amplification,Thailand
"In schizophrenia, psychomotor retardation is associated with executive and memory impairments, negative and psychotic symptoms, neurotoxic immune products and lower natural IgM to malondialdehyde",Thailand
Vanadium-Based Oxide on Two-Dimensional Vanadium Carbide MXene (V2Ox@V2CTx) as Cathode for Rechargeable Aqueous Zinc-Ion Batteries,Thailand
"Two new species of the genus Chironephthya (Octocorallia, Alcyonacea, Nidaliidae, Siphonogorgiinae) from the Gulf of Thailand",Japan
Spatial Separation of Charge Carriers via Heterogeneous Structural Defects in Graphitic Carbon Nitride for Photocatalytic Hydrogen Evolution,China
Measurement of the jet mass distribution and top quark mass in hadronic decays of boosted top quarks in pp collisions at √s = 13 TeV,Armenia
Gamma-glutamyl transferase and cardiovascular risk in nonalcoholic fatty liver disease: The Gut and Obesity Asia initiative,Thailand
Pinostrobin suppresses the Ca2+-signal-dependent growth arrest in yeast by inhibiting the Swe1-mediated G2cell-cycle regulation,Thailand
Protein patterning with antifouling polymer gel platforms generated using visible light irradiation,Japan
"Rotavirus infection in children in Southeast Asia 2008-2018: Disease burden, genotype distribution, seasonality, and vaccination",Thailand
Toward semantic data imputation for a dengue dataset,Thailand
Incidence of acute kidney injury and use of renal replacement therapy in intensive care unit patients in Indonesia,Indonesia
Optical Bioelectronic Device Based on a Screen-Printed Electroluminescent Transducer,Thailand
Tuning rigidity and negative electrostriction of multi-walled carbon nanotube filled poly(lactic acid),Thailand
Risk and profit-based bidding and offering strategies for pumped hydro storage in the energy market,China
Solvent-based washing as a treatment alternative for onshore petroleum drill cuttings in Thailand,Thailand
"Antibodies to measles, mumps, and rubella virus in Thai children after two-dose vaccination at 9 months and 2.5 years: A longitudinal study",Thailand
Transactional and transformational leadership: a study of Indonesian managers,Thailand
A literature perspective of key factors influencing creativity and a conceptual model for virtual learning team work,Thailand
"The influnce of external cultures on art, music, and dance education students: A case study of Thailand and Lao Pdr",Thailand
Hospital epidemiology and antimicrobial susceptibility of isolated methicillin-resistant Staphylococcus aureus: a one-year retrospective study at a tertiary care center in Thailand,Thailand
Risk-constrained optimal operation of fuel cell/photovoltaic/battery/grid hybrid energy system using downside risk constraints method,China
"Conflict and Peace Economics: Retrospective and Prospective Reflections on Concepts, Theories, and Data",Thailand
Effect of molecular shape of suspended colloids on an osmotic flow across a fibrous membrane,Thailand
Antiplatelet activity of deferiprone through cyclooxygenase-1 inhibition,Thailand
"Palladium-Catalyzed Cycloaddition of Alkynylimines, Double Isocyanides, and H2O/KOAc",China
"The uterine-chemokine-brain axis: menstrual cycle-associated symptoms (MCAS) are in part mediated by CCL2, CCL5, CCL11, CXCL8 and CXCL10",Thailand
Cohomology theory for financial time series,Thailand
"Suppression of white feces syndrome in Pacific white shrimp, Litopenaeus vannamei, using hen egg white lysozyme",Thailand
Development of a species-specific polymerase chain reaction for highly sensitive detection of Flavobacterium columnare targeting chondroitin AC lyase gene,Thailand
"Draft genome sequences of chlamydiales bacterium STE3 and neochlamydia sp. strain AcF84, endosymbionts of acanthamoeba spp",Austria
A universal and facile approach to suppress dendrite formation for a Zn and Li metal anode,Thailand
Test Case Impact Analysis for BPMN Input Changes,Thailand
Monitoring Call activity and Service Task Invocations for BPMN,Thailand
Morphology and Mechanical Properties of Polyamide 6 and Polybutylene Terephthalate Blends Compatibilized with Epoxidized Natural Rubber,Thailand
A traction controller of a two-wheel mobile robot with feedforward compensator,Thailand
Why are lopinavir and ritonavir effective against the newly emerged coronavirus 2019? Atomistic insights into the inhibitory mechanisms,Thailand
In vivo removal of profenofos in agricultural soil and plant growth promoting activity on Vigna radiata by efficient bacterial formulation,Thailand
Study of J/ψ meson production inside jets in pp collisions at s=8TeV,Armenia
Supersymmetric S-matrices from the worldsheet in 10 & 11d,Thailand
Process development of sustainable biorefinery system integrated into the existing pulping process,Thailand
Delayed versus early initiation of renal replacement therapy for severe acute kidney injury: a systematic review and individual patient data meta-analysis of randomised clinical trials,{}
Parameter-dependent linear matrix inequality approach to robust state estimation of noisy genetic networks,Thailand
Optimal operational strategy for a vanadium redox flow battery,Thailand
Silver line defect reduction of rear lens combination lamp process,Thailand
Processing and antibacterial application of biodegradable sponge nano-composite materials of silver nanoparticles and silk sericin,Thailand
Waste generation and management status in the fast-expanding Indian cities: A review,Thailand
Additional Candida albicans administration enhances the severity of dextran sulfate solution induced colitis mouse model through leaky gut-enhanced systemic inflammation and gut-dysbiosis but attenuated by Lactobacillus rhamnosus L34,Thailand
Presence of hepatitis b virus in paraffin-embedded liver tissues of patients with hepatocellular carcinoma,Thailand
Factors influencing technology adoption of people with visual impairment: Case study of financial transactions through an automatic teller machine (atm),Thailand
Opinion mining for laptop reviews using naïve bayes,Thailand
"A new environmental performance index based on the carbon footprint, VOC emissions, and waste in a printing house",Thailand
Treatment and clinical outcome of colistin-resistant klebsiella pneumoniae bacteremia patients,Thailand
Green synthesis of iron oxide nanoparticles using Hibiscus rosa-sinensis for fortifying wheat biscuits,India
Transient treatment response of platelet-rich plasma injection for temporal triangular alopecia: A case report with dermoscopic examination follow-up,Thailand
"The existence of argyrophilic endocrine cells in the digestive system of snake eels (Pisodonophis boro, Hamilton, 1822)",Thailand
Cognition-adjusted dependency ratio among later-life adults and the role of education,Thailand
Suicidal idea among the elderly,Thailand
COVID-19: An early review of its global impact and considerations for parkinson’s disease patient care,Thailand
Automatic Epileptic Seizure Onset-Offset Detection Based on CNN in Scalp EEG,Thailand
Learning A Common Granger Causality Network Using A Non-Convex Regularization,Thailand
Acute myocardial infarction among hospitalizations for heat stroke in the united states,United States
Changing dynamics of psychoneuroimmunology during the COVID-19 pandemic,India
"Erratum to: Study of dijet events with a large rapidity gap between the two leading jets in pp collisions at s = 7 Te (The European Physical Journal C, (2018), 78, 3, (242), 10.1140/epjc/s10052-018-5691-6)",Austria
Pedv orf3 independently regulates iκb kinase β-mediated nf-κb and ifn-β promoter activities,Thailand
Nutrition management in acute pancreatitis: Clinical practice consideration,Canada
Catalysis and fine chemicals,Japan
Bergenin from Cissus javana DC. (Vitaceae) root extract enhances glucose uptake by rat L6 myotubes,Thailand
Guidelines to build a smooth transition from home to preschool: Parental roles in the thai context,Thailand
Calibration of the CMS hadron calorimeters using proton-proton collision data at s = 13 TeV,Armenia
Results of traumatic canalicular laceration repair performed by trainees in a tertiary eye care center,Thailand
Transient CO2 diffusion from vehicle cabin micro-environment in hot and humid climates,Thailand
Button damper reduces the impact force during tennis flat serve,Thailand
An assessment of the niche centroid hypothesis: Pteropus lylei (Chiroptera),Thailand
Research competency enhancement process based on knowledge management procedures for developing routine to research of support staff at Thaksin University,Thailand
Lactic acid modified natural rubber-bacterial cellulose composites,Thailand
Efficacy of Broadline® in cats against induced infections with developing fourth-stage larval and adult Ancylostoma ceylanicum hookworms,Germany
Green pathway in utilizing CO2 via cycloaddition reaction with epoxide-A mini review,Thailand
"Parasitism of soldiers of the termite, macrotermes gilvus (Hagen), by the scuttle fly, megaselia scalaris (loew) (diptera: Phoridae)",Thailand
Structure-activity analysis and molecular docking studies of coumarins from toddalia asiatica as multifunctional agents for alzheimer's disease,Thailand
Synthesis and characterization of hollow-sphered poly(n-methyaniline) for enhanced electrical conductivity based on the anionic surfactant templates and doping,Thailand
Erratum: Gastric peroral endoscopic pyloromyotomy versus gastric electrical stimulation in the treatment of refractory gastroparesis: A propensity score-matched analysis of long term outcomes (Endoscopy (2020) 52 (349-358) DOI: 10.1055/a-1111-8566),United States
Friends and exam cheating: An experimental study in Thailand,Thailand
Measurement of differential cross sections and charge ratios for t-channel single top quark production in proton–proton collisions at √s=13Te,Armenia
Quantification of glucose-6-phosphate dehydrogenase activity by spectrophotometry: A systematic review and meta-analysis,Australia
Cationic Polylactic Acid-Based Nanoparticles Improve BSA-FITC Transport Across M Cells and Engulfment by Porcine Alveolar Macrophages,Thailand
The role of preoperative parenteral nutrition,Thailand
Cyanidin attenuates methylglyoxal-induced oxidative stress and apoptosis in ins-1 pancreatic β-cells by increasing glyoxalase-1 activity,Thailand
"Growth, Body Composition, and Neurodevelopmental Outcomes at 2 Years among Preterm Infants Fed an Exclusive Human Milk Diet in the Neonatal Intensive Care Unit: A Pilot Study",United States
Search for an excited lepton that decays via a contact interaction to a lepton and two jets in proton-proton collisions at √s = 13 TeV,Armenia
The development and validation of a hazard perception test for Thai drivers,Thailand
"Degradation mechanism of 2,4-dichlorophenol by fungi isolated from marine invertebrates",Greece
"Search for direct top squark pair production in events with one lepton, jets, and missing transverse momentum at 13 TeV with the CMS experiment",Armenia
Search for high mass dijet resonances with a new background prediction method in proton-proton collisions at √s = 13 TeV,Armenia
Review of upper limb exoskeleton for rehabilitation and assistive application,Thailand
Gut leakage enhances sepsis susceptibility in iron-overloaded β-thalassemia mice through macrophage hyperinflammatory responses,Thailand
High-capacity dual-electrolyte aluminum-air battery with circulating methanol anolyte,Thailand
The causal connection of natural resources and globalization with energy consumption in top Asian countries: evidence from a nonparametric causality-in-quantile approach,Malaysia
Early childhood caries and its associated factors among 9-to 18-month old exclusively breastfed children in thailand: A cross-sectional study,Thailand
Benzoxazine dimer analogue targets integrin β3 in lung cancer cells and suppresses anoikis resistance and migration,Thailand
Levansucrase from bacillus amyloliquefaciens kk9 and its y237s variant producing the high bioactive levan-type fructooligosaccharides,Thailand
"Hiring discrimination against highly competent candidates: An investigation of competence and warmth stereotypes, and cooperative/competitive mindsets",Thailand
IR microspectroscopic identification of microplastics in municipal wastewater treatment plants,Thailand
Cost-Effectiveness Analysis of Xpert MTB/RIF for Multi-Outcomes of Presumptive Pulmonary Tuberculosis Patients in Thailand,Thailand
"Successful pregnancy following chemotherapy in a survivor of small cell carcinoma of the ovary, hypercalcemic type (SCCOHT): A case report and review of literature",United States
Binder-free α-MnO2 nanowires on carbon cloth as cathode material for zinc-ion batteries,Thailand
Heuristic Algorithms for Aggregated HVAC Control via Smart Thermostats for Regulation Service,United States
Gastric peroral endoscopic pyloromyotomy versus gastric electrical stimulation in the treatment of refractory gastroparesis: A propensity score-matched analysis of long term outcomes,United States
National screening programs for cervical cancer in Asian countries,Japan
The First Asian Kidney Transplantation Prediction Models for Long-term Patient and Allograft Survival,Thailand
Role of Zeolite-Supported Nanoscale Zero-Valent Iron in Selenate Removal,Thailand
Comparison of exercise training and estrogen supplementation on mast cellmediated doxorubicin-induced cardiotoxicity,Thailand
On-farm lambing outcomes after transfer of vitrified and slow frozen embryos,Thailand
Relationships Between Pharmaceutical Therapy–Related Quality of Life and Health Utility Scores in Thai Patients With Chronic Diseases,Thailand
Indetermination of indeterminate biliary strictures,Thailand
Synthesis of reusable biobased nano-catalyst from waste sugarcane bagasse for biodiesel production,Malaysia
Determination of anti-leishmanial drugs efficacy against Leishmania martiniquensis using a colorimetric assay,Thailand
Multi Response Optimization of Bioactive Starch Foam Composite Using Taguchi’s Method and Grey Relational Analysis,Thailand
Potential Thai medicinal plants for neurodegenerative diseases: A review focusing on the anti-glutamate toxicity effect,Thailand
Determination of radiation dose and low-dose protocol for digital chest tomosynthesis using radiophotoluminescent (RPL) glass dosimeters,Thailand
The wake of a three-dimensional underwater obstacle: Effect of bottom boundary conditions,United States
The impact of corrected field output factors based on IAEA/AAPM code of practice on small-field dosimetry to the calculated monitor unit in eclipse™ treatment planning system,Thailand
"Immune response and protective efficacy of intramuscular and intradermal vaccination with porcine reproductive and respiratory syndrome virus 1 (PRRSV-1) modified live vaccine against highly pathogenic PRRSV-2 (HP-PRRSV-2) challenge, either alone or in combination with of PRRSV-1",Thailand
Fatty acid–binding protein 4 downregulation drives calcification in the development of kidney stone disease,United States
Returns to education among the informally employed in Thailand,Thailand
Is childhood obstructive sleep apnoea an independent risk factor of hypertension in adulthood?,Australia
International comparison of peritoneal dialysis prescriptions from the Peritoneal Dialysis Outcomes and Practice Patterns Study (PDOPPS),Hong Kong
Hepatic expression of HGF/C-met and native liver survival in biliary atresia,Thailand
Effect of lidocaine nebuliser compared with NSS nebuliser in reducing cough symptom and pain in early tracheostomy care,Thailand
Mastering nocturnal jigsaws in Parkinson’s disease: a dusk-to-dawn review of night-time symptoms,Thailand
Molecular approaches to allergen-specific immunotherapy: Are we so far from clinical implementation?,Thailand
Superhydrophobic surface modification for corrosion protection of metals and alloys,Thailand
Global Retinoblastoma Presentation and Analysis by National Income Level,United Kingdom
Multi-model projections of precipitation extremes in Southeast Asia based on CORDEX-Southeast Asia simulations,Malaysia
The evolutionarily conserved HtrA is associated with stress tolerance and protein homeostasis in the halotolerant cyanobacterium Halothece sp. PCC7418,Thailand
Modulation of DNA and RNA by PNA,Thailand
Adsorptions of lithium ion/atom and packing of Li ions on graphene quantum dots: Application for Li-ion battery,Thailand
"The clinical characteristics, pre- and post–liver transplantation outcomes in patients having autoimmune overlap syndromes",Thailand
Genetic and clinical risk factors associated with phenytoin-induced cutaneous adverse drug reactions in Thai population,Thailand
Phase inversion temperature-fabricated cinnamon oil nanoemulsion as a natural preservative for prolonging shelf-life of chilled Asian seabass (Lates calcarifer) fillets,Thailand
Dynamic feedback control of day-to-day traffic disequilibrium process,China
Increased Levels of Plasma Tumor Necrosis Factor-α Mediate Schizophrenia Symptom Dimensions and Neurocognitive Impairments and Are Inversely Associated with Natural IgM Directed to Malondialdehyde and Paraoxonase 1 Activity,Thailand
Silver nanoparticle/bacterial nanocellulose paper composites for paste-and-read SERS detection of pesticides on fruit surfaces,Thailand
Impaired ability to turn in bed in parkinson's disease as a potential rare cause of positional asphyxia: a sensor-based analysis,Thailand
Alginate microencapsulated human hepatocytes for the treatment of acute liver failure in children,United Kingdom
Virus-like particles displaying major house dust mite allergen Der p 2 for prophylactic allergen immunotherapy,Thailand
Neurodevelopmental pathways in bipolar disorder,Canada
Systemic distribution of progesterone receptor subtypes in human tissues,Japan
Enhanced H2 production with efficient N2-fixation by fructose mixotrophically grown Anabaena sp. PCC 7120 strain disrupted in uptake hydrogenase,Thailand
Enhancing purchase intention in circular economy: An empirical evidence of remanufactured automotive product in Thailand,Thailand
Comprehensive investigation on bond mechanism of embedded through-section fiber-reinforced polymer bars to concrete for structural analysis,Thailand
Antioxidant and Anti-inflammatory Diagnostic Biomarkers in Multiple Sclerosis: A Machine Learning Study,Brazil
"Duck Tembusu virus detection and characterization from mosquitoes in duck farms, Thailand",Thailand
An iterative elastic SBFE approach for collapse load analysis of inelastic structures,Australia
Synthesis and electrochemical performance of LiV3O8/graphene for aqueous lithium batteries,Malaysia
Unilateral breast enlargement secondary to hemodialysis arteriovenous fistula,Thailand
Risk factors of foot and mouth disease in an endemic area on low vaccination rate in Xayaboury province of Lao People’s Democratic Republic (Lao PDR),Laos
Trinucleotide repeat expansion in the transcription factor 4 (TCF4) gene in Thai patients with Fuchs endothelial corneal dystrophy,Japan
Optimal scheduling of electric vehicles aggregator under market price uncertainty using robust optimization technique,China
"The Effects of Restricted Protein Diet Supplemented With Ketoanalogue on Renal Function, Blood Pressure, Nutritional Status, and Chronic Kidney Disease-Mineral and Bone Disorder in Chronic Kidney Disease Patients: A Systematic Review and Meta-Analysis",Thailand
The potential use of cross-linked alginate/gelatin hydrogels containing silver nanoparticles for wound dressing applications,Thailand
Physical and psychological predictors on pain intensity in conscripts with plantar fasciitis,Thailand
Predicting bacteria causing acute bacterial rhinosinusitis by clinical features Predição de bactérias causadoras de rinossinusite bacteriana aguda por características clínicas,Thailand
Student and feedback: Which type of feedback is preferable?,Thailand
"Creative leadership strategies for primary school principals to promote teachers’ creativity in Guangxi, China",Thailand
Use of metal mesh to assist the multi-phase reaction in a microreactor,Thailand
Constructing MoS2/g-C3N4 heterojunction with enhanced oxygen evolution reaction activity: A theoretical insight,China
"Corrigendum: Fertility Preservation for Child and Adolescent Cancer Patients in Asian Countries (Frontiers in Endocrinology, (2019), 10, 10.3389/fendo.2019.00655)",Japan
Cortical superficial siderosis progression in cerebral amyloid angiopathy: Prospective MRI study,{}
Asian CHI symposium: HCI research from asia and on asian contexts and cultures,Japan
Atomic diffusion mediated by vacancy defects in L12-Zr3Al: A first-principles study,China
An introduction to deep convolutional neural networks with keras,Pakistan
Large-scale Distributive Matrix Collaborative Filtering for Recommender System,China
Visual-based Items Recommendation Using Deep Neural Network,China
Constraints on the χc1 versus χc2 Polarizations in Proton-Proton Collisions at s =8 TeV,Armenia
Elucidating the Regulon of a Fur-like Protein in Mycobacterium avium subsp. paratuberculosis (MAP),United States
Ethyl acetate extract of kaempferia parviflora inhibits helicobacter pyloriassociated mammalian cell inflammation by regulating proinflammatory cytokine expression and leukocyte chemotaxis,Thailand
Long-Term Isotope Evidence on the Diet and Habitat Breadth of Pleistocene to Holocene Caprines in Thailand: Implications for the Extirpation and Conservation of Himalayan Gorals,Thailand
A Well-Defined Core–Shell-Structured Capsule Catalyst for Direct Conversion of CO2 into Liquefied Petroleum Gas,Japan
Rocking vibrations of rigid foundations on multi-layered poroelastic media,Thailand
Comparison of two caries prevention programs among Thai kindergarten: A randomized controlled trial,Thailand
A highly responsive methanol sensor based on graphene oxide/polyindole composites,Thailand
"Middle Permian (Roadian) gastropods from the Khao Khad Formation, Central Thailand: Implications for palaeogeography of the Indochina Terrane",Germany
Performance analysis and temperature gradient of solid oxide fuel cell stacks operated with bio-oil sorption-enhanced steam reforming,Thailand
Aryl ethynylpyrene as fluorescent sensors for cyanide ions in aqueous media,Thailand
Computational Study of the Evolution of Ni-Based Catalysts during the Dry Reforming of Methane,United States
Supersymmetric solutions of 7D maximal gauged supergravity,Thailand
Rapid Low-Cost Microarray-Based Genotyping for Genetic Screening in Primary Immunodeficiency,Netherlands
Electrochemical immunosensor functionalized with nanobodies for the detection of the toxic microalgae Alexandrium minutum using glassy carbon electrode modified with gold nanoparticles,Slovenia
Quantitative analysis of calcium carbonate formation in magnetized water,Thailand
Neoproterozoic to Early Triassic tectono-stratigraphic evolution of Indochina and adjacent areas: A review with new data,Viet Nam
Bacterial cellulose membrane conjugated with plant-derived osteopontin: Preparation and its potential for bone tissue regeneration,Thailand
"Hydrochemical, geophysical and multivariate statistical investigation of the seawater intrusion in the coastal aquifer at Phetchaburi Province, Thailand",Thailand
Photocatalytic zinc oxide on flexible polyacrylonitrile nanofibers via sol–gel coaxial electrospinning,Thailand
A Control System for Maintaining Passenger Cabin Air Quality,Thailand
Epigenetic TET-Catalyzed Oxidative Products of 5-Methylcytosine Impede Z-DNA Formation of CG Decamers,Thailand
"Investigating carbon dioxide absorption by urban trees in a new park of Bangkok, Thailand",Thailand
Husband's willingness-to-pay for HIV and syphilis screening at antenatal care clinic under the Thai universal coverage scheme,Thailand
Study of excited Λb 0 states decaying to Λb 0π+π− in proton-proton collisions at s=13TeV,Armenia
Measurement of the tt‾bb‾ production cross section in the all-jet final state in pp collisions at s=13 TeV,Armenia
