title,publisher,aggregationType,subject_area_abbrevs,subject_area_names,SNIP,SJR,citeScoreTracker_2024,citeScoreCurrentMetric_2023,publicationCount_2022,citeCountSCE_2022,zeroCitesSCE_2022,revPercent_2022,publicationCount_2023,citeCountSCE_2023,zeroCitesSCE_2023,revPercent_2023,publicationCount_2024,citeCountSCE_2024,zeroCitesSCE_2024,revPercent_2024
Cyprus Review,University of Nicosia,journal,ECON;SOCI,Law;Social Sciences (miscellaneous);Sociology and Political Science;Economics and Econometrics,0.153,0.143,0.4,0.4,15,101,13,0.0,14,138,12,0.0,5,122,5,0.0
DLSU Business and Economics Review,De la Salle University,journal,ECON;BUSI,"Economics, Econometrics and Finance (all);Marketing;Strategy and Management;Accounting",0.478,0.172,0.6,0.8,25,155,17,0.0,23,176,20,4.35,21,146,21,0.0
Danube,De Gruyter Open Ltd.,journal,ECON;SOCI,"Law;Economics, Econometrics and Finance (all)",0.356,0.194,1.0,1.3,17,69,9,0.0,20,90,17,0.0,10,73,10,0.0
De Economist,Springer Netherlands,journal,ECON,Economics and Econometrics,0.846,0.337,2.8,2.9,18,562,7,0.0,14,627,10,0.0,10,540,10,0.0
Decisions in Economics and Finance,Springer-Verlag Italia s.r.l.,journal,ECON,"Finance;Economics, Econometrics and Finance (all)",0.715,0.458,3.1,2.5,23,239,10,0.0,40,320,27,0.0,73,336,65,0.0
Defence and Peace Economics,Routledge,journal,ECON;SOCI,Social Sciences (miscellaneous);Economics and Econometrics,1.294,0.539,3.9,4.0,55,1071,9,1.82,76,1347,31,1.32,83,1491,55,3.61
Desarrollo y Sociedad,"Universidad de los Andes, Colombia",journal,ECON;SOCI,Political Science and International Relations;Sociology and Political Science;Economics and Econometrics;Development,0.34,0.155,0.7,1.0,23,106,16,0.0,15,135,11,0.0,13,97,12,0.0
Developing Economies,Wiley-Blackwell,journal,ECON;SOCI,Economics and Econometrics;Development,0.771,0.506,4.0,3.6,7,668,2,0.0,10,641,4,0.0,19,473,16,0.0
Development Engineering,Elsevier Ltd,journal,ECON;ENGI;SOCI;COMP,"Engineering (all);Computer Science Applications;Economics, Econometrics and Finance (all);Development",0.93,0.329,6.1,4.9,14,307,0,7.14,9,316,0,0.0,0,259,0,0.0
Documenti Geografici,Universita degli Studi di Roma Tor Vergata,journal,ECON;ARTS;SOCI,"History;Economics, Econometrics and Finance (miscellaneous);Geography, Planning and Development",0.116,0.120,0.2,0.5,74,35,65,27.03,98,27,94,8.16,50,25,50,20.0
Dynamic Games and Applications,Springer Science + Business Media,journal,ECON;MATH;COMP,Computer Graphics and Computer-Aided Design;Economics and Econometrics;Computational Theory and Mathematics;Computational Mathematics;Computer Science Applications;Statistics and Probability;Applied Mathematics,1.159,0.627,3.3,3.2,56,595,12,1.79,56,690,18,1.79,97,673,77,1.03
Dynamic Relationships Management Journal,Slovenian Academy of Management,journal,PSYC;BUSI;ECON,"Economics, Econometrics and Finance (miscellaneous);Social Psychology;Organizational Behavior and Human Resource Management;Strategy and Management",0.094,0.149,0.4,0.6,13,25,10,0.0,17,48,13,0.0,5,39,5,0.0
E a M: Ekonomie a Management,Technical University of Liberec,journal,ECON;BUSI,"Economics, Econometrics and Finance (all);Strategy and Management;Business and International Management",0.499,0.317,2.6,2.7,47,632,10,0.0,46,691,22,0.0,39,533,35,2.56
ECONOMICS - Innovative and Economics Research Journal,Sciendo,journal,ECON;BUSI,"Economics, Econometrics and Finance (all);Business and International Management",0.858,0.511,3.9,3.2,21,123,3,38.1,40,197,11,7.5,47,207,39,0.0
EEAG Report on the European Economy,Ifo institute for Economic Research e.V.,journal,ECON,"Economics, Econometrics and Finance (all)",0,0.102,0.1,0.2,5,6,4,0.0,0,6,0,0.0,0,3,0,0.0
Eastern Economic Journal,Palgrave Macmillan Ltd.,journal,ECON,Economics and Econometrics,0.562,0.349,2.2,2.1,23,438,14,0.0,34,440,19,0.0,34,450,32,0.0
Eastern European Economics,Taylor and Francis Ltd.,journal,ECON,Economics and Econometrics,0.791,0.345,2.1,2.2,25,442,5,0.0,38,539,14,0.0,64,543,48,0.0
Eastern Journal of European Studies,Universitatea Alexandru Ioan Cuza,journal,ECON;ARTS;SOCI,"History;Sociology and Political Science;Economics, Econometrics and Finance (all);Political Science and International Relations",0.476,0.224,1.2,1.3,43,123,19,0.0,35,174,23,5.71,16,133,16,0.0
Ecological Economics,Elsevier B.V.,journal,ECON;ENVI,Environmental Science (all);Economics and Econometrics,1.856,1.983,11.7,12.0,299,38833,5,2.34,285,39639,19,3.51,264,35725,137,4.55
"Ecology, Economy and Society",Indian Society for Ecological Economics (INSEE),journal,ECON;AGRI;ENVI,"Nature and Landscape Conservation;Global and Planetary Change;Economics and Econometrics;Forestry;Ecology, Evolution, Behavior and Systematics;Ecology",0.455,0.186,1.5,1.3,23,49,10,0.0,22,73,12,0.0,13,68,10,7.69
Econ Journal Watch,Institute of Spontaneous Order Economics,journal,ECON,Economics and Econometrics,0.575,0.189,1.1,1.0,22,154,11,0.0,24,137,22,0.0,19,143,17,0.0
Econometric Reviews,Taylor and Francis Ltd.,journal,ECON,Economics and Econometrics,1.002,1.051,1.8,1.7,49,2791,22,0.0,34,3239,22,0.0,41,3111,34,0.0
Econometric Theory,Cambridge University Press,journal,ECON;SOCI,Social Sciences (miscellaneous);Economics and Econometrics,1.174,1.393,2.2,1.9,45,3468,14,0.0,62,3501,31,0.0,40,3508,31,0.0
Econometrica,Wiley-Blackwell Publishing Ltd,journal,ECON,Economics and Econometrics,5.159,17.701,11.6,11.0,93,19512,11,0.0,79,21705,18,0.0,63,20759,45,0.0
Econometrics,Multidisciplinary Digital Publishing Institute (MDPI),journal,ECON,Economics and Econometrics,0.802,0.604,2.2,2.4,36,577,8,0.0,27,576,14,0.0,26,590,23,0.0
Econometrics Journal,Oxford University Press,journal,ECON,Economics and Econometrics,1.871,3.244,6.5,4.2,36,1390,8,0.0,30,1743,14,0.0,24,1914,16,0.0
Econometrics and Statistics,Elsevier B.V.,journal,ECON;DECI;MATH,"Statistics, Probability and Uncertainty;Statistics and Probability;Economics and Econometrics",1.025,0.690,3.6,3.1,77,328,23,0.0,88,434,30,0.0,73,553,40,0.0
EconomiA,Emerald Publishing,journal,ECON,"Economics, Econometrics and Finance (miscellaneous)",1.53,0.398,2.0,3.9,8,262,4,0.0,15,306,9,6.67,26,304,25,0.0
Economia,LSE Press,journal,ECON;BUSI;SOCI,"Political Science and International Relations;Economics, Econometrics and Finance (all);Business and International Management",0.551,0.116,0.4,0.4,0,23,0,0.0,13,23,8,0.0,18,41,16,0.0
Economia Agro-Alimentare,FrancoAngeli,journal,ECON;VETE;ENVI;BUSI;SOCI;AGRI,"Social Sciences (miscellaneous);Business, Management and Accounting (all);Geography, Planning and Development;Food Animals;Agronomy and Crop Science;Economics and Econometrics;Food Science;Agricultural and Biological Sciences (miscellaneous);Management, Monitoring, Policy and Law",0.331,0.182,1.8,1.4,24,141,11,0.0,27,137,16,0.0,7,128,7,14.29
Economia Aplicada,University of Sao Paolo,journal,ECON,"Economics, Econometrics and Finance (all)",0.187,0.139,0.3,0.3,20,148,15,0.0,0,134,0,0.0,0,118,0,0.0
Economia Politica,Springer International Publishing AG,journal,ECON;SOCI,Finance;Sociology and Political Science;Economics and Econometrics,0.922,0.701,4.1,3.9,48,431,7,0.0,33,582,14,0.0,38,595,29,0.0
Economia Pubblica,FrancoAngeli,journal,ECON,"Economics, Econometrics and Finance (all)",0.046,0.116,0.2,0.2,22,9,20,0.0,24,5,22,0.0,12,11,12,0.0
Economia y Politica,Universidad Adolfo Ibanez,journal,ECON;SOCI,Political Science and International Relations;Sociology and Political Science;Cultural Studies;Economics and Econometrics,0.31,0.141,0.6,0.7,10,13,7,0.0,10,23,10,20.0,0,10,0,0.0
Economic Alternatives,University of National and World Economy,journal,ECON,"Economics, Econometrics and Finance (all)",0.387,0.149,0.7,0.7,38,41,20,0.0,48,83,33,0.0,37,98,34,0.0
Economic Analysis and Policy,Elsevier B.V.,journal,ECON,Economics and Econometrics,1.89,1.597,12.5,9.8,225,3425,11,0.0,343,6352,36,0.0,242,8350,96,0.0
Economic Annals,University of Belgrade,journal,ECON,"Economics, Econometrics and Finance (all)",0.284,0.163,0.9,0.9,21,188,8,0.0,21,168,17,0.0,5,164,4,0.0
Economic Annals-XXI,Institute of Society Transformation,journal,ECON;SOCI,"Sociology and Political Science;Economics, Econometrics and Finance (all)",0.333,0.181,1.6,1.5,41,599,24,2.44,51,572,39,0.0,0,393,0,0.0
Economic Anthropology,John Wiley and Sons Inc,journal,ECON;SOCI,Economics and Econometrics;Anthropology,0.762,0.667,2.5,2.6,29,203,6,0.0,26,256,14,0.0,34,239,27,0.0
Economic Change and Restructuring,Springer Netherlands,journal,ECON,Economics and Econometrics,1.34,0.713,6.3,4.8,93,740,10,0.0,174,1455,26,0.0,238,1843,163,0.0
Economic Computation and Economic Cybernetics Studies and Research,Editura Academia de studii economice,journal,ECON;MATH;COMP,Computer Science Applications;Economics and Econometrics;Applied Mathematics,0.468,0.238,1.9,1.8,79,650,22,0.0,76,787,48,0.0,59,629,54,0.0
Economic Development Quarterly,SAGE Publications Inc.,journal,ECON;SOCI,Economics and Econometrics;Urban Studies;Development,0.831,0.532,2.8,2.2,26,1220,6,0.0,33,1281,15,0.0,24,1163,22,0.0
Economic Development and Cultural Change,University of Chicago Press,journal,ECON;SOCI,Economics and Econometrics;Development,1.136,1.100,3.1,3.7,43,2941,2,0.0,39,2918,15,0.0,63,2662,42,0.0
Economic Geography,Taylor and Francis Ltd.,journal,ECON;SOCI,"Geography, Planning and Development;Economics and Econometrics",2.281,2.106,9.8,9.7,20,3283,0,0.0,21,3626,1,0.0,15,3122,7,0.0
Economic History Review,Wiley-Blackwell Publishing Ltd,journal,ECON;ARTS,History;Economics and Econometrics,2.199,1.266,2.9,3.6,50,2627,7,0.0,56,3410,22,3.57,93,2635,69,6.45
Economic History of Developing Regions,Taylor and Francis Ltd.,journal,ECON;ARTS;SOCI,History;Economics and Econometrics;Development,0.994,0.323,1.4,1.3,13,195,5,0.0,13,237,6,15.38,10,214,10,10.0
Economic Horizons,University of Kragujevac - Faculty of Economics,journal,ECON;BUSI,"Business, Management and Accounting (all);Economics, Econometrics and Finance (all)",0.277,0.166,1.3,1.0,20,24,12,25.0,21,40,15,28.57,12,39,11,33.33
Economic Inquiry,Wiley-Blackwell Publishing Ltd,journal,ECON;BUSI,"Business, Management and Accounting (all);Economics and Econometrics",1.187,1.159,3.7,3.8,88,4571,21,0.0,52,4904,29,0.0,92,4399,76,0.0
Economic Journal,Wiley-Blackwell,journal,ECON,Economics and Econometrics,2.532,4.507,7.2,6.6,107,13618,9,0.0,108,14126,25,0.0,97,13516,53,0.0
Economic Modelling,Elsevier B.V.,journal,ECON,Economics and Econometrics,1.785,1.335,8.0,8.0,295,14933,24,0.0,397,16944,75,0.0,262,17543,173,0.0
Economic Notes,Wiley-Blackwell Publishing Ltd,journal,ECON,Economics and Econometrics,0.786,0.350,1.6,3.3,18,329,7,0.0,9,345,2,0.0,21,347,20,0.0
Economic Outlook,Wiley-Blackwell Publishing Ltd,journal,ECON,Economics and Econometrics,0.03,0.103,0.0,0.2,50,29,46,0.0,45,33,44,0.0,44,20,44,0.0
Economic Papers,John Wiley and Sons Inc,journal,ECON,"Economics, Econometrics and Finance (all)",0.567,0.302,1.6,2.3,27,409,12,0.0,22,419,10,4.55,23,383,22,0.0
Economic Policy,Oxford University Press,journal,ECON;ENVI,"Management, Monitoring, Policy and Law;Economics and Econometrics",2.564,2.229,6.9,4.8,62,2067,43,0.0,55,2231,44,0.0,42,2216,34,0.0
Economic Record,Wiley-Blackwell Publishing Ltd,journal,ECON,Economics and Econometrics,0.614,0.379,1.9,1.9,20,1445,7,0.0,26,1378,13,7.69,23,1235,23,4.35
Economic Research Guardian,Weissberg SRL,journal,ECON;SOCI,"Economics, Econometrics and Finance (miscellaneous);Sociology and Political Science;Geography, Planning and Development;Economics and Econometrics",0.459,0.188,1.2,1.0,8,17,3,0.0,8,43,7,0.0,4,41,4,0.0
Economic Research-Ekonomska Istrazivanja,Taylor and Francis Ltd.,journal,ECON,Economics and Econometrics,1.228,0.830,9.6,7.1,364,4997,21,1.37,533,7275,104,1.13,21,7061,14,0.0
Economic Systems,Elsevier B.V.,journal,ECON,Economics and Econometrics,1.303,0.701,5.0,4.9,59,1925,3,0.0,65,2240,12,0.0,90,2289,53,0.0
Economic Systems Research,Routledge,journal,ECON,Economics and Econometrics,1.375,0.894,4.8,5.6,24,2045,2,0.0,34,1689,7,0.0,35,1409,19,0.0
Economic Theory,Springer New York,journal,ECON,Economics and Econometrics,1.193,1.217,2.7,2.5,82,2394,27,0.0,83,2433,46,0.0,121,2166,98,0.0
Economic Thought,World Economics Association,journal,ECON,"Economics, Econometrics and Finance (miscellaneous);Economics and Econometrics",0.062,0.113,0.4,0.4,0,12,0,0.0,7,17,7,0.0,0,10,0,0.0
Economic and Labour Relations Review,Cambridge University Press,journal,ECON;BUSI,Organizational Behavior and Human Resource Management;Economics and Econometrics,0.947,0.575,2.9,4.6,43,781,6,0.0,60,875,37,3.33,29,825,26,0.0
Economic and Political Studies,Routledge,journal,ECON;SOCI,Political Science and International Relations;Sociology and Political Science;Economics and Econometrics,0.952,0.473,3.2,5.6,29,433,8,3.45,30,386,11,6.67,29,425,23,0.0
Economic and Political Weekly,Economic and Political Weekly,journal,ECON;SOCI,"Political Science and International Relations;Economics, Econometrics and Finance (all);Sociology and Political Science",0.537,0.251,0.6,0.9,867,5973,691,14.99,813,6069,718,19.8,641,4964,628,8.89
Economic and Social Review,Economic and Social Studies,journal,ECON;SOCI,Sociology and Political Science;Economics and Econometrics,0.776,0.259,0.6,1.3,10,388,6,0.0,11,403,7,0.0,16,284,16,0.0
Economica,Wiley-Blackwell Publishing Ltd,journal,ECON,Economics and Econometrics,1.065,1.419,2.8,2.4,51,2905,8,0.0,47,2987,16,0.0,61,2876,45,0.0
Economics,Walter de Gruyter GmbH,journal,ECON,"Economics, Econometrics and Finance (all)",0.416,0.212,1.0,1.0,18,558,8,5.56,22,550,12,0.0,69,551,53,5.8
Economics Bulletin,Economics Bulletin,journal,ECON,"Economics, Econometrics and Finance (all)",0.343,0.227,0.6,1.6,114,1765,101,0.0,160,1796,155,0.0,57,1592,54,0.0
Economics Letters,Elsevier B.V.,journal,ECON,Finance;Economics and Econometrics,0.94,0.729,3.1,3.2,365,16366,109,0.0,417,17095,189,0.0,509,16791,423,0.0
Economics and Business Letters,Universidad de Oviedo,journal,ECON;BUSI,"Economics, Econometrics and Finance (all);Business and International Management",0.332,0.250,1.9,1.8,21,138,7,0.0,36,158,21,0.0,16,172,15,0.0
Economics and Business Review,Walter de Gruyter GmbH,journal,ECON;BUSI,Finance;Economics and Econometrics;Business and International Management,0.398,0.234,1.8,1.4,27,55,7,0.0,35,118,24,2.86,25,152,22,0.0
Economics and Environment,Wydawnictwo Ekonomia i Srodowisko,journal,ECON;ENVI,"Management, Monitoring, Policy and Law;Ecology;Economics and Econometrics",0.269,0.184,1.0,0.7,44,55,18,4.55,103,96,69,0.97,79,145,69,0.0
Economics and Philosophy,Cambridge University Press,journal,ECON;ARTS,Economics and Econometrics;Philosophy,0.857,0.375,2.0,1.8,21,683,6,0.0,34,794,15,0.0,46,705,38,0.0
Economics and Policy of Energy and the Environment,FrancoAngeli Edizioni,journal,ECON;ENVI;ENER,"Renewable Energy, Sustainability and the Environment;Management, Monitoring, Policy and Law;Economics and Econometrics",0.086,0.113,0.6,0.5,17,114,12,0.0,11,96,8,0.0,13,93,13,7.69
Economics and Politics,Wiley-Blackwell Publishing Ltd,journal,ECON,Economics and Econometrics,1.023,0.662,2.2,2.4,20,1090,3,0.0,34,1238,11,0.0,73,1223,58,0.0
Economics and Sociology,Centre of Sociological Research,journal,ECON;BUSI;SOCI,"Social Sciences (miscellaneous);Economics, Econometrics and Finance (all);Business, Management and Accounting (miscellaneous)",0.947,0.451,4.9,5.4,71,1231,10,0.0,70,1366,27,0.0,46,1105,39,0.0
Economics of Education Review,Elsevier Ltd,journal,ECON;SOCI,Education;Economics and Econometrics,1.405,1.059,3.2,3.3,80,5625,14,0.0,110,5984,34,0.91,62,5839,47,1.61
Economics of Energy and Environmental Policy,International Association for Energy Economics,journal,ECON;ENVI;ENER,"Management, Monitoring, Policy and Law;Economics and Econometrics;Energy (miscellaneous)",0.597,0.637,2.5,4.0,13,487,4,0.0,22,448,15,0.0,13,337,10,0.0
Economics of Governance,Springer Verlag,journal,ECON;BUSI,"Economics, Econometrics and Finance (all);Business and International Management",0.695,0.298,1.9,1.5,19,384,9,5.26,22,476,16,0.0,14,473,12,0.0
Economics of Innovation and New Technology,Routledge,journal,ECON;BUSI,"Management of Technology and Innovation;Economics, Econometrics and Finance (all)",1.45,0.998,7.4,7.2,32,2496,1,0.0,63,2672,9,0.0,95,2610,55,0.0
Economics of Peace and Security Journal,EPS Publishing,journal,ECON;BUSI;SOCI,"Political Science and International Relations;Economics, Econometrics and Finance (miscellaneous);Management of Technology and Innovation",0.415,0.133,1.4,1.0,7,22,4,0.0,10,18,3,0.0,3,31,3,0.0
Economics of Transition and Institutional Change,John Wiley & Sons Inc.,journal,ECON,"Economics, Econometrics and Finance (miscellaneous);Economics and Econometrics",0.585,0.367,2.0,1.7,35,1026,10,0.0,43,1096,16,0.0,58,990,43,0.0
Economics of Transportation,Elsevier Ltd,journal,ECON;SOCI,"Economics, Econometrics and Finance (miscellaneous);Transportation",1.269,1.185,4.4,5.5,17,491,2,0.0,13,542,5,0.0,16,439,9,0.0
Economie et Statistique,Institut National de la Statistique et des Etudes Economiques,journal,ECON;MATH;SOCI,Sociology and Political Science;Statistics and Probability;Economics and Econometrics,0.381,0.197,1.0,0.7,26,203,14,0.0,18,214,13,0.0,14,216,14,0.0
Economies,Multidisciplinary Digital Publishing Institute (MDPI),journal,ECON;SOCI,"Economics, Econometrics and Finance (miscellaneous);Development",0.999,0.497,4.3,4.0,326,1949,39,2.15,301,3029,86,2.99,281,3405,220,3.2
Economists' Voice,Walter de Gruyter GmbH,journal,ECON;BUSI,"Business, Management and Accounting (all);Economics, Econometrics and Finance (all)",0.286,0.245,1.1,1.1,24,89,9,4.17,29,115,16,0.0,23,112,22,0.0
Economy and Society,Routledge,journal,ECON;ARTS;SOCI,History;Social Sciences (all);Economics and Econometrics,2.166,1.634,5.3,6.3,30,3495,2,0.0,31,3624,5,0.0,26,3213,14,0.0
Economy of Regions,"Institute of Economics, The Ural Branch of Russian Academy of Sciences",journal,ECON;BUSI;ENVI,"Environmental Science (miscellaneous);Economics, Econometrics and Finance (all);Business, Management and Accounting (miscellaneous)",0.833,0.289,1.5,1.8,91,591,44,4.4,93,639,61,2.15,62,409,58,1.61
Education Economics,Routledge,journal,ECON;SOCI,Education;Economics and Econometrics,0.979,0.415,1.8,2.0,35,1105,9,0.0,52,1134,27,0.0,72,1082,56,0.0
Ekonomiaz,Servicio Central Publicaciones. Gobierno vasco,journal,ECON;SOCI,"Economics, Econometrics and Finance (miscellaneous);Sociology and Political Science;Cultural Studies",0.055,0.125,0.3,0.4,25,30,22,0.0,14,34,12,7.14,5,30,5,0.0
Ekonomicheskaya Politika,Editorial Board of the Journal Economic Policy,journal,ECON;SOCI,Finance;Sociology and Political Science;Economics and Econometrics,0.569,0.209,0.9,1.3,32,152,19,0.0,30,164,22,0.0,18,115,18,0.0
Ekonomicheskaya Sotsiologiya,National Research University Higher School of Economics,journal,ECON;SOCI,Sociology and Political Science;Economics and Econometrics,0.577,0.209,0.8,1.1,24,58,11,16.67,23,81,20,4.35,22,52,21,4.55
Ekonomicky Casopis,Slovak Academic Press Ltd,journal,ECON,Economics and Econometrics,0.261,0.147,1.0,1.0,36,286,16,0.0,24,303,17,0.0,8,221,8,0.0
Ekonomika,Vilnius University Press,journal,ECON,"Economics, Econometrics and Finance (all)",0.379,0.293,2.9,1.4,16,23,7,0.0,23,92,17,4.35,16,176,13,0.0
Ekonomiska Samfundets Tidskrift,Economic Society of Finland,journal,ECON,Economics and Econometrics,0,0.100,0.0,0.0,30,1,29,0.0,23,0,23,0.0,12,1,12,25.0
Ekonomski Pregled,Hrvatsko Drustvo Ekonomista,journal,ECON,"Economics, Econometrics and Finance (all)",0.383,0.152,0.6,0.7,40,151,24,0.0,34,177,29,5.88,17,125,17,0.0
Electronic Commerce Research,Kluwer Academic Publishers,journal,ECON;COMP,"Human-Computer Interaction;Economics, Econometrics and Finance (miscellaneous)",1.381,0.811,9.4,7.5,85,1926,2,0.0,224,2539,52,0.0,174,3073,81,0.0
Electronic Markets,Springer Verlag,journal,ECON;BUSI;COMP,Management of Technology and Innovation;Economics and Econometrics;Computer Science Applications;Marketing;Business and International Management,2.29,1.671,19.3,14.8,136,3015,13,0.0,63,4132,12,0.0,54,4965,31,0.0
Emerald Emerging Markets Case Studies,Emerald Group Publishing Ltd.,journal,ECON;BUSI;SOCI,Education;Strategy and Management;Economics and Econometrics;Finance;Business and International Management,0.124,0.142,0.3,0.3,145,154,109,0.69,154,196,129,0.0,109,251,107,0.0
Emerging Markets Finance and Trade,M.E. Sharpe Inc.,journal,ECON,"Finance;Economics, Econometrics and Finance (all)",1.113,0.781,5.7,7.8,287,5156,40,0.0,254,6137,56,0.39,261,6453,191,0.77
Emerging Markets Review,Elsevier B.V.,journal,ECON;BUSI,Economics and Econometrics;Business and International Management,1.886,1.179,8.1,7.1,74,3306,5,5.41,92,3704,12,2.17,96,3892,64,2.08
Empirica,Springer Netherlands,journal,ECON,Economics and Econometrics,0.968,0.426,3.0,2.7,41,684,7,0.0,37,745,15,0.0,43,707,35,0.0
Empirical Economics,Physica-Verlag,journal,ECON;MATH;SOCI,Mathematics (miscellaneous);Social Sciences (miscellaneous);Statistics and Probability;Economics and Econometrics,1.251,0.704,5.3,4.4,221,4951,46,0.0,208,5655,70,0.0,215,5922,158,0.0
Energy Economics,Elsevier B.V.,journal,ECON;ENER,Economics and Econometrics;Energy (all),2.637,3.555,20.3,18.6,566,39880,13,0.0,652,46673,46,0.0,697,50756,325,0.0
Energy Journal,SAGE Publications Ltd,journal,ECON;ENER,Economics and Econometrics;Energy (all),0.954,0.934,5.0,5.1,66,3490,7,0.0,71,3227,11,0.0,10,2863,3,0.0
Energy Research Letters,Asia-Pacific Applied Economics Association,journal,ECON;ENER,"Economics, Econometrics and Finance (all);Energy (miscellaneous);Economics and Econometrics;Energy (all);Finance;Economics, Econometrics and Finance (miscellaneous)",1.369,1.341,5.6,24.9,24,629,4,4.17,24,562,9,16.67,12,409,7,50.0
Energy Systems,Springer Verlag,journal,ECON;MATH;ENER,Modeling and Simulation;Economics and Econometrics;Energy (all),0.769,0.469,6.0,6.4,57,1098,8,15.79,125,1122,49,7.2,109,1151,55,8.26
Engineering Economics,Kauno Technologijos Universitetas,journal,ECON;BUSI;ENGI,Engineering (miscellaneous);Economics and Econometrics;Business and International Management,0.756,0.424,4.9,5.2,39,1173,3,0.0,40,1335,8,0.0,24,1017,16,0.0
Engineering Economist,Taylor and Francis Ltd.,journal,ECON;ENGI;SOCI,Education;Engineering (all);Economics and Econometrics,0.357,0.251,1.6,2.0,20,426,7,0.0,16,401,9,0.0,12,317,11,0.0
Ensayos Sobre Politica Economica,Banco de la Republica Colombia,journal,ECON;SOCI,Political Science and International Relations;Economics and Econometrics,0.936,0.201,1.3,1.5,1,85,0,0.0,3,82,1,0.0,1,67,1,0.0
Entrepreneurial Business and Economics Review,Cracow University of Economics,journal,ECON;BUSI;SOCI,"Political Science and International Relations;Economics, Econometrics and Finance (miscellaneous);Strategy and Management;Business and International Management",1.032,0.544,7.4,7.2,44,859,3,2.27,44,1041,13,2.27,30,1063,25,3.33
Entrepreneurship Theory and Practice,Wiley-Blackwell,journal,ECON;BUSI,Economics and Econometrics;Business and International Management,4.215,5.819,20.3,19.0,60,16452,0,0.0,82,18180,3,0.0,69,18170,25,0.0
Entrepreneurship and Regional Development,Routledge,journal,ECON;BUSI,Economics and Econometrics;Business and International Management,1.627,1.373,6.6,7.9,46,5548,1,0.0,43,5640,9,0.0,94,5325,47,0.0
Entreprises et Histoire,Editions ESKA,journal,ARTS;BUSI;ECON,"History;Economics, Econometrics and Finance (miscellaneous);Business and International Management",0.144,0.125,0.5,0.5,39,92,35,0.0,30,73,27,0.0,50,97,48,14.0
Environment and Development Economics,Cambridge University Press,journal,ECON;SOCI;ENVI,Environmental Science (all);Economics and Econometrics;Development,0.711,0.687,4.7,5.0,32,2412,5,0.0,30,2419,7,0.0,20,2188,16,0.0
"Environment, Development and Sustainability",Springer Science and Business Media B.V.,journal,ECON;SOCI;ENVI,"Management, Monitoring, Policy and Law;Geography, Planning and Development;Economics and Econometrics",1.297,0.889,10.5,10.2,661,12792,28,5.14,1124,17103,219,7.65,2270,21162,1012,8.02
Environmental Economics,LLC CPC Business Perspectives,journal,ECON;SOCI;ENVI;ENER,"Public Administration;Renewable Energy, Sustainability and the Environment;Environmental Science (miscellaneous);Economics and Econometrics;Law;Management, Monitoring, Policy and Law",0.908,0.407,3.7,3.6,14,45,1,0.0,20,155,5,0.0,22,128,15,4.55
Environmental Economics and Policy Studies,Springer Japan,journal,ECON;ENVI,"Management, Monitoring, Policy and Law;Economics and Econometrics",1.042,0.592,4.1,4.8,28,758,2,0.0,24,841,6,0.0,55,863,31,0.0
Environmental and Resource Economics,Springer Science and Business Media B.V.,journal,ECON;ENVI,"Management, Monitoring, Policy and Law;Economics and Econometrics",1.396,1.328,5.6,10.2,106,7639,6,4.72,96,7388,20,0.0,116,6720,88,0.0
Equilibrium. Quarterly Journal of Economics and Economic Policy,Instytut Badan Gospodarczych/Institute of Economic Research (Poland),journal,ECON,"Economics, Econometrics and Finance (miscellaneous);Economics and Econometrics",0.946,0.624,8.8,9.2,36,644,2,0.0,38,665,5,7.89,29,585,20,10.34
Erasmus Journal for Philosophy and Economics,"Faculty of Philosophy, Erasmus University Rotterdam",journal,ECON;ARTS,"Economics, Econometrics and Finance (miscellaneous);Philosophy",0.271,0.308,1.0,0.8,23,64,16,0.0,15,105,13,0.0,23,92,22,0.0
Estonian Discussions on Economic Policy,Mattimar OU,journal,ECON;SOCI,Development;Public Administration;Economics and Econometrics;Finance;Sociology and Political Science,0.63,0.139,0.1,0.1,37,0,35,0.0,34,4,34,0.0,5,4,5,20.0
Estudios Fronterizos,Universidad Autonoma de Baja California,journal,ECON;ARTS;SOCI,"Political Science and International Relations;Geography, Planning and Development;Economics and Econometrics;History;Demography;Sociology and Political Science;Anthropology",0.758,0.455,1.3,1.8,28,71,16,0.0,25,78,15,0.0,15,84,13,0.0
Estudios Gerenciales,Universidad Icesi,journal,ECON;BUSI,Management of Technology and Innovation;Strategy and Management;Economics and Econometrics;Finance;Marketing;Business and International Management,0.53,0.205,2.1,1.7,40,441,10,7.5,33,579,25,12.12,17,398,16,17.65
