title,publisher,aggregationType,subject_area_abbrevs,subject_area_names,SNIP,SJR,citeScoreTracker_2024,citeScoreCurrentMetric_2023,publicationCount_2022,citeCountSCE_2022,zeroCitesSCE_2022,revPercent_2022,publicationCount_2023,citeCountSCE_2023,zeroCitesSCE_2023,revPercent_2023,publicationCount_2024,citeCountSCE_2024,zeroCitesSCE_2024,revPercent_2024
ABAC Journal,Assumption University,journal,ECON;BUSI;SOCI;ARTS,"Education;Social Sciences (miscellaneous);Economics, Econometrics and Finance (all);Literature and Literary Theory;Business, Management and Accounting (all)",0.425,0.189,2.9,2.2,57,89,19,0.0,64,150,27,1.56,44,209,40,4.55
ACM Transactions on Economics and Computation,Association for Computing Machinery (ACM),journal,ECON;BUSI;MATH;COMP,Computer Science (miscellaneous);Economics and Econometrics;Computational Mathematics;Statistics and Probability;Marketing,1.346,0.724,3.8,3.8,10,461,3,0.0,17,537,11,0.0,11,459,8,0.0
ACRN Journal of Finance and Risk Perspectives,ACRN Oxford Ltd.,journal,ECON;BUSI;DECI,"Statistics, Probability and Uncertainty;Accounting;Business and International Management;Finance",0.813,0.376,1.0,3.3,6,74,4,0.0,4,104,3,0.0,0,103,0,0.0
ASTIN Bulletin,Cambridge University Press,journal,ECON;BUSI,Finance;Economics and Econometrics;Accounting,1.19,0.979,3.1,3.2,31,1327,5,0.0,31,1188,7,0.0,31,1156,26,0.0
AStA Advances in Statistical Analysis,Springer Verlag,journal,ECON;MATH;SOCI,Modeling and Simulation;Analysis;Economics and Econometrics;Social Sciences (miscellaneous);Statistics and Probability;Applied Mathematics,1.103,0.480,2.7,2.2,32,553,12,9.38,38,650,8,2.63,43,645,36,0.0
ATA Journal of Legal Tax Research,American Accounting Association,journal,ECON;BUSI;SOCI,Law;Finance;Accounting,0,0.114,0.9,0.5,3,2,2,0.0,3,6,2,0.0,4,11,4,0.0
Academia Economic Papers,Institute of Economics Academia Sinica,journal,ECON,"Economics, Econometrics and Finance (all)",0.308,0.135,0.2,0.3,13,9,10,0.0,12,9,12,0.0,3,7,3,0.0
Academia Revista Latinoamericana de Administracion,Emerald Group Publishing Ltd.,journal,ECON;BUSI;DECI,"Economics, Econometrics and Finance (all);Strategy and Management;Organizational Behavior and Human Resource Management;Management Science and Operations Research;Business and International Management",0.567,0.356,3.3,2.6,29,475,3,0.0,30,509,12,0.0,32,475,27,0.0
Academic Journal of Interdisciplinary Studies,Richtmann Publishing Ltd,journal,ECON;ENVI;BUSI;SOCI;ARTS,"Arts and Humanities (miscellaneous);Social Sciences (all);Environmental Science (miscellaneous);Business, Management and Accounting (miscellaneous);Economics, Econometrics and Finance (miscellaneous)",0.462,0.212,1.9,1.5,172,340,74,1.74,178,597,112,0.0,30,644,26,0.0
Accounting Forum,Taylor and Francis Ltd.,journal,ECON;BUSI,Finance;Accounting,1.196,0.664,5.3,5.2,18,1495,1,0.0,43,1966,10,2.33,44,1907,17,4.55
Accounting Perspectives,John Wiley and Sons Inc,journal,ECON;BUSI,Finance;Accounting,0.738,0.455,3.0,2.6,24,292,7,0.0,20,342,10,0.0,24,398,20,0.0
Accounting Research Journal,Emerald Group Publishing Ltd.,journal,ECON;BUSI,Finance;Accounting,0.938,0.425,4.3,5.0,45,673,6,0.0,30,900,7,3.33,31,1061,20,9.68
Accounting Review,American Accounting Association,journal,ECON;BUSI,Finance;Economics and Econometrics;Accounting,3.187,4.640,6.1,5.8,108,16057,8,0.93,165,18918,64,3.64,93,21248,49,1.08
Accounting and Finance,Wiley-Blackwell,journal,ECON;BUSI,"Economics, Econometrics and Finance (miscellaneous);Finance;Accounting",1.321,0.816,6.0,5.1,143,3257,16,0.0,177,4213,59,0.56,207,5008,153,0.0
Accounting in Europe,Routledge,journal,ECON;BUSI,Accounting;Business and International Management;Finance,1.326,0.733,6.2,5.0,15,397,2,0.0,15,527,6,0.0,27,568,17,0.0
"Accounting, Auditing and Accountability Journal",Emerald Group Publishing Ltd.,journal,ECON;BUSI,"Economics, Econometrics and Finance (miscellaneous);Accounting",2.098,1.847,9.4,9.5,103,7111,12,1.94,102,9514,17,1.96,123,9891,77,5.69
"Accounting, Economics and Law: A Convivium",Walter de Gruyter GmbH,journal,ECON;BUSI;SOCI,"Economics, Econometrics and Finance (miscellaneous);Law;Accounting",0.628,0.391,1.8,2.8,18,170,11,0.0,39,198,13,0.0,31,224,24,0.0
Acta Oeconomica,Akademiai Kiado,journal,ECON,Economics and Econometrics,0.385,0.218,1.3,1.4,35,305,18,5.71,35,324,26,0.0,10,290,10,0.0
Acta Turistica,University of Zagreb Faculty of Economics and Business,journal,ECON;BUSI;SOCI,"Economics, Econometrics and Finance (miscellaneous);Geography, Planning and Development;Tourism, Leisure and Hospitality Management",0.127,0.146,1.1,0.8,7,16,5,14.29,8,18,6,25.0,4,29,4,0.0
Actuel Marx,Presses Universitaires de France,journal,ECON;ARTS;SOCI,Sociology and Political Science;Economics and Econometrics;Philosophy,0.941,0.101,0.3,0.2,25,62,23,4.0,16,76,15,12.5,16,48,16,18.75
Administration,De Gruyter Open Ltd.,journal,ECON;SOCI,"Public Administration;Economics, Econometrics and Finance (miscellaneous);Sociology and Political Science",0.547,0.288,0.8,0.7,25,81,18,4.0,27,104,26,3.7,21,90,21,0.0
Advances in Accounting,Emerald Publishing,journal,ECON;BUSI,Finance;Accounting,0.856,0.422,2.3,2.5,26,1066,3,0.0,27,1169,12,0.0,43,1180,27,0.0
Advances in Austrian Economics,Emerald Group Publishing Ltd.,bookseries,ECON,Economics and Econometrics,0,0.104,1.8,0.4,9,104,3,0.0,0,118,0,0.0,0,90,0,0.0
Advances in Business Marketing and Purchasing,Emerald Group Publishing Ltd.,bookseries,ECON;BUSI,"Economics, Econometrics and Finance (miscellaneous);Marketing",0.138,0.221,0.4,0.0,0,73,0,0.0,26,84,21,0.0,0,85,0,0.0
Advances in Business Related Scientific Research Journal,GEA College – Faculty of Entrepreneurship,journal,ECON;BUSI;SOCI,"Economics, Econometrics and Finance (miscellaneous);Law;Gender Studies;Business, Management and Accounting (miscellaneous)",0.115,0.124,0.7,0.8,10,20,6,0.0,11,13,7,0.0,6,21,6,16.67
Advances in Econometrics,Emerald Group Publishing Ltd.,bookseries,ECON,Economics and Econometrics,0.089,0.153,0.2,1.2,0,828,0,0.0,0,844,0,0.0,15,859,11,0.0
Advances in Environmental Accounting and Management,Emerald Group Publishing Ltd.,bookseries,ECON;BUSI;ENVI,"Economics, Econometrics and Finance (miscellaneous);Management, Monitoring, Policy and Law;Accounting",0.39,0.232,4.1,2.4,7,96,1,0.0,0,96,0,0.0,7,115,7,0.0
Advances in Financial Economics,Emerald Group Publishing Ltd.,bookseries,ECON;BUSI,"Economics, Econometrics and Finance (miscellaneous);Finance;Accounting",0.098,0.147,0.9,0.4,7,101,4,0.0,0,110,0,0.0,0,87,0,0.0
Advances in Spatial Science,Springer Nature,bookseries,ECON;SOCI,"Geography, Planning and Development;Economics and Econometrics",0.454,0.161,1.2,1.0,23,418,19,0.0,54,411,40,0.0,11,367,10,0.0
Advances in Strategic Management,Emerald Group Publishing Ltd.,bookseries,ECON;BUSI,"Economics, Econometrics and Finance (miscellaneous);Strategy and Management",1.576,1.571,1.1,1.0,0,622,0,0.0,11,667,9,0.0,0,668,0,0.0
Advances in Taxation,Emerald Group Publishing Ltd.,bookseries,ECON;BUSI,"Finance;Business, Management and Accounting (miscellaneous)",0.669,0.137,1.0,0.8,0,55,0,0.0,6,77,5,0.0,9,77,9,0.0
Aestimum,Firenze University Press,journal,ECON;SOCI;ENVI,"Nature and Landscape Conservation;Management, Monitoring, Policy and Law;Urban Studies;Economics, Econometrics and Finance (miscellaneous);Ecology",0.49,0.306,2.4,2.3,9,121,0,0.0,5,122,4,0.0,10,140,5,0.0
African Economic History,University of Wisconsin at Madison,journal,ECON;ARTS,History;Economics and Econometrics,1.511,0.148,0.6,0.5,18,102,13,5.56,11,118,9,0.0,6,89,6,0.0
African Finance Journal,University of Stellenbosch,journal,ECON,Finance,0.588,0.135,0.7,0.4,9,39,6,0.0,9,77,7,0.0,4,66,4,0.0
African Journal of Agricultural and Resource Economics,African Association of Agricultural Economists,journal,ECON;AGRI,Agricultural and Biological Sciences (miscellaneous);Economics and Econometrics,0.303,0.213,0.9,1.2,24,73,14,0.0,17,106,14,0.0,5,102,5,0.0
African Journal of Business and Economic Research,Adonis & Abbey Publishers Ltd.,journal,ECON;BUSI,Economics and Econometrics;Business and International Management,0.241,0.165,0.7,0.8,62,121,36,1.61,63,182,50,0.0,47,186,44,0.0
African Journal of Economic and Management Studies,Emerald Group Publishing Ltd.,journal,ECON;BUSI,"Business, Management and Accounting (all);Economics, Econometrics and Finance (all)",0.8,0.401,2.9,3.2,39,668,7,0.0,49,826,12,0.0,68,856,47,0.0
Afro-Asian Journal of Finance and Accounting,Inderscience Enterprises Ltd,journal,ECON;BUSI,Finance;Accounting,0.312,0.170,0.7,0.7,39,171,24,2.56,40,213,30,0.0,41,224,39,0.0
AgBioForum,University of Missouri,journal,ECON;AGRI;BIOC,Biotechnology;Agronomy and Crop Science;Economics and Econometrics;Food Science,0.734,0.357,4.6,4.4,48,524,7,0.0,32,507,19,0.0,6,343,5,0.0
Agraris,"Department of Agribusiness, Universitas Muhammadiyah Yogyakarta",journal,ECON;AGRI;SOCI,Agricultural and Biological Sciences (miscellaneous);Social Sciences (miscellaneous);Economics and Econometrics,0.601,0.219,2.2,1.9,17,44,7,0.0,18,65,10,5.56,9,73,9,22.22
Agrekon,Taylor and Francis Ltd.,journal,ECON;AGRI;SOCI,"Agronomy and Crop Science;Geography, Planning and Development;Economics and Econometrics",0.701,0.355,2.9,2.8,28,781,9,0.0,22,729,9,0.0,14,667,14,0.0
Agribusiness,Wiley-VCH Verlag,journal,ECON;AGRI;SOCI,"Geography, Planning and Development;Agronomy and Crop Science;Economics and Econometrics;Food Science;Animal Science and Zoology",1.203,0.843,5.8,5.5,50,1642,1,0.0,93,1772,24,0.0,120,1628,90,0.0
Agricultural Economics (Czech Republic),Czech Academy of Agricultural Sciences,journal,ECON;AGRI,"Agricultural and Biological Sciences (miscellaneous);Economics, Econometrics and Finance (all)",0.801,0.435,3.6,4.3,48,1249,3,6.25,48,1326,13,2.08,32,1082,28,0.0
Agricultural Economics (United Kingdom),Wiley-Blackwell Publishing Ltd,journal,ECON;AGRI,Agronomy and Crop Science;Economics and Econometrics,1.74,1.601,7.3,7.3,71,5694,10,0.0,51,5951,10,0.0,50,5110,33,0.0
Agricultural Finance Review,Emerald Publishing,journal,ECON;BUSI;AGRI,Agricultural and Biological Sciences (miscellaneous);Finance;Economics and Econometrics;Strategy and Management,1.004,0.564,3.4,3.7,51,758,12,0.0,43,986,12,0.0,24,903,21,4.17
Agricultural History Review,British Agricultural History Society,journal,ECON;ARTS;AGRI,Animal Science and Zoology;Agronomy and Crop Science;Economics and Econometrics;History and Philosophy of Science,1.054,0.145,0.9,0.7,10,182,2,0.0,12,329,5,0.0,5,199,5,0.0
Agricultural and Food Economics,Springer Science and Business Media Deutschland GmbH,journal,ECON;AGRI,Agricultural and Biological Sciences (miscellaneous);Economics and Econometrics;Food Science,1.32,0.780,6.0,5.5,32,908,2,0.0,52,1117,8,5.77,37,1159,27,16.22
Agricultural and Resource Economics Review,Cambridge University Press,journal,ECON;AGRI,Agronomy and Crop Science;Economics and Econometrics,0.702,0.458,2.5,2.2,19,655,3,0.0,29,697,6,0.0,19,555,13,0.0
Agris On-line Papers in Economics and Informatics,Faculty of Economics and Management,journal,ECON;ENVI;SOCI;AGRI;COMP,"Geography, Planning and Development;Computer Science (miscellaneous);Management, Monitoring, Policy and Law;Agricultural and Biological Sciences (miscellaneous);Economics, Econometrics and Finance (miscellaneous)",0.326,0.232,1.9,2.2,40,481,10,0.0,40,495,21,0.0,30,353,26,0.0
Agroalimentaria,Centro de Investigaciones Agroalimentarias (CIAAL),journal,ECON;AGRI;SOCI,"Social Sciences (all);Economics, Econometrics and Finance (all);Food Science",0.048,0.109,0.3,0.4,24,50,20,0.0,19,43,18,0.0,6,40,6,0.0
Agua y Territorio,Universidad de Jaen Campus Las Lagunillas,journal,ECON;ARTS;SOCI,"History;Economics, Econometrics and Finance (miscellaneous);Arts and Humanities (miscellaneous);Geography, Planning and Development",1.046,0.250,0.7,0.5,14,19,8,0.0,35,29,24,2.86,16,29,15,0.0
Algorithmic Finance,IOS Press BV,journal,ECON;MATH;COMP,Finance;Computer Science Applications;Computational Mathematics;Computer Vision and Pattern Recognition,0,0.102,0.5,0.4,5,64,4,0.0,4,66,3,0.0,0,62,0,0.0
America Latina en la Historia Economica,Instituto de Investigaciones Dr. Jose Maria Luis Mora,journal,ECON;ARTS,"History;Economics, Econometrics and Finance (all)",0.598,0.146,0.3,0.3,26,93,19,0.0,26,105,23,0.0,27,59,27,0.0
American Economic Journal: Applied Economics,American Economic Association,journal,ECON,"Economics, Econometrics and Finance (all)",3.854,8.933,8.6,9.1,59,6096,5,0.0,54,6723,0,0.0,32,6811,11,0.0
American Economic Journal: Economic Policy,American Economic Association,journal,ECON,"Economics, Econometrics and Finance (all)",3.631,6.519,9.5,8.2,65,4470,3,0.0,64,5205,8,0.0,32,5518,12,0.0
American Economic Journal: Macroeconomics,American Economic Association,journal,ECON,"Economics, Econometrics and Finance (all)",3.861,12.324,10.3,8.2,54,3496,6,0.0,55,4202,7,0.0,24,4477,9,0.0
American Economic Journal: Microeconomics,American Economic Association,journal,ECON,"Economics, Econometrics and Finance (all)",1.591,3.835,3.8,2.9,82,1595,13,0.0,65,1801,19,0.0,21,1798,11,0.0
American Economic Review,American Economic Association,journal,ECON,Economics and Econometrics,7.493,22.344,17.6,18.6,118,62439,4,2.54,96,66494,16,3.13,61,64968,21,0.0
American Journal of Agricultural Economics,John Wiley & Sons Inc.,journal,ECON;AGRI,Agricultural and Biological Sciences (miscellaneous);Economics and Econometrics,2.005,2.136,10.8,9.1,78,10987,3,0.0,65,10479,5,0.0,98,9129,49,0.0
American Journal of Economics and Sociology,Wiley-Blackwell Publishing Ltd,journal,ECON;SOCI,Sociology and Political Science;Economics and Econometrics,0.698,0.253,1.9,1.9,47,1226,19,0.0,34,1505,20,0.0,69,1342,52,0.0
American Journal of Health Economics,University of Chicago Press,journal,ECON;MEDI,"Economics, Econometrics and Finance (miscellaneous);Health Policy;Public Health, Environmental and Occupational Health",1.17,1.978,5.1,4.3,20,342,3,0.0,23,403,10,0.0,17,428,12,0.0
American Law and Economics Review,Oxford University Press,journal,ECON;SOCI,Law;Finance,0.7,0.274,2.0,1.6,17,399,8,0.0,9,399,8,0.0,0,355,0,0.0
Amfiteatru Economic,Bucharest University of Economic Studies Publishing House,journal,ECON,"Economics, Econometrics and Finance (all)",0.545,0.408,4.0,4.2,60,1013,5,0.0,65,1156,24,1.54,32,950,23,0.0
Annals of Actuarial Science,Cambridge University Press,journal,ECON;DECI;MATH,"Statistics, Probability and Uncertainty;Statistics and Probability;Economics and Econometrics",0.939,0.730,3.7,3.1,28,248,9,3.57,29,240,14,0.0,28,277,21,3.57
Annals of Corporate Governance,Now Publishers Inc,journal,ECON;BUSI;SOCI,"Law;Finance;Business, Management and Accounting (miscellaneous)",0.327,0.248,2.0,1.9,3,12,0,33.33,2,15,1,0.0,2,27,2,50.0
Annals of Economics and Finance,Central University of Finance and Economics,journal,ECON,Finance;Economics and Econometrics,0.54,0.160,0.4,0.7,16,419,8,0.0,18,427,16,0.0,24,367,23,0.0
Annals of Economics and Statistics,Groupe des ecoles nationales d'economie et statistique,journal,ECON;DECI;MATH;SOCI,"Statistics, Probability and Uncertainty;Social Sciences (miscellaneous);Statistics and Probability;Economics and Econometrics",0.297,0.576,0.9,0.8,17,40,9,0.0,16,60,12,0.0,11,87,11,0.0
Annals of Finance,Springer Verlag,journal,ECON,"Finance;Economics, Econometrics and Finance (all)",0.868,0.442,1.4,2.0,20,328,7,0.0,20,358,10,0.0,21,324,20,0.0
Annals of Financial Economics,World Scientific,journal,ECON;BUSI,"Economics and Econometrics;Finance;Business, Management and Accounting (miscellaneous);Economics, Econometrics and Finance (miscellaneous);Business and International Management",0.995,0.580,10.5,6.6,24,257,3,0.0,29,414,7,3.45,9,381,8,0.0
Annals of Public and Cooperative Economics,Wiley-Blackwell,journal,ECON;SOCI,Sociology and Political Science;Economics and Econometrics,1.248,0.595,4.1,3.8,45,1122,3,0.0,51,1320,10,0.0,50,1206,24,0.0
Annals of the Fondazione Luigi Einaudi,Casa Editrice Leo S. Olschki,journal,ECON;ARTS;SOCI,"History;Social Sciences (miscellaneous);Sociology and Political Science;Economics, Econometrics and Finance (all)",0.455,0.118,0.4,0.4,30,36,27,0.0,0,44,0,0.0,0,43,0,0.0
Annual Review of Economics,Annual Reviews Inc.,journal,ECON,Economics and Econometrics,4.037,8.925,10.8,9.7,33,3426,0,100.0,28,4019,3,100.0,23,4439,15,95.65
Annual Review of Financial Economics,Annual Reviews Inc.,journal,ECON,Finance;Economics and Econometrics,2.246,4.854,9.6,5.0,25,1250,2,96.0,32,1559,16,84.38,0,1833,0,0.0
Annual Review of Resource Economics,Annual Reviews Inc.,journal,ECON,Economics and Econometrics,1.733,2.032,9.9,9.4,32,1740,0,68.75,24,1928,2,87.5,0,2090,0,0.0
Antitrust Bulletin,SAGE Publications Inc.,journal,ECON;SOCI,Law;Economics and Econometrics,0.812,0.353,1.7,1.3,34,334,14,0.0,34,403,23,0.0,4,291,4,0.0
Applied Computer Science,Polish Association for Knowledge Promotion,journal,ECON;ENGI;COMP,"Artificial Intelligence;Industrial and Manufacturing Engineering;Mechanical Engineering;Computer Science Applications;Economics, Econometrics and Finance (miscellaneous);Biomedical Engineering;Control and Systems Engineering;Information Systems",0.321,0.148,2.1,1.5,32,87,13,0.0,39,90,19,0.0,14,169,12,0.0
Applied Econometrics,Russian Presidential Academy of National Economy and Public Administration,journal,ECON;SOCI,"Economics, Econometrics and Finance (miscellaneous);Economics, Econometrics and Finance (all);Social Sciences (miscellaneous);Economics and Econometrics",0.477,0.174,0.7,0.7,26,169,14,0.0,28,159,23,0.0,18,161,14,0.0
Applied Econometrics and International Development,Euro-American Association of Economic Development Studies,journal,ECON;SOCI,Political Science and International Relations;Finance;Economics and Econometrics;Development,0.358,0.196,0.9,1.2,12,170,4,0.0,14,166,8,0.0,22,156,21,4.55
Applied Economic Analysis,Emerald Group Publishing Ltd.,journal,ECON,"Economics, Econometrics and Finance (all)",0.892,0.492,3.0,3.5,14,161,0,0.0,13,236,7,7.69,17,245,10,0.0
Applied Economic Perspectives and Policy,John Wiley & Sons Inc.,journal,ECON;SOCI,Economics and Econometrics;Development,1.885,1.796,11.1,10.7,115,2762,20,0.0,110,3205,21,0.0,95,2969,60,0.0
Applied Economics,Taylor and Francis Ltd.,journal,ECON,Economics and Econometrics,0.9,0.590,4.0,3.8,421,14014,73,0.0,523,14873,194,0.0,1008,14937,673,0.0
Applied Economics Letters,Routledge,journal,ECON,Economics and Econometrics,0.676,0.376,3.0,2.9,336,6011,88,0.0,665,6661,303,0.0,880,6644,660,0.0
Applied Economics Quarterly,Duncker und Humblot GmbH,journal,ECON,"Economics, Econometrics and Finance (all)",0.337,0.151,0.7,0.5,9,22,8,0.0,0,39,0,0.0,0,33,0,0.0
Applied Health Economics and Health Policy,Springer International Publishing AG,journal,ECON;MEDI,Economics and Econometrics;Health Policy,1.098,0.990,5.5,6.1,79,2397,11,21.52,77,2272,14,23.38,89,2178,69,23.6
Applied Mathematical Finance,Routledge,journal,ECON;MATH,Finance;Applied Mathematics,0.623,0.474,2.8,2.3,17,438,8,0.0,10,499,7,0.0,5,449,5,0.0
Apuntes,Universidad del Pacifico Press,journal,ECON;SOCI,"Social Sciences (all);Economics, Econometrics and Finance (all)",0.858,0.233,0.9,0.7,24,26,13,4.17,24,37,16,0.0,6,49,6,0.0
Apuntes del Cenes,Universidad Pedagogica y Tecnologica de Colombia,journal,ECON,"Economics, Econometrics and Finance (all)",0.228,0.130,0.5,0.4,20,13,9,5.0,20,16,16,5.0,16,25,16,0.0
Argumenta Oeconomica,Wroclaw University Economics,journal,ECON;BUSI,Economics and Econometrics;Strategy and Management,0.221,0.182,1.2,1.1,24,125,13,0.0,25,127,18,0.0,13,114,13,0.0
Arthaniti: Journal of Economic Theory and Practice,SAGE Publications Ltd,journal,ECON,"Economics, Econometrics and Finance (all)",1.177,0.373,2.6,2.4,11,61,4,0.0,12,78,4,0.0,11,65,8,0.0
Asia Pacific Journal of Management,Springer New York,journal,ECON;BUSI,"Economics, Econometrics and Finance (miscellaneous);Strategy and Management;Business and International Management",1.985,1.640,11.0,9.7,67,4532,5,1.49,119,5145,23,0.0,83,5128,44,0.0
Asia and the Pacific Policy Studies,John Wiley and Sons Ltd,journal,ECON;BUSI;SOCI,"Political Science and International Relations;Strategy and Management;Public Administration;Economics, Econometrics and Finance (miscellaneous);Sociology and Political Science",0.8,0.316,2.5,3.2,26,676,8,0.0,4,674,1,0.0,19,538,15,0.0
Asia-Pacific Economic History Review,John Wiley and Sons Inc,journal,ECON;ARTS,History;Economics and Econometrics,0.74,0.243,1.0,1.0,17,125,9,5.88,19,175,15,0.0,21,168,21,0.0
Asia-Pacific Financial Markets,Springer New York,journal,ECON,Finance,0.594,0.339,4.1,3.0,28,350,4,0.0,48,408,16,0.0,84,456,60,0.0
Asia-Pacific Journal of Accounting and Economics,Taylor and Francis Ltd.,journal,ECON;BUSI,Finance;Economics and Econometrics;Accounting,0.679,0.318,3.0,2.4,88,606,19,0.0,98,795,36,0.0,76,1004,50,0.0
Asia-Pacific Journal of Financial Studies,John Wiley and Sons Ltd,journal,ECON,Finance,0.754,0.526,2.4,2.6,34,505,12,0.0,32,614,17,0.0,25,704,22,0.0
Asia-Pacific Journal of Regional Science,Springer Science and Business Media Deutschland GmbH,journal,ECON;SOCI;ENER,"Renewable Energy, Sustainability and the Environment;Economics, Econometrics and Finance (miscellaneous);Urban Studies;Development",0.587,0.368,3.8,3.1,50,255,12,0.0,55,368,17,0.0,38,450,34,0.0
Asia-Pacific Review,Routledge,journal,ECON;ARTS;SOCI,History;Political Science and International Relations;Economics and Econometrics,0.188,0.125,0.4,0.5,23,168,11,0.0,24,181,20,20.83,11,154,11,9.09
Asia-Pacific Social Science Review,De la Salle University,journal,ECON;ARTS;SOCI,History;Sociology and Political Science;Economics and Econometrics;Political Science and International Relations,0.386,0.220,1.5,1.4,48,233,25,0.0,31,288,22,0.0,17,296,16,0.0
Asian Academy of Management Journal of Accounting and Finance,Universiti Sains Malaysia,journal,ECON;BUSI,Finance;Accounting,0.57,0.240,1.4,1.5,21,240,11,0.0,20,246,14,0.0,10,259,9,0.0
Asian Affairs,Taylor and Francis Ltd.,journal,ECON;SOCI,"Political Science and International Relations;Sociology and Political Science;Economics, Econometrics and Finance (all)",0,0.145,1.5,1.1,9,130,2,0.0,14,145,8,0.0,12,124,11,0.0
Asian Affairs,Routledge,journal,ECON;SOCI,"Political Science and International Relations;Law;Geography, Planning and Development;Economics and Econometrics",2.224,0.230,1.7,1.7,45,316,20,0.0,35,416,20,0.0,13,348,13,0.0
Asian Development Policy Review,Asian Economic and Social Society,journal,ECON;SOCI;ENVI,"Management, Monitoring, Policy and Law;Sociology and Political Science;Economics, Econometrics and Finance (all);Development",0.267,0.146,1.1,0.9,19,29,8,0.0,17,55,5,5.88,25,64,23,0.0
Asian Development Review,World Scientific,journal,ECON;SOCI,"Geography, Planning and Development;Economics and Econometrics;Development",1.001,0.525,2.3,2.3,18,415,4,0.0,23,481,11,0.0,26,458,23,0.0
Asian Economic Journal,Wiley-Blackwell Publishing Ltd,journal,ECON;SOCI,"Geography, Planning and Development;Economics and Econometrics;Development",0.686,0.284,1.3,1.5,20,482,7,0.0,20,479,13,0.0,16,432,15,0.0
Asian Economic Papers,MIT Press Journals,journal,ECON;SOCI,Political Science and International Relations;Finance;Economics and Econometrics,1.208,0.800,9.0,7.5,16,493,1,0.0,17,466,8,0.0,22,422,18,0.0
Asian Economic Policy Review,Wiley-Blackwell Publishing Ltd,journal,ECON;SOCI;ENVI,"Political Science and International Relations;Management, Monitoring, Policy and Law;Economics, Econometrics and Finance (all)",2.353,1.512,14.1,12.9,37,390,17,32.43,34,547,24,29.41,53,587,45,33.96
Asian Economic and Financial Review,Asian Economic and Social Society,journal,ECON;BUSI;SOCI,"Business, Management and Accounting (all);Economics, Econometrics and Finance (all);Development",0.45,0.204,2.2,1.8,70,412,22,2.86,70,546,34,4.29,46,770,40,0.0
Asian Journal of Business Ethics,Springer Science and Business Media B.V.,journal,ARTS;BUSI;SOCI;ECON,"Social Sciences (miscellaneous);Business, Management and Accounting (all);Philosophy;Economics, Econometrics and Finance (miscellaneous)",0.482,0.369,4.2,2.6,20,179,2,0.0,23,276,5,0.0,36,463,31,0.0
Asian Journal of Economic Modelling,Asian Economic and Social Society,journal,ECON;SOCI,"Economics, Econometrics and Finance (miscellaneous);Economics and Econometrics;Development",0.363,0.169,1.3,1.2,18,22,5,5.56,11,56,5,0.0,13,56,8,0.0
Asian Journal of Law and Economics,Walter de Gruyter GmbH,journal,ECON;SOCI,"Economics, Econometrics and Finance (miscellaneous);Law",0.608,0.312,0.9,1.1,17,52,10,5.88,15,72,11,0.0,19,66,16,0.0
Asian Journal of Technology Innovation,Routledge,journal,ECON;BUSI,Management of Technology and Innovation;Economics and Econometrics,0.997,0.677,4.5,4.3,33,493,4,0.0,35,629,10,0.0,56,755,34,0.0
Asian Journal of WTO and International Health Law and Policy,National Taiwan University (IEEB),journal,ECON;SOCI;MEDI,"Political Science and International Relations;Public Health, Environmental and Occupational Health;Economics and Econometrics;Law;Health (social science)",0.199,0.123,0.6,0.9,16,51,11,0.0,12,46,9,0.0,9,44,8,0.0
Asian Review of Accounting,Emerald Group Publishing Ltd.,journal,ECON;BUSI,Finance;Accounting,1.148,0.408,3.8,3.2,30,716,5,0.0,36,920,9,0.0,50,1003,28,2.0
Asian Review of Financial Research,Korean Finance Association,journal,ECON,Finance,0.266,0.143,0.3,0.5,18,7,13,5.56,16,9,15,0.0,8,8,8,0.0
Asian-Pacific Economic Literature,Wiley-Blackwell Publishing Ltd,journal,ECON;SOCI,"Geography, Planning and Development;Economics and Econometrics;Development",0.638,0.294,1.9,1.7,15,253,3,0.0,14,296,10,7.14,25,250,24,0.0
Atlantic Economic Journal,Springer Netherlands,journal,ECON,"Economics, Econometrics and Finance (all)",0.425,0.219,0.9,1.3,17,533,13,0.0,29,523,20,0.0,18,470,18,0.0
Auditing,American Accounting Association,journal,ECON;BUSI,Finance;Economics and Econometrics;Accounting,2.075,1.875,4.2,4.3,32,3760,2,0.0,34,4251,9,0.0,25,4271,17,0.0
"Australasian Accounting, Business and Finance Journal",University of Wollongong,journal,ECON;BUSI,"Business, Management and Accounting (all);Finance",0.775,0.391,4.2,3.9,61,494,20,0.0,59,664,36,0.0,41,881,34,2.44
